fecha;pagina;id_aviso;fecha_primera_vista;dias_desde_primera_vista;nueva_publicacion;publicado_zonaprop_raw;fecha_publicacion_zonaprop;antiguedad_zonaprop_dias;barrio;direccion;precio_raw;moneda;expensas;m2;ambientes;dormitorios;banos;precio_m2;mascotas;balcon;cochera;terraza;pileta;parrilla;luminoso;url;imagen;texto
2026-07-06;5;59417022;2026-06-23;13;False;;;;Caballito;"Victor Martinez al 300 Caballito, Capital Federal Ubicado en el prestigioso &quot;Barrio Inglés&quot; de Caballito, este";$ 1.700.000;ARS;500000.0;102;4;2;3;16667;False;True;True;False;False;False;True;https://www.zonaprop.com.ar/propiedades/clasificado/alclapin-caballito-zna.-barrio-ingles-p.-goyena-v.-59417022.html?n_src=Listado&n_pills=Terraza&n_pg=5&n_pos=4;;"$ 1.700.000 $ 500.000 Expensas 102 m² tot. 4 amb. 2 dorm. 3 baños Victor Martinez al 300 Caballito, Capital Federal Ubicado en el prestigioso &quot;Barrio Inglés&quot; de Caballito, este departamento de 4 ambientes con dependencia ofrece una combinación perfecta de espacio, comodidad y ubicación privilegiada. Con una superficie cubierta de 102 m2, este luminoso piso ha sido recientemente reciclado, proporcionando un ambiente moderno y acogedor. El amplio living de 4. 50 x 6. 20 m se abre hacia un balcón al frente de 8 x 1. 20 m, ideal para disfrutar del aire libre. El dormitorio principal, con placard, tiene vistas al frente y mide 3. 50 x 3. 50 m. Los otros dos dormitorios son de 3. 20 x 3. 20 m y 2. 80 x 3. 00 m respectivamente, ofreciendo espacio suficiente para toda la familia. La propiedad cuenta con un total de 3 baños, asegurando la comodidad de todos los residentes. La cocina y el lavadero han sido renovados a nuevo, ofreciendo instalaciones modernas. Además, cuenta con una baulera que proporciona espacio de almacenamiento adicional. Aunque no tiene cochera, el acceso al transporte público en Caballito es excelente, facilitando la movilidad en la ciudad. El edificio, de 60 años de antigüedad, cuenta con un ascensor y un palier privado, asegurando privacidad y comodidad. Los servicios incluyen agua corriente, cloacas, gas natural, electricidad y alumbrado público, garantizando un estilo de vida cómodo y moderno. Las medidas, superficies y proporciones consignadas en esta ficha son aproximadas y solo se muestran a titulo informativo. - WhatsApp Contactar"
2026-07-06;5;45866075;2026-06-23;13;False;;;;Caballito;"Senillosa 12 Caballito, Capital Federal Ubicacion. Senillosa N°12 - Piso 10° - a 10 metros de Av. Rivadavia; a 100 metros de subte estación Río de Janeiro, y de Av. La Plata, a 200 metros del parque Rivadavia. Y cochera a 200m. estado del inmueble. Se entrega recién pintado con los pisos de roble conservados en su plastificado. Caracteristicas y orientacion. Todo luz y sol! Con balcon corrido al frente. Orientacion so y ne en su contrafrente. Edificio señorial con seguridad las 24 hs y grupo electrógeno. Comodidades: Pallier de ingreso semi-privado y entrada de servicio. Amplio Living comedor de 7, 15 x 3, 00 metros, con salida al balcón 4, 60 por 1, 20 metros. - Toilette con ducha. Cocina comedor de 4, 45 x 2, 20 metros, conectado a amplio lavadero de 1, 90 x 1, 30 metros con conexión y ténder de techo. A este lavadero se ingresa por la puerta de servicio, por donde se puede acceder a las escaleras y ascensor de servicio. - Dormitorio principal de 4, 00 x 2, 90 metros más amplio placard de pared, todos, muy bien provistos internamente con cajoneras y estantes. Segundo dormitorio de 3, 55 x 2, 90 metros más amplio placard. - Tercer dormitorio de 3, 60 x 2, 00 metros con placard incluido. - Baño principal a nuevo- Segundo baño y cocina ""Vintage"" Servio de agua caliente individual - calefacción por expensas- no se aceptan mascotas. Expensas: . - incluye losa radiante- abl. Aysa: Condiciones:";$ 1.500.000;ARS;390000.0;90;4;3;1;16667;False;True;True;False;False;False;False;https://www.zonaprop.com.ar/propiedades/clasificado/alclapin-caballito-4-amb-piso-10-bcon-corrido-fte-coch-45866075.html?n_src=Listado&n_pills=Lavadero&n_pg=5&n_pos=5;;"$ 1.500.000 $ 390.000 Expensas 90 m² tot. 4 amb. 3 dorm. 1 baño 1 coch. Senillosa 12 Caballito, Capital Federal Ubicacion. Senillosa N°12 - Piso 10° - a 10 metros de Av. Rivadavia; a 100 metros de subte estación Río de Janeiro, y de Av. La Plata, a 200 metros del parque Rivadavia. Y cochera a 200m. estado del inmueble. Se entrega recién pintado con los pisos de roble conservados en su plastificado. Caracteristicas y orientacion. Todo luz y sol! Con balcon corrido al frente. Orientacion so y ne en su contrafrente. Edificio señorial con seguridad las 24 hs y grupo electrógeno. Comodidades: Pallier de ingreso semi-privado y entrada de servicio. Amplio Living comedor de 7, 15 x 3, 00 metros, con salida al balcón 4, 60 por 1, 20 metros. - Toilette con ducha. Cocina comedor de 4, 45 x 2, 20 metros, conectado a amplio lavadero de 1, 90 x 1, 30 metros con conexión y ténder de techo. A este lavadero se ingresa por la puerta de servicio, por donde se puede acceder a las escaleras y ascensor de servicio. - Dormitorio principal de 4, 00 x 2, 90 metros más amplio placard de pared, todos, muy bien provistos internamente con cajoneras y estantes. Segundo dormitorio de 3, 55 x 2, 90 metros más amplio placard. - Tercer dormitorio de 3, 60 x 2, 00 metros con placard incluido. - Baño principal a nuevo- Segundo baño y cocina ""Vintage"" Servio de agua caliente individual - calefacción por expensas- no se aceptan mascotas. Expensas: . - incluye losa radiante- abl. Aysa: Condiciones: Alquiler inicial $. - con ajuste cuatrimestral por icl. Depósito: Ingresos demostrables. Garante de Capital - Prov si es fliar + Gastos de informes y certificación del garante. ó Seguro de Finaer-Premiun WhatsApp Contactar"
2026-07-06;5;59492302;2026-07-02;4;True;;;;Caballito;Del Barco Centenera 345 Primera Junta, Caballito 4 ambientes reciclado A nuevo con balcón Y vista abierta - piso 17 - caballito. excelente;$ 1.300.000;ARS;200000.0;67;4;3;1;19403;False;True;True;False;False;False;True;https://www.zonaprop.com.ar/propiedades/clasificado/alclappa-4-amb-3-dorm-2-banos-reciclado-a-nuevo-balcon-59492302.html?n_src=Listado&n_pills=Lavadero&n_pg=5&n_pos=8;;$ 1.300.000 $ 200.000 Expensas 67 m² tot. 4 amb. 3 dorm. 1 baño Del Barco Centenera 345 Primera Junta, Caballito 4 ambientes reciclado A nuevo con balcón Y vista abierta - piso 17 - caballito. excelente departamento de 4 ambientes con 3 dormitorios, ubicado en del barco centenera 345 - caballito. Torre de categoria con seguridad. A media cuadra de avda. Juan B alberdi, 2 cuadras de avda pedro goyena, 2 cuadras del subte A, fácil acceso A transporte público, bares Y restaurantes. La unidad se encuentra en un piso 17, con excelente luminosidad Y vista abierta, ubicada al contrafrente con balcón, brindando tranquilidad Y nada de ruido. Cuenta con: -amplio living comedor con salida al balcón. - balcón enrejado. - 3 dormitorios cómodos Y luminosos. - 1 baño completo con bañera. - 1 toilete. - cocina totalmente renovada. - lavadero independiente. - expensas $200. 000 aprox. - superficie 67 m2 aprox. Departamento totalmente reciclado A nuevo, incluyendo instalaciones, cañerias Y desagues. -se entrega con todas las luces instaladas. excelente distribución Y ambientes aprovechables. el edificio cuenta con 2 encargados (1 permanente), 3 ascensores, grupo electrógeno para funcionamiento de ascensores, seguridad mediante totem, ingreso electrónico visor, excelente mantenimiento general (recien pintado). Opcional: cochera disponible en el edificio (no incluida en el valor del alquiler) ideal para familias que buscan comodidad, excelente ubicación Y un departamento listo para entrar A vivir. Contactar
2026-07-06;5;59282616;2026-06-23;13;False;;;;La Paternal;Av San Martin 2100 La Paternal, Capital Federal Ph piso unico 4 ambientes C/ balcon corrido Y terraza propia. comodidades. living comedor 8. 00 X 3. 50. cocina 3. 50 X 3. 00. Lavadero independiente. 1° dorm 3. 50 X 3. 50 com placard. 2° dorm 3. 50 X 2. 60 con placard. habitacion de servicio con baño. baño instalado completo. balcon 8. 00 X 1. 00. terraza total con lavadero/ parrilla.. Detalles. agua caliente por termotanque. cocina equipada con mueble bajo mesada, alacena colgante. mesada de granito revestimientos de azulejos. living comedor Y dormitorios piso de parquet. resto mosaico granitico muy buen estado.;$ 1.550.000;ARS;;100;4;3;2;15500;False;True;False;True;False;True;False;https://www.zonaprop.com.ar/propiedades/clasificado/alclphin-ph-piso-unico-4-amb.-c-balcon-y-terraza-prop.-59282616.html?n_src=Listado&n_pills=Terraza&n_pg=5&n_pos=10;;$ 1.550.000 8% 100 m² tot. 4 amb. 3 dorm. 2 baños Av San Martin 2100 La Paternal, Capital Federal Ph piso unico 4 ambientes C/ balcon corrido Y terraza propia. comodidades. living comedor 8. 00 X 3. 50. cocina 3. 50 X 3. 00. Lavadero independiente. 1° dorm 3. 50 X 3. 50 com placard. 2° dorm 3. 50 X 2. 60 con placard. habitacion de servicio con baño. baño instalado completo. balcon 8. 00 X 1. 00. terraza total con lavadero/ parrilla.. Detalles. agua caliente por termotanque. cocina equipada con mueble bajo mesada, alacena colgante. mesada de granito revestimientos de azulejos. living comedor Y dormitorios piso de parquet. resto mosaico granitico muy buen estado. alquiler: 1° trimestre: $1. 550. 000. - deposito: U$ 1. 500. - requisitos: garantia propietaria A satisfaccion del propietario comprobantes de ingreso justificados gastos de luz - gas - Aysa A cargo del locatario. Las medidas, superficies y detalles consignados en el presente folleto son aproximados y a los solos efectos orientativos. Las medidas originales surgirán del título de propiedad respectivo WhatsApp Contactar
2026-07-06;5;59288951;2026-06-23;13;False;;;;Caballito;Senillosa 356 Parque Rivadavia, Caballito;$ 1.700.000;ARS;343000.0;95;4;3;2;17895;True;True;True;False;False;False;False;https://www.zonaprop.com.ar/propiedades/clasificado/alclapin-senillosa-y-gayaquil-2do-piso-frente-balcon-4-c-dep-2-59288951.html?n_src=Listado&n_pills=Permite+mascotas&n_pg=5&n_pos=11;;$ 1.700.000 $ 343.000 Expensas 95 m² tot. 4 amb. 3 dorm. 2 baños Senillosa 356 Parque Rivadavia, Caballito Departamento en venta ubicado en Parque Rivadavia, ideal para familias. Cuenta con 3 habitaciones y 2 baños, ofreciendo comodidad y funcionalidad. La propiedad posee una superficie construida de 88 m² y 95 m² totales. Dispone de living comedor, cocina equipada y lavadero independiente. Además, cuenta con balcón al frente, lo que proporciona buena iluminación natural. El edificio tiene 8 pisos y 2 departamentos por piso, con ascensor y encargado. Entre las comodidades, se incluyen aire acondicionado, calefacción y caldera individual. Permite mascotas. La cochera es cubierta 2. El departamento cuenta con un dormitorio en suite y vestidor. La zona de Parque Rivadavia es residencial y ofrece cercanía a diversos servicios. Se encuentra próximo a supermercados, farmacias y centros de salud. Además, cuenta con fácil acceso a transporte público, como colectivos. El entorno es tranquilo y familiar, ideal para quienes buscan un lugar apacible para vivir. WhatsApp Contactar
2026-07-06;5;50168343;2026-06-23;13;False;;;;Caballito;ROSARIO 758 Caballito Norte, Caballito Semipiso,;$ 1.000.000;ARS;300000.0;91;4;3;2;10989;False;True;False;False;False;False;True;https://www.zonaprop.com.ar/propiedades/clasificado/alclapin-caballito:venta-o-alquiler-3-ambientes-c-dependencia-50168343.html?n_src=Listado&n_pills=Aire+acondicionado&n_pg=5&n_pos=12;;"$ 1.000.000 $ 300.000 Expensas 91 m² tot. 4 amb. 3 dorm. 2 baños ROSARIO 758 Caballito Norte, Caballito Semipiso, excelente dto muy luminoso, A mts de av rivadavia Y san jose de calasanz, al frente con balcon corrido, 3 baños, calefaccion central, muy confortable pleno centro comercial. Mat; 5370 cucicba. Contactar"
2026-07-06;5;59261829;2026-06-23;13;False;;;;Villa del Parque;Av Beiro al 3500 Villa del Parque, Capital Federal Hermoso;$ 1.300.000;ARS;250000.0;80;4;2;1;16250;False;True;False;False;False;False;False;https://www.zonaprop.com.ar/propiedades/clasificado/alclapin-departamento-de-3-ambientes-con-dependencia-59261829.html?n_src=Listado&n_pills=Lavadero&n_pg=5&n_pos=14;;"$ 1.300.000 $ 250.000 Expensas 80 m² tot. 4 amb. 2 dorm. 1 baño Av Beiro al 3500 Villa del Parque, Capital Federal Hermoso departamento al frente de tres ambientes con dependencia de servicioLiving comedor con pisos de parquet y salida a balcon corrido al frenteCocina independiente, comedor diarioDependencia de servicio con baño Dos dormitorios con placard empotrado y pisos de maderaBaño completo con bañera y toilette de recepcionRequisitosGarantia propietaria caba o Provincia. Seguro de Caucion FinaerIngresos comprobables propiosNo se aceptan mascotascucicba Mat 7831 / cucicba Mat 8020&quot;Se encuentra prohibido cobrar comisiones inmobiliarias y gastos de gestoría de informes a los inquilinos que sean personas físicas. Para los casos de alquiler de vivienda, el monto máximo de comisión que se le puede requerir a los propietarios será el equivalente al cuatro con quince centésimos por ciento (4, 15%) del valor total del respectivo contrato&quot;. - (art. 5, Ley 5859). Cumple con la ley de accesibilidad (art. 10 inc. 8 de la ley 2340) -La publicación de este inmueble es a título informativo, la venta de la propiedad está supeditada a que el propietario cumplimente el trámite ante la afip para la obtención del número de coti correspondiente. En cumplimiento de la leyes provinciales vigentes que regulan el corretaje inmobiliario, Ley Nacional 25. 028, Ley 22. 802 de Lealtad Comercial, Ley 24. 240 de Defensa al Consumidor, las normas del Código Civil y Comercial de la Nación y Constitucionales, los agentes/gestores no ejercen el corretaje inmobiliario, todas las operaciones inmobiliarias son concluidas por el martillero/corredor colegiado, cuyos datos se exhiben a continuación: Martilleras Responsables: María Virginia Zandueta cucicba Mat 7831 / cmcpsi 7066 y Sabrina Aldana Enrique cucicba Mat 8020 / cmcpsi 6814 WhatsApp Contactar"
2026-07-06;5;58677668;2026-06-23;13;False;;;;Floresta;Moreto 74 Floresta, Capital Federal;$ 1.200.000;ARS;170000.0;74;4;3;2;16216;False;True;True;True;False;True;True;https://www.zonaprop.com.ar/propiedades/clasificado/alclapin-departamento-4-ambientes-a-la-calle-con-balcon.-58677668.html?n_src=Listado&n_pills=Terraza&n_pg=5&n_pos=15;;"$ 1.200.000 $ 170.000 Expensas 74 m² tot. 4 amb. 3 dorm. 2 baños Moreto 74 Floresta, Capital Federal Departamento 4 ambientes al frente con amplio balcon. todo luz Y sol. se ingresa A un living comedor con amplio balcon- cocina independiente luminosa Y lugar para lavarropas. hall de distribucion, 3 dormitorios Y 1 baño completo Y toilette con ducha. Excelente luz Y vista abierta en todos los ambientes. Sum Y terraza con parrilla en el edificio. Entrada con rampa. Ubicado en la mejor zona de floresta, residencial tranquila Y. con todo cerca. - A metros de av. Rivadavia con varias lineas de colectivos. Cochera opcional! Consultar. Condiciones para alquiler: Alquiler mensual $ 1. 200. 000, los tres primeros meses, luego incremento trimestral por ipc acumulativo. Mas Expensas ordinarias incluye Aysa, abl, y servicios. Contrato por 24 meses. Justificación de ingresos, garantía propietaria. No se aceptan mascotas. Art. 4 de la Ley 5. 859 de C. A. B. A. ""Para los casos de alquiler de vivienda única, el monto máximo de comisión que se le puede requerir a los propietarios será el equivalente al cuatro con quince centésimos por ciento (4, 15%) del valor total del respectivo contrato. Se encuentra prohibido cobrar a los inquilinos que sean personas físicas comisiones inmobiliarias cuando el destino sea vivienda única y permanente "". - La información contenida en el presente aviso es meramente a titulo estimativo y no forma parte de ningún tipo de documentación contractual. Las medidas y superficies definitivas surgirán del título de propiedad del inmueble referido. Para mayor información comunícarse al Ver datos ( whatsapp). Demarco Operaciones Inmobiliarias. WhatsApp Contactar"
2026-07-06;5;59512235;2026-07-01;5;True;;;;Caballito;Viel 200 Caballito, Capital Federal Corredor Responsable: Hernan Perrone cucicba 2792 / mgr 170- Contacto: Gonzalo Grau. excepcional;$ 1.450.000;ARS;350000.0;96;4;3;1;15104;False;True;False;False;False;False;False;https://www.zonaprop.com.ar/propiedades/clasificado/alclapin-alquiler-4-ambientes-caballito-con-balcon-y-dep.-59512235.html?n_src=Listado&n_pills=Encargado&n_pg=5&n_pos=19;;$ 1.450.000 $ 350.000 Expensas 96 m² tot. 4 amb. 3 dorm. 1 baño Viel 200 Caballito, Capital Federal Corredor Responsable: Hernan Perrone cucicba 2792 / mgr 170- Contacto: Gonzalo Grau. excepcional departamento de 4 ambientes con dependencia Y balcón corrido en caballito. El equipo re/max presenta en alquiler este magnífico departamento de 4 ambientes con dependencia, reciclado a nuevo, ubicado sobre la calle Viel al 200, en el barrio de Caballito, a tan solo media cuadra del Parque Rivadavia. A 2 cuadras de Av. José María Moreno, a 2 de Av. Rivadavia, Av. La Plata y a 3 de Av. Directorio. Destacando Viel como cuadra tranquila, ya que en ella no transitan colectivos. Situado en el segundo piso, al frente, esta unidad se destaca por su gran luminosidad y una excelente distribución de los ambientes. Características de la propiedad: • Tres dormitorios con amplios placares y pisos de parquet. • Living-comedor con pisos de parquet y acceso al balcón corrido. • Cocina independiente con comedor diario, de generosas dimensiones. • Baño completo y toilette. • Dependencia de servicio con baño propio. • Lavadero independiente. Detalles del edificio: • Antigüedad: 39 años. • Ascensor. • Encargado. Excelente conectividad: Rodeado de múltiples opciones de transporte público: • Colectivos: 2, 5, 8, 15, 25, 26, 36, 42, 53, 55, 56, 65, 84, 85, 86, 88, 96, 103, 104, 119, 132, 135, 141, 172, 180, 181. • Subte: Línea A (Estación Acoyte). ¿por qué elegir este departamento? Su ubicación estratégica, amplitud y luminosidad, esta propiedad es ideal para quienes buscan confort y calidad de vida en una de las zonas más buscadas de Caballito. Requisitos para el alquiler: • Garante familiar directo con garantía propietaria en caba. • Ingresos comprobables. • Un mes de adelanto y depósito de garantía (en dólares). • No acepta mascotas. ¡Contáctenos, estamos para asesorarle! Con gusto coordinaremos una visita. Rau S. R. L. No ejerce el corretaje inmobiliario. El presente sitio web es una plataforma en donde cada oficina inmobiliaria independiente que contrata los servicios re/max puede publicar las propiedades a su cargo. Cada oficina es de propiedad y gestión independiente, por lo que rau S. R. L. No interviene en los datos de la publicación, en la operación inmobiliaria, ni en la confección y/o firma del boleto de compraventa y/o escritura y/o contrato de alquiler. En cumplimiento de las leyes vigentes que regulan el corretaje inmobiliario, Ley Nacional 25. 028, Ley 22. 802 de Lealtad Comercial, Ley 24. 240 de Defensa al Consumidor, las normas del Código Civil y Comercial de la Nación y Constitucionales, los agentes/gestores no ejercen el corretaje inmobiliario. Todas las operaciones inmobiliarias son objeto de intermediación y conclusión por parte del corredor público inmobiliario colegiado a cargo de la publicación, cuyos datos se exhiben en la presente. La presente publicación describe las características esenciales del inmueble, debiéndose consultar al corredor público inmobiliario responsable de la operación por la eventual actualización de las medidas, descripciones arquitectónicas y funcionales, valores de expensas, servicios, impuestos, precios y demás información, cuyos valores son aproximados. Para los casos de alquiler de vivienda, el monto máximo de comisión que se le puede requerir a los propietarios será el equivalente al cuatro con quince centésimos por ciento (4, 15%) del valor total del respectivo contrato. Se encuentra prohibido cobrar a los inquilinos que sean personas físicas comisiones inmobiliarias y gastos de gestoría de informes. El inmueble no es accesible para personas con discapacidades físicas. Contactar
2026-07-06;5;58677063;2026-06-23;13;False;;;;Villa del Parque;Álvarez Jonte 2909 Villa del Parque, Capital Federal;$ 1.290.000;ARS;300000.0;110;4;3;1;11727;False;False;False;False;False;False;True;https://www.zonaprop.com.ar/propiedades/clasificado/alclapin-alvarez-jonte-2900-depto-4-ambientes-mas-dependencia-58677063.html?n_src=Listado&n_pills=Lavadero&n_pg=5&n_pos=20;;$ 1.290.000 $ 300.000 Expensas 110 m² tot. 4 amb. 3 dorm. 1 baño Álvarez Jonte 2909 Villa del Parque, Capital Federal Departamento 4 ambientes con dependencia, cocina con comedor diario, Gran living en L con vista al frente, orientación este, muy luminoso, 1 baño completo, 1 toilette y 1 baño de servicio, lavadero. Entrada de servicio. Excelente ubicación, av nazca y alvarez jonte. Requisitos: -D1. 000 de deposito. -Garantia propietaria de caba, o seguro de caucion respaldar. -Aumento cuatrimestral por indice ipc. -Ingresos demostrables. -Grupo familiar acorde a la unidad. -Seguro contra incendio. -No acepta mascotas. -Comisión a cargo de los propietarios. Para los casos de alquiler de vivienda, el monto máximo de comisión que se le puede requerir a los propietarios será el equivalente al cuatro con quince centésimos por ciento (4, 15%) del valor total del respectivo contrato. Se encuentra prohibido cobrar a los inquilinos que sean personas físicas comisiones inmobiliarias y gastos de gestoría de informes. Matricula Nº 1589. WhatsApp Contactar
2026-07-06;5;59504932;2026-07-01;5;True;;;;Flores;Av Nazca al 400 Flores, Capital Federal Excelente;$ 900.000;ARS;296000.0;123;4;3;3;7317;False;True;False;False;False;False;False;https://www.zonaprop.com.ar/propiedades/clasificado/alclapin-departamento-en-flores-59504932.html?n_src=Listado&n_pg=5&n_pos=21;;$ 900.000 $ 296.000 Expensas 123 m² tot. 4 amb. 3 dorm. 3 baños Av Nazca al 400 Flores, Capital Federal Excelente departamento de 120 m² en alquiler, ubicado en la mejor zona comercial de Flores, sobre la esquina de Nazca y Avellaneda. La propiedad cuenta con cuatro ambientes, tres baños y dos balcones, uno con frente a Nazca y otro sobre Avellaneda, lo que le brinda una excelente luminosidad y ventilación. El departamento se encuentra en buen estado general. Requiere algunos trabajos de pintura, pero no presenta problemas de humedad. Sus amplios ambientes y su ubicación privilegiada lo convierten en una excelente opción para vivienda. Contrato a 24 meses con actualización trimestral por ipc. Se acepta seguro de caución. Venga a visitarlo. cucicba 142Diro PropiedadesAgente Raúl Maleh WhatsApp Contactar
2026-07-06;5;59018080;2026-06-23;13;False;;;;Villa Devoto;Allende 3600 Villa Devoto, Capital Federal Semipiso 4 ambientes al frente con balcon. Cochera fija cubierta (auto chico) en planta baja con portón individual. Todos los ambientes principales dan a la calle super luminoso, incluso la cocina es luminosa y cómoda ya que entra una mesa y sillas. Lavadero separado cubierto. Excelente ubicación, 1 cuadra Av Beiro, 4 cuadras Colegio Devoto School y del Devoto Shopping. Mat cucicba N° 20. Mat cmcpsm N° 2332. Socio cia N° 601. Art. 4 ley 5859 caba, Para los casos de;$ 1.500.000;ARS;300000.0;80;4;3;2;18750;False;True;True;False;False;False;True;https://www.zonaprop.com.ar/propiedades/clasificado/alclapin-departamento-4-ambientes-con-cochera-59018080.html?n_src=Listado&n_pills=Lavadero&n_pg=5&n_pos=22;;$ 1.500.000 $ 300.000 Expensas 80 m² tot. 4 amb. 3 dorm. 2 baños 1 coch. Allende 3600 Villa Devoto, Capital Federal Semipiso 4 ambientes al frente con balcon. Cochera fija cubierta (auto chico) en planta baja con portón individual. Todos los ambientes principales dan a la calle super luminoso, incluso la cocina es luminosa y cómoda ya que entra una mesa y sillas. Lavadero separado cubierto. Excelente ubicación, 1 cuadra Av Beiro, 4 cuadras Colegio Devoto School y del Devoto Shopping. Mat cucicba N° 20. Mat cmcpsm N° 2332. Socio cia N° 601. Art. 4 ley 5859 caba, Para los casos de alquiler de vivienda, el monto máximo de honorarios que se le puede requerir a los propietarios será el equivalente al cuatro con quince centésimos por ciento (4, 15%) del valor total del respectivo contrato. Se encuentra prohibido cobrar a los inquilinos que sean personas físicas comisiones inmobiliarias y gastos de gestoría de informes. Ley 5115, inmueble apto/no apto para personas con movilidad reducida. Las medidas y superficies son aproximadas y a solo efecto orientativo, las reales surgirán del respectivo título, plano mh registrado o Reglamento de Copropiedad y/o estado parcelario de cada inmueble proporcionados por el propietario. Fotos de caracter no contractual. Todos los valores y expensas pueden ser modificados sin previo aviso. WhatsApp Contactar
