fecha;pagina;id_aviso;fecha_primera_vista;dias_desde_primera_vista;nueva_publicacion;publicado_zonaprop_raw;fecha_publicacion_zonaprop;antiguedad_zonaprop_dias;barrio;direccion;precio_raw;moneda;expensas;m2;ambientes;dormitorios;banos;precio_m2;mascotas;balcon;cochera;terraza;pileta;parrilla;luminoso;url;imagen;texto
2026-07-06;3;59462529;2026-06-25;11;False;;;;Flores;Avenida Varela 800 Flores, Capital Federal Corredor Responsable: Sebastián Morales – cmcpsi 7280. - Contacto: Diego Prelog.;$ 1.500.000;ARS;200000.0;78;4;3;1;19231;True;True;True;False;False;False;False;https://www.zonaprop.com.ar/propiedades/clasificado/alclapin-alquiler-departamento-4-ambientes-cochera-flores-59462529.html?n_src=Listado&n_pills=Encargado&n_pg=3&n_pos=19;;"$ 1.500.000 $ 200.000 Expensas 78 m² tot. 4 amb. 3 dorm. 1 baño 1 coch. Avenida Varela 800 Flores, Capital Federal Corredor Responsable: Sebastián Morales – cmcpsi 7280. - Contacto: Diego Prelog. departamento 4 ambientes con cochera descubierta en piso 9 en alquiler - flores - capital federal. Departamento de 78 m² ubicado sobre Avenida Varela en el barrio de Flores, emplazado en el noveno piso de un edificio de 10 niveles construido en 1994. Excelente ubicación con acceso inmediato a la autopista 25 de Mayo, estación de subte, múltiples líneas de colectivo y Avenida Directorio. La propiedad mantiene su estructura original en muy buen estado de conservación, distribuida en 4 ambientes con tres dormitorios, un baño completo, toilette, cocina separada y living/comedor con balcón de orientación este. Los pisos de madera en habitaciones se complementan con placard en cada dormitorio y otro adicional en el living. El edificio cuenta con dos ascensores, representando un valor agregado para los residentes. La disposición frente permite una óptima iluminación natural. Entre sus características destacan aire acondicionado, servicios completos de electricidad, agua, gas y desagüe cloacal. Incluye cochera, elemento diferencial para quienes valoran estacionamiento propio en zona céntrica. Vista panorámica 180°. Expensas: incluyen Agua (aysa) y expensas de cochera (descubierta). Encargado con vivienda en el edificio. Condiciones de alquiler: - Plazo contractual: 2 años. - Un mes de adelanto. - Depósito de 1 mes en dólares. - Ajuste por ipc trimestral. - Ingresos demostrables. - Garantía: seguro de caución. A una cuadra de estación \""Varela\"" de subte línea E, 8 cuadras de plaza Flores y estación \""San José de Flores\"" de subte línea A. A 3 cuadras de importante centro comercial, supermercados y otros negocios de cercanía en el radio de 1 cuadra. Zona y cuadra del edificio con vigilancia policial las 24 hs. Importante: !! No se admiten mascotas! Rau S. R. L. No ejerce el corretaje inmobiliario. El presente sitio web es una plataforma en donde cada oficina inmobiliaria independiente que contrata los servicios re/max puede publicar las propiedades a su cargo. Cada oficina es de propiedad y gestión independiente, por lo que rau S. R. L. No interviene en los datos de la publicación, en la operación inmobiliaria, ni en la confección y/o firma del boleto de compraventa y/o escritura y/o contrato de alquiler. En cumplimiento de las leyes vigentes que regulan el corretaje inmobiliario, Ley Nacional 25. 028, Ley 22. 802 de Lealtad Comercial, Ley 24. 240 de Defensa al Consumidor, las normas del Código Civil y Comercial de la Nación y Constitucionales, los agentes/gestores no ejercen el corretaje inmobiliario. Todas las operaciones inmobiliarias son objeto de intermediación y conclusión por parte del corredor público inmobiliario colegiado a cargo de la publicación, cuyos datos se exhiben en la presente. La presente publicación describe las características esenciales del inmueble, debiéndose consultar al corredor público inmobiliario responsable de la operación por la eventual actualización de las medidas, descripciones arquitectónicas y funcionales, valores de expensas, servicios, impuestos, precios y demás información, cuyos valores son aproximados. Para los casos de alquiler de vivienda, el monto máximo de comisión que se le puede requerir a los propietarios será el equivalente al cuatro con quince centésimos por ciento (4, 15%) del valor total del respectivo contrato. Se encuentra prohibido cobrar a los inquilinos que sean personas físicas comisiones inmobiliarias y gastos de gestoría de informes. El inmueble no es accesible para personas con discapacidades físicas. Contactar"
2026-07-06;3;58257730;2026-06-23;13;False;;;;Caballito;Av. Díaz Vélez 5479 Caballito, Capital Federal;$ 1.100.000;ARS;240000.0;90;4;3;2;12222;False;True;False;False;False;False;True;https://www.zonaprop.com.ar/propiedades/clasificado/alclapin-4-ambientes-con-dependencia-balcon-corrido-super-58257730.html?n_src=Listado&n_pills=Encargado&n_pg=3&n_pos=22;;$ 1.100.000 $ 240.000 Expensas 90 m² tot. 4 amb. 3 dorm. 2 baños Av. Díaz Vélez 5479 Caballito, Capital Federal Departamento de 4 ambientes al frente, balcon corrido, super luminoso, muy buena distribución, amplio living comedor, toilette de recepción, cocina comedor diario totalmente equipada, dependencia de servicio, baño completo, 3 dormitorios con placard, excelente ubicación av diaz velez 5479 A una cuadra del cid campeador, zona comercial, medios de locomoción, consulte. Ver datos juan manuel Contactar
2026-07-06;3;53215454;2026-07-02;4;True;;;;Caballito;Guayaquil 282 Parque Rivadavia, Caballito Te presentamos este hermoso;$ 1.600.000;ARS;290000.0;84;4;3;1;19048;False;False;False;False;False;False;True;https://www.zonaprop.com.ar/propiedades/clasificado/alclappa-excelente-dpto-4-ambientes-parque-rivadavia-53215454.html?n_src=Listado&n_pills=Lavadero&n_pg=3&n_pos=24;;$ 1.600.000 $ 290.000 Expensas 84 m² tot. 4 amb. 3 dorm. 1 baño Guayaquil 282 Parque Rivadavia, Caballito Te presentamos este hermoso departamento de 4 ambientes ubicado en la mejor zona del barrio. Los metros del departamento están excelentemente aprovechados!! Con tres amplias habitaciones y un luminoso living, ofrece el espacio perfecto para tu familia. Con un baño completo y un toilet, además de una cocina y comedor muy amplio, tendrás todo lo que necesitas para vivir cómodamente. Además, cuenta con un lavadero separado para mayor comodidad. Disfruta de la vista al frente y la conveniencia de estar a solo dos cuadras de Av. Rivadavia y una cuadra del emblemático Parque Rivadavia. ¡No dejes pasar esta oportunidad de hacer de este departamento tu nuevo hogar! Contáctanos hoy para más información. Contactar
2026-07-06;3;59480770;2026-07-04;2;True;;;;Caballito;"Avenida San Martin 2130 Caballito Norte, Caballito A metros del cruce entre la avenida San Martin y la Avenida Juan B. Justo, con innumerables lineas de colectivos que nos conectan con toda la Capital Federal, comercios, establecimientos educativos y parques, ofrecemos esta cómoda unidad que cuenta con una entrada por el living comedor con acceso al balcón, y otra de servicio a la cocina. Grande y con comedor diario. En las fotos se aprecia el amplio amueblamiento. Lavadero y cuarto de servicio con su toilette. Los dormitorios, dos ventilando al frente y otro al aire y luz, todos con placard. Baño completo y toilette en el pasillo. Una unidad atractiva por lo funcional, con la comodidad de la calefacción central. Contrato a dos años, actualizado cuatrimestralmente por ipcba. Requisitos: -Garantía propietaria o seguro de caución. -Demostración de ingresos. -Mes adelantado. -Mes de depósito a valor inicial, o en dólares fijo. -Certificación de firmas e informes (pueden ser brindandos por la persona reservante) no cobramos comisión. ""Propiedad no accesible para personas con movilidad reducida Ley 5115"" Servicios: Electricidad, Cloacas, Gas, Agua Corriente. Otros Servicios: Dependencia, Balcón. Las Imágenes son meramente ilustrativas, no contractuales. Las superficies, medidas y expensas aquí citadas son aproximadas al solo efecto informativo y no resultan vinculantes, las reales serán las que surgen de planos, título de propiedad y recibo de expensas que deberán ser suministrados por el propietario. El valor de expensas está sujeto a variación. El precio del inmueble puede ser modificado sin previo aviso. Kon propiedades matricula cucicba 3670";$ 1.250.000;ARS;426000.0;80;4;3;3;15625;False;True;False;False;False;False;False;https://www.zonaprop.com.ar/propiedades/clasificado/alclapin-alquiler-cuatro-ambientes-excelente-zona-59480770.html?n_src=Listado&n_pills=Lavadero&n_pg=3&n_pos=25;;"$ 1.250.000 $ 426.000 Expensas 80 m² tot. 4 amb. 3 dorm. 3 baños Avenida San Martin 2130 Caballito Norte, Caballito A metros del cruce entre la avenida San Martin y la Avenida Juan B. Justo, con innumerables lineas de colectivos que nos conectan con toda la Capital Federal, comercios, establecimientos educativos y parques, ofrecemos esta cómoda unidad que cuenta con una entrada por el living comedor con acceso al balcón, y otra de servicio a la cocina. Grande y con comedor diario. En las fotos se aprecia el amplio amueblamiento. Lavadero y cuarto de servicio con su toilette. Los dormitorios, dos ventilando al frente y otro al aire y luz, todos con placard. Baño completo y toilette en el pasillo. Una unidad atractiva por lo funcional, con la comodidad de la calefacción central. Contrato a dos años, actualizado cuatrimestralmente por ipcba. Requisitos: -Garantía propietaria o seguro de caución. -Demostración de ingresos. -Mes adelantado. -Mes de depósito a valor inicial, o en dólares fijo. -Certificación de firmas e informes (pueden ser brindandos por la persona reservante) no cobramos comisión. ""Propiedad no accesible para personas con movilidad reducida Ley 5115"" Servicios: Electricidad, Cloacas, Gas, Agua Corriente. Otros Servicios: Dependencia, Balcón. Las Imágenes son meramente ilustrativas, no contractuales. Las superficies, medidas y expensas aquí citadas son aproximadas al solo efecto informativo y no resultan vinculantes, las reales serán las que surgen de planos, título de propiedad y recibo de expensas que deberán ser suministrados por el propietario. El valor de expensas está sujeto a variación. El precio del inmueble puede ser modificado sin previo aviso. Kon propiedades matricula cucicba 3670 WhatsApp Contactar"
2026-07-06;3;58395301;2026-06-23;13;False;;;;Flores;Argerich 543 Flores Norte, Flores;$ 700.000;ARS;620000.0;121;4;3;2;5785;False;True;True;False;True;False;False;https://www.zonaprop.com.ar/propiedades/clasificado/alclapin-departamento-4-ambientes-con-dependencia-al-frente-con-58395301.html?n_src=Listado&n_pills=Pileta&n_pg=3&n_pos=26;;"$ 700.000 $ 620.000 Expensas 121 m² tot. 4 amb. 3 dorm. 2 baños 1 coch. Argerich 543 Flores Norte, Flores Departamento de 4 ambientes con dependencia de servicio al frente con balcón y cochera cubierta, el mismo se lo describe de la siguiente manera: -Entrada por palier privado derivando directamente al living comedor de muy buen tamaño con pisos de mármol, medidas generosas y salida al balcón corrido de casi 7 metros de largo con vista al frente más una excelente luminosidad. -2da entrada por la dependencia de servicio con toilette bien apartado del resto del departamento, acceso hacia la cocina comedor de muy cómodo espacio ya que cuenta con lugar para mesa, heladera y tiene salida al lavadero independiente con pileta para lavado, gran ventanal con rejas de protección. -La cocina cuenta con muebles bajos ubicada sobre mesada de granito, doble bacha de acero inoxidable, alacena y tiene ingreso de muy buena luz natural. -Dormitorio principal con placard empotrado, pisos de parquet, vista al frente y baño en suite. -2do dormitorio cuenta con similares medidas, placard empotrado, pisos de parquet y vista al pulmón del edificio. -3er dormitorio chico con pisos de parquet y vista al lavadero del mismo, cuenta con buena luz natura. -La unidad ofrece un baño completo con bañera y 3 toilettes de servicio, ""uno de ellos con ducha"". -El departamento cuenta con cochera fija y cubierta. -Las condiciones de ingresos son las siguientes: - justificación de ingresos. -Garantía de Capital Federal o seguro de caucion. -El Edificio se lo destáca por su privilegiada ubicación, ofrece una gama de servicios ámplia y variada, más de veinte líneas de colectivos y la línea ""A"" de Subte facilitan el acceso desde cualquier punto de la ciudad. -Ofrece diferentes opciones como restaurantes, farmacias, supermercados, bancos, tiendas de ropa y galerías comerciales a solo 5 cuadras de la Avenida Rivadavia y a media de la Av. Avellaneda. WhatsApp Contactar"
2026-07-06;3;59433333;2026-06-23;13;False;;;;Caballito;Avenida Pedro Goyena 1400 Caballito, Capital Federal Corredor Responsable: Gimena Guido cpi 9619 cmcpdjlm 1103- Contacto: Rita D\'Angela. Descripción. alquiler semi piso 4 amb/o 3 con dep. En caballito. Se ingresa con llave presencia y luego código de seguridad. Amplio, luminoso y con balcón. Ubicado en un 4° semi piso contrafrente, con doble ingreso y ventilación cruzada, este;$ 1.600.000;ARS;183000.0;97;4;3;1;16495;False;True;False;False;False;False;True;https://www.zonaprop.com.ar/propiedades/clasificado/alclapin-alquiler-semi-piso-4-amb-o-3-con-dep-en-caballito-59433333.html?n_src=Listado&n_pills=Aire+acondicionado&n_pg=3&n_pos=28;;$ 1.600.000 11% $ 183.000 Expensas 97 m² tot. 4 amb. 3 dorm. 1 baño Avenida Pedro Goyena 1400 Caballito, Capital Federal Corredor Responsable: Gimena Guido cpi 9619 cmcpdjlm 1103- Contacto: Rita D\'Angela. Descripción. alquiler semi piso 4 amb/o 3 con dep. En caballito. Se ingresa con llave presencia y luego código de seguridad. Amplio, luminoso y con balcón. Ubicado en un 4° semi piso contrafrente, con doble ingreso y ventilación cruzada, este departamento de 4 ambientes ó 3 con dependencia, ofrece excelentes condiciones de habitabilidad y confort. * Orientación: norte. * Distribución y ambientes: Living comedor amplio, con salida a balcón corrido, pisos de parquet plastificados en excelente estado y muy buena luminosidad. Cocina independiente, completa, con ventilación natural, alacenas y bajo mesadas, con conexión para lavarropas, incluye espacio para la heladera y Comedor/diario. * Dormitorio principal con salida al balcón, placard de piso a techo y excelente luz natural y A. A. Frío/Calor. * Dormitorio secundario con placard de piso a techo, y ventilador de techo. * El otro dormitorio y/o escritorio con baulera. Todos los dormitorios son amplios, luminosos y ventilados. * Baños. Un baño completo con bañera, y mampara, artefactos originales en perfecto funcionamiento. Un Toilette completo. * Balcón. Balcón corrido al contrafrente, con visuales despejadas. Ver video: clqyh7xqXuY. * Extras. Lugar de guardado distribuido en toda la vivienda. Muy buena luminosidad en toda la unidad. En planta baja posee un jardín de uso común. Hall de Entrada 1, 14 X 3, 24 = 3, 69 m² Comedor 2, 97 X 2, 88 = 8, 55 m² Living 3, 55 X 4, 04 = 14, 34 m² Living/Comedor 22, 90 m² Cocina 3, 11 X 2, 90 = 9, 02 m² Comedor Diario 1, 77 X 2, 02 = 3, 58 m² Pasillo/ Lavadero 1, 26 X 2, 66 = 3, 35 m² Toilette 1, 23 X 1, 29 = 1, 59 m² Dormitorio Principal 3, 07 X 3, 55 = 10, 90 m² Segundo Dormitorio 3, 08 X 3, 96 = 12, 20 m² Tercer Dormitorio 2, 15 X 1, 29 = 2, 77 m² Pasillo Interior 1, 32 X 2, 75 = 3, 63 m² Baño Principal 1, 60 X 2, 32 = 3, 71 m² Balcón 7, 53 m² Excelente ubicación sobre avenida Pedro Goyena (polo gastronómico) a una cuadra de Valle( con polo gastronómico también) frondosa de árboles, restaurantes, bares, acceso a transporte público, Subte A y avenidas. requisitos: Disponible a partir del 20 Abril del 2026. 1 mes de depósito. 1 mes de adelanto. Garantía propietaria caba o seguro de caución. Comprobación de ingresos. indexado trimestralmente. rau S. R. L. No ejerce el corretaje inmobiliario. El presente sitio web es una plataforma en donde cada oficina inmobiliaria independiente que contrata los servicios re/max puede publicar las propiedades a su cargo. Cada oficina es de propiedad y gestión independiente, por lo que rau S. R. L. No interviene en los datos de la publicación, en la operación inmobiliaria, ni en la confección y/o firma del boleto de compraventa y/o escritura y/o contrato de alquiler. En cumplimiento de las leyes vigentes que regulan el corretaje inmobiliario, Ley Nacional 25. 028, Ley 22. 802 de Lealtad Comercial, Ley 24. 240 de Defensa al Consumidor, las normas del Código Civil y Comercial de la Nación y Constitucionales, los agentes/gestores no ejercen el corretaje inmobiliario. Todas las operaciones inmobiliarias son objeto de intermediación y conclusión por parte del corredor público inmobiliario colegiado a cargo de la publicación, cuyos datos se exhiben en la presente. La presente publicación describe las características esenciales del inmueble, debiéndose consultar al corredor público inmobiliario responsable de la operación por la eventual actualización de las medidas, descripciones arquitectónicas y funcionales, valores de expensas, servicios, impuestos, precios y demás información, cuyos valores son aproximados. Para los casos de alquiler de vivienda, el monto máximo de comisión que se le puede requerir a los propietarios será el equivalente al cuatro con quince centésimos por ciento (4, 15%) del valor total del respectivo contrato. Se encuentra prohibido cobrar a los inquilinos que sean personas físicas comisiones inmobiliarias y gastos de gestoría de informes. El inmueble no es accesible para personas con discapacidades físicas. Contactar
2026-07-06;3;59417022;2026-06-23;13;False;;;;Caballito;"Victor Martinez al 300 Caballito, Capital Federal Ubicado en el prestigioso &quot;Barrio Inglés&quot; de Caballito, este";$ 1.700.000;ARS;500000.0;102;4;2;3;16667;False;True;True;False;False;False;True;https://www.zonaprop.com.ar/propiedades/clasificado/alclapin-caballito-zna.-barrio-ingles-p.-goyena-v.-59417022.html?n_src=Listado&n_pills=Terraza&n_pg=3&n_pos=29;;"$ 1.700.000 $ 500.000 Expensas 102 m² tot. 4 amb. 2 dorm. 3 baños Victor Martinez al 300 Caballito, Capital Federal Ubicado en el prestigioso &quot;Barrio Inglés&quot; de Caballito, este departamento de 4 ambientes con dependencia ofrece una combinación perfecta de espacio, comodidad y ubicación privilegiada. Con una superficie cubierta de 102 m2, este luminoso piso ha sido recientemente reciclado, proporcionando un ambiente moderno y acogedor. El amplio living de 4. 50 x 6. 20 m se abre hacia un balcón al frente de 8 x 1. 20 m, ideal para disfrutar del aire libre. El dormitorio principal, con placard, tiene vistas al frente y mide 3. 50 x 3. 50 m. Los otros dos dormitorios son de 3. 20 x 3. 20 m y 2. 80 x 3. 00 m respectivamente, ofreciendo espacio suficiente para toda la familia. La propiedad cuenta con un total de 3 baños, asegurando la comodidad de todos los residentes. La cocina y el lavadero han sido renovados a nuevo, ofreciendo instalaciones modernas. Además, cuenta con una baulera que proporciona espacio de almacenamiento adicional. Aunque no tiene cochera, el acceso al transporte público en Caballito es excelente, facilitando la movilidad en la ciudad. El edificio, de 60 años de antigüedad, cuenta con un ascensor y un palier privado, asegurando privacidad y comodidad. Los servicios incluyen agua corriente, cloacas, gas natural, electricidad y alumbrado público, garantizando un estilo de vida cómodo y moderno. Las medidas, superficies y proporciones consignadas en esta ficha son aproximadas y solo se muestran a titulo informativo. - WhatsApp Contactar"
2026-07-06;3;59434591;2026-06-23;13;False;;;;Caballito;Emilio Mitre 221 Caballito Sur, Caballito Aviso con video! No dejede verlo!;$ 1.800.000;ARS;348000.0;98;4;3;2;18367;False;False;False;False;False;False;False;https://www.zonaprop.com.ar/propiedades/clasificado/alclapin-alquilo-muy-lindo-depto.-caballito-2-3-dorm.-59434591.html?n_src=Listado&n_pills=Aire+acondicionado&n_pg=3&n_pos=30;;$ 1.800.000 $ 348.000 Expensas 98 m² tot. 4 amb. 3 dorm. 2 baños Emilio Mitre 221 Caballito Sur, Caballito Aviso con video! No dejede verlo! Muy lindo depto. De 2/3 dormitorios + 1 baño completo + 1 de servicio y/o Toillete. Medidas: L/C: 4, 10 x 4, 40. Dorm. Dependencia 3, 00 x 2, 00. Dorm. Principal 3, 40 x 3, 40. Dorm. Segundo 3, 0 x 3, 40. Dos A/C frío calor + 2 estufas. Edificio de cocheras al lado del edificio. Condiciones: Contrato a 2 años con ajuste trimestral x ipc. Primer mes adelantado. Deposito U$D 1, 500. Garanti caba y/o Seguro de Caucion. Comision 1/2 mes WhatsApp Contactar
2026-07-06;5;58604062;2026-06-24;12;False;;;;Caballito;Alquiler 4 Ambientes Caballito Reciclado a Nuevo! al 5100 Caballito, Capital Federal;$ 1.100.000;ARS;300000.0;75;4;3;2;14667;False;True;False;False;False;False;False;https://www.zonaprop.com.ar/propiedades/clasificado/alclapin-alquiler-4-ambientes-caballito-reciclado-a-nuevo!-58604062.html?n_src=Listado&n_pills=Permite+mascotas&n_pg=5&n_pos=1;;$ 1.100.000 $ 300.000 Expensas 75 m² tot. 4 amb. 3 dorm. 2 baños Alquiler 4 Ambientes Caballito Reciclado a Nuevo! al 5100 Caballito, Capital Federal Departamento 4 ambientes al frente con balcón de 10 m² – CaballitoUbicado sobre Av. Díaz Vélez al 5100, en el barrio de Caballito, este departamento se destaca por su excelente luminosidad y muy buena distribución. La propiedad cuenta con 3 dormitorios, amplio living comedor con salida a balcón corrido de aproximadamente 10 m², cocina independiente con lavadero, y dos baños con ducha. Su orientación y disposición al frente permiten disfrutar de gran ingreso de luz natural durante todo el día. Excelente ubicación, con gran variedad de medios de transporte, comercios, colegios y servicios en la zona. Ideal para familia que busca espacios amplios, luminosidad y una ubicación estratégica en Caballito. WhatsApp Contactar
2026-07-06;5;59550189;2026-07-06;0;True;;;;Caballito;Rosario 841. Entre San josé de calasanz y Del barco centenera Caballito, Capital Federal Alquiler de;$ 1.300.000;ARS;200000.0;71;4;3;1;18310;True;True;False;False;False;False;False;https://www.zonaprop.com.ar/propiedades/clasificado/alclapin-alquiler-departamento-4-ambientes-rosario-al-800-59550189.html?n_src=Listado&n_pills=Lavadero&n_pg=5&n_pos=2;;"$ 1.300.000 $ 200.000 Expensas 71 m² tot. 4 amb. 3 dorm. 1 baño Rosario 841. Entre San josé de calasanz y Del barco centenera Caballito, Capital Federal Alquiler de Departamento 4 Ambientes en Caballito, Capital Federal. 4 ambientes al frente con balcón ubicado sobre la calle Rosario 841, en pleno Barrio de Caballito. La propiedad se distribuye en un amplio living comedor con salida al balcón, cocina independiente, tres dormitorios, un baño completo y espacios funcionales que permiten adaptar uno de los ambientes como escritorio o espacio de trabajo. Cocina equipada con alacenas y muebles bajomesada. Lavadero incorporado. 2 dormitorios con vista hacia el contrafrente (Av. Rivadavia). El 3er. Dormitorio con vista hacia la calle Rosario. Excelente ubicación situado a metros del subte línea ""A"" Estación Primera Junta. Asimismo, con conectividad a múltiples líneas de colectivo tanto sobre la calle Rosario como por Av. Rivadavia. Cercanía a área comercial, comercios, colegios y espacios verdes y de recreación como Parque Rivadavia y Parque Centenario, entre otros. El edificio cuenta con 3 ascensores, encargado y acceso para personas con movilidad reducida. Permite mascotas. Alemany propiedades // C. U. C. I.. B. A. Mat.: 2878 - cuit: Ver datos-8 // Aviso Legal.: Se deja constancia que toda la información expuesta, medidas, valor de expensas, impuestos y servicios de este inmueble son aproximados y pueden no estar actualizados al momento de visualización del presente aviso pudiendo surgir diferencias con respecto a las que surgen de las facturas, títulos y planos legales del inmueble, no comprometiendo contractualmente a nuestra empresa, las que deberán ser ratificados con la documentación pertinente proporcionada por el propietario previo a la realización de cualquier operación, requiriendo por sí o sus profesionales las copias necesarias de la documentación que corresponda. Fotografías no vinculantes ni contractuales. Venta supeditada al cumplimiento por parte del propietario de los requisitos de la resolución general Nº 2371 de la afip (pedido de coti). xintel(any-any-603) WhatsApp Contactar"
