fecha;pagina;id_aviso;fecha_primera_vista;dias_desde_primera_vista;nueva_publicacion;publicado_zonaprop_raw;fecha_publicacion_zonaprop;antiguedad_zonaprop_dias;barrio;direccion;precio_raw;moneda;expensas;m2;ambientes;dormitorios;banos;precio_m2;mascotas;balcon;cochera;terraza;pileta;parrilla;luminoso;url;imagen;texto
2026-07-01;4;58604062;2026-06-24;7;False;;;;Caballito;Alquiler 4 Ambientes Caballito Reciclado a Nuevo! al 5100 Caballito, Capital Federal;$ 1.100.000;ARS;300000.0;75;4;3;2;14667;False;True;False;False;False;False;False;https://www.zonaprop.com.ar/propiedades/clasificado/alclapin-alquiler-4-ambientes-caballito-reciclado-a-nuevo!-58604062.html?n_src=Listado&n_pills=Permite+mascotas&n_pg=4&n_pos=18&n_search_id=68f041fb-288c-42da-b6f5-dd86e6b44a48;;$ 1.100.000 $ 300.000 Expensas 75 m² tot. 4 amb. 3 dorm. 2 baños Alquiler 4 Ambientes Caballito Reciclado a Nuevo! al 5100 Caballito, Capital Federal Departamento 4 ambientes al frente con balcón de 10 m² – CaballitoUbicado sobre Av. Díaz Vélez al 5100, en el barrio de Caballito, este departamento se destaca por su excelente luminosidad y muy buena distribución. La propiedad cuenta con 3 dormitorios, amplio living comedor con salida a balcón corrido de aproximadamente 10 m², cocina independiente con lavadero, y dos baños con ducha. Su orientación y disposición al frente permiten disfrutar de gran ingreso de luz natural durante todo el día. Excelente ubicación, con gran variedad de medios de transporte, comercios, colegios y servicios en la zona. Ideal para familia que busca espacios amplios, luminosidad y una ubicación estratégica en Caballito. WhatsApp Contactar
2026-07-01;4;58369578;2026-06-23;8;False;;;;Floresta;Moron 4114 Floresta, Capital Federal Morón 4114 entre Gualeguaychu y Sanabria. fines comerciales unicamente. no apto para vivienda.;USD 1.000;USD;;225;4;3;2;6667;False;True;True;True;False;False;False;https://www.zonaprop.com.ar/propiedades/clasificado/alclcain-no-dan-puntada-sin-nudo.-solo-fines-comerciales-58369578.html?n_src=Listado&n_pills=Terraza&n_pg=4&n_pos=19&n_search_id=68f041fb-288c-42da-b6f5-dd86e6b44a48;;USD 1.000 225 m² tot. 4 amb. 3 dorm. 2 baños 1 coch. Moron 4114 Floresta, Capital Federal Morón 4114 entre Gualeguaychu y Sanabria. fines comerciales unicamente. no apto para vivienda. alquiler u$s 1. 000 mensuales. ajustes A convenir. fundamental. garantia propietaria en lo posible familiar directo de quien alquile con inmueble en caba e ingresos demostrables reales. contrato 24 meses. Inmejorable ubicación en el corazón de floresta muy cerquita a próspero centro textil. a una cuadrita Avda. Gaona 4600. a 150 metros Avda. Segurola al 600. a doscientos pasos Av. Avellaneda al 4000 y a no más de cuatro cuadritas de la mítica Plaza velez sarsfield donde hay desde la Estación Saludable del gcba hasta la Iglesia de la candelaria e importante supermercado. opinion y analisis de Inmobiliaria ricardi. se trata de una hermosa casa en lote propio - toda en bajos - reciclada toda pero toda A nuevo - no quedo nada de la casa primitiva, está im-pe-ca- ble cuidadita y en condiciones, si bien conserva la distribución original tipo chorizo fue íntegramente remodelada a nueva, los actuales dueños la han hecho a nuevo - literal - edificando un consultorio que puede ser perfectamente un eventual tercer dormitorio, o escritorio, con un recibidor y-o con sala de espera en la parte delantera de la finca, una regia cochera cubierta y dos dormitorios uno de ellos con vestidor y otro con un placar divino de pared a pared y de piso a techo, una regia cocina y comedor de diario contiguo, un patio interior divino con cerramiento corredizo transformado en otro ambiente más tipo estar, además de un soleado patio trasero donde no falta un ambiente tipo quincho y acceso a la terraza con otra habitación auxiliar, todo pipiqq como para mudarse sin hacer arreglo alguno. Los actuales propietarios - de la mano de su hijo - han reciclado con esmero, dedicación y buen gusto un reciclado integral y cuidadoso de todos los ambientes dando como resultado una casa muy cómoda y con la ventaja de tener exteriormente una discreción total que la hace pasar desapercibida totalmente a la casa. - lote 8, 66x25, 98 son 225 m2 de tierra y tiene edificados 174 m2 cubiertos orientada al norte - con un sol divino. según codigo de edificacion. Unidades de Sustentabilidad de Altura Baja 1. Son las áreas de la ciudad de alturas menores, adecuadas para el desarrollo principalmente de actividades residenciales. Altura Máxima: 9 metros. Altura de Planta Baja mínima: 2, 60 metros, la cual no podrá tener una cota inferior a cero en los primeros 8 metros de fondo contados desde la Línea Oficial con excepción de rampas vehiculares y escaleras. La altura podrá variar si: existe algún edificio lindero Catalogado (Artículo 3. 6 Anexo ii) o la altura del edificio lindero es mayor a la de la Unidad de Edificabilidad (Artículo 6. 5. 5). Área de Media Mixtura de Usos del Suelo 2. Corresponde a las áreas y corredores destinados a residencia, servicios y comercios de mediana afluencia. Ambientes: Baño completo (2. 43x1. 27) Cochera cubierta (2. 5x5. 64) Cocina comedor (4. 37x4. 07) Dormitorio (4. 02x2. 42) Dormitorio con placard (3. 84x3) Hall de entrada (1. 85x3. 37) Patio descubierto (2. 5x9. 39) Servicios: Electricidad, Pavimento, Cloacas, Gas, Agua Corriente. Otros Servicios: Lavadero, Reciclado, Terraza. letra chica ( se recomienda leer) La venta se realiza de acuerdo a superficies y constancias obrantes en los títulos de propiedad y-o planos del inmueble. El presente plano grafico que se reproduce en esta publicación no es preciso y es dibujado por la Inmobiliaria ricardi para la comercialización del inmueble. Los metros cuadrados y medidas aquí indicadas son aproximadas y para uso interno de la Inmobiliaria ricardi quien declina toda su responsabilidad por su eventual no coincidencia con las del título de propiedad y-o plano/s aprobado/s y-o por la simple inexistencia de los mismos. - La Inmobiliaria ricardi no garantiza que el inmueble cumpla con el certificado de conservación de fachadas y balcones (Ley 257) tampoco efectúa el estudio de títulos, ni analiza los alcances del Código de edificación y no será responsable por los vicios ocultos o redhibitorios que competen a quien corresponda. Advertimos al adquirente que las instalaciones eléctricas, de gas natural y-o sanitarias pueden no solo no tener un correcto y adecuado funcionamiento técnico sino que además puede no cumplir con las exigencias actuales de metrogas- edesur- edenor - siendo a cargo del adquirente que implique su puesta en valor y-o funcionamiento. El valor de las expensas e impuestos quedan sujetos a cambios y-o ajustes. El precio y condiciones de venta pueden ser modificados sin previo aviso. Las fotos e imágenes son de carácter no contractual y se exhiben a los fines publicitarios y son meramente ilustrativas. El inmueble publicitado se encuentra está sujeto a disponibilidad y la Inmobiliaria ricardi actúa como comercializador del inmueble., siendo bajo responsabilidad del propietario la tramitación del coti. Comercializa Inmobiliaria ricardi. atencion virtual los 365 días del año. ( Incluso sábados domingos y feriados) Siempre de 10 a 13 y 16 a 20 horas. Nos puede pedir que le enviemos por correo electrónico y-o por Whatsapp fotos plano de relevamiento con medidas y video del inmueble. No somos los primeros. no somos los mejores. no somos los unicos. somos Inmobiliaria ricardi. cucicba Matricula 79. compartimos el 50% de los honorarios del comprador con todos los matriculados de cucicba. ladrillos. La inversión más segura y confiable. Ayer hoy y siempre. WhatsApp Contactar
2026-07-01;4;59434591;2026-06-23;8;False;;;;Caballito;Emilio Mitre 221 Caballito Sur, Caballito Aviso con video! No dejede verlo!;$ 1.800.000;ARS;348000.0;98;4;3;2;18367;False;False;False;False;False;False;False;https://www.zonaprop.com.ar/propiedades/clasificado/alclapin-alquilo-muy-lindo-depto.-caballito-2-3-dorm.-59434591.html?n_src=Listado&n_pills=Aire+acondicionado&n_pg=4&n_pos=21&n_search_id=68f041fb-288c-42da-b6f5-dd86e6b44a48;;$ 1.800.000 $ 348.000 Expensas 98 m² tot. 4 amb. 3 dorm. 2 baños Emilio Mitre 221 Caballito Sur, Caballito Aviso con video! No dejede verlo! Muy lindo depto. De 2/3 dormitorios + 1 baño completo + 1 de servicio y/o Toillete. Medidas: L/C: 4, 10 x 4, 40. Dorm. Dependencia 3, 00 x 2, 00. Dorm. Principal 3, 40 x 3, 40. Dorm. Segundo 3, 0 x 3, 40. Dos A/C frío calor + 2 estufas. Edificio de cocheras al lado del edificio. Condiciones: Contrato a 2 años con ajuste trimestral x ipc. Primer mes adelantado. Deposito U$D 1, 500. Garanti caba y/o Seguro de Caucion. Comision 1/2 mes WhatsApp Contactar
2026-07-01;4;52487866;2026-06-23;8;False;;;;Floresta;Rivadavia 8000 Floresta, Capital Federal Amplio;$ 850.000;ARS;280000.0;90;4;3;2;9444;False;True;False;False;False;False;False;https://www.zonaprop.com.ar/propiedades/clasificado/alclapin-av-rivadavia-8000-departamento-de-4-ambientes-52487866.html?n_src=Listado&n_pills=Lavadero&n_pg=4&n_pos=22&n_search_id=68f041fb-288c-42da-b6f5-dd86e6b44a48;;"$ 850.000 $ 280.000 Expensas 90 m² tot. 4 amb. 3 dorm. 2 baños Rivadavia 8000 Floresta, Capital Federal Amplio departamento ubicado en el corazón de floresta en un piso 10 con disposición al frente. El mismo posee doble circulación, 3 dormitorios (todos con placards y espacio de guardado), 2 baños de los cuales 1 es completo) y balcón corrido, amplia cocina, dependencia de servicio con baño propio (que puede ser una cuarta habitación o escritorio) y lavadero. Sobre Avenida Rivadavia, a tan solo 3 cuadras de la estación Floresta del Ferrocarril Sarmiento y a 5 cuadras de la estación de subte San Pedrito (Línea A). Maximiliano Avila Mat. N° 4887 Inciso 8 del artículo 10 de la Ley 2340 (texto consolidado según Ley N° 5666). Para los casos de alquiler de vivienda, el monto máximo de comisión que se le puede requerir a los propietarios será el equivalente al cuatro con quince centésimos por ciento (4, 15) del valor total del respectivo contrato. Se encuentra prohibido cobrar a los inquilinos que sean personas físicas comisiones inmobiliarias y gastos de gestoría de informes"", segun Art. 4 de la Ley 5. 859 de C. A. B. A. El edificio no cuenta con accesibilidad para personas con movilidad reducida (Ley 5115) ” WhatsApp Contactar"
2026-07-01;4;59154645;2026-06-23;8;False;;;;Villa del Parque;CUENCA 3400. Entre Beiro, Francisco, Avda. y Jose Pedro Varela Villa del Parque, Capital Federal Alquiler de;$ 1.300.000;ARS;203900.0;85;4;3;2;15294;False;True;False;False;False;False;False;https://www.zonaprop.com.ar/propiedades/clasificado/alclapin-semipiso-4-amb.-con-balcon-corrido-al-frente-59154645.html?n_src=Listado&n_pills=Lavadero&n_pg=4&n_pos=23&n_search_id=68f041fb-288c-42da-b6f5-dd86e6b44a48;;$ 1.300.000 $ 203.900 Expensas 85 m² tot. 4 amb. 3 dorm. 2 baños CUENCA 3400. Entre Beiro, Francisco, Avda. y Jose Pedro Varela Villa del Parque, Capital Federal Alquiler de Departamento 4 ambientes en Villa del Parque, Capital Federal. semipiso al frente con doble circulacion. - Hermoso Living Comedor con Puerta Bancón 6 x 3. - Balcón Corrido 8 x 1, 60 con protección para niños. - Cocina con espacio lavadero integrado 4 x 2, 50. - Dormitorio Principal con Placard con vista al frente 3, 20 x 3. - Otro dormitorio con placard al contrafrente. - Otro dormitorio más pequeño. - Baño completo. - Toillete. - apto profesional - # inmejorable ubicacion# - plena zona comercial de villa del parque. - A mts. De av. Beiro. - A 100 mts. De av. San martin. - A 300 mts. De av. Nazca. - A 300 mts. De la estacion villa del parque del Ferrocarril san martin. - Colectivos: 47, 57, 78, 80, 84, 105, 108, 110, 134, 146, etc. -Requisitos: seguro de caucion preferentemente. + recibos de sueldo O constancias de ingresos. - se acepta 1 mascota de tamaño pequeño - Visitá nuestra página Web y Fan Page. -Las medidas indicadas son aproximadas, solo a título orientativo. xintel(cim-cim-988) WhatsApp Contactar
2026-07-01;4;59004692;2026-06-23;8;False;;;;Flores;Bacacay al 2900 Flores, Capital Federal Excelente;$ 980.000;ARS;189000.0;1;4;3;3;980000;False;True;False;False;False;False;True;https://www.zonaprop.com.ar/propiedades/clasificado/alclapin-departamento-4-ambientes-con-dependencia-59004692.html?n_src=Listado&n_pills=Lavadero&n_pg=4&n_pos=24&n_search_id=68f041fb-288c-42da-b6f5-dd86e6b44a48;;$ 980.000 $ 189.000 Expensas 1 m² tot. 4 amb. 3 dorm. 3 baños Bacacay al 2900 Flores, Capital Federal Excelente departamento 4 ambientes con dependencia al frente con 2 balcones, cocina comedor, baño, toilette. Muy Luminoso! Excelente Ubicación! En cumplimiento a la ley 5115, se informa que el inmueble no es accesible para personas con discapacidades físicas. ley 5858 - art. 5Se encuentra prohibido cobrar comisiones inmobiliarias y gastos de gestoría de informes a los inquilinos que sean personas físicas. Para los casos de alquiler de vivienda, el monto máximo de comisión que se puede requerir a los propietarios será el equivalente al cuatro quince centésimos por ciento (4, 15%) del valor total del respectivo contrato. cucicba mat. Nº 27/67 WhatsApp Contactar
2026-07-01;4;58395301;2026-06-23;8;False;;;;Flores;Argerich 543 Flores Norte, Flores;$ 700.000;ARS;620000.0;121;4;3;2;5785;False;True;True;False;True;False;False;https://www.zonaprop.com.ar/propiedades/clasificado/alclapin-departamento-4-ambientes-con-dependencia-al-frente-con-58395301.html?n_src=Listado&n_pills=Lavadero&n_pg=4&n_pos=25&n_search_id=68f041fb-288c-42da-b6f5-dd86e6b44a48;;"$ 700.000 $ 620.000 Expensas 121 m² tot. 4 amb. 3 dorm. 2 baños 1 coch. Argerich 543 Flores Norte, Flores Departamento de 4 ambientes con dependencia de servicio al frente con balcón y cochera cubierta, el mismo se lo describe de la siguiente manera: -Entrada por palier privado derivando directamente al living comedor de muy buen tamaño con pisos de mármol, medidas generosas y salida al balcón corrido de casi 7 metros de largo con vista al frente más una excelente luminosidad. -2da entrada por la dependencia de servicio con toilette bien apartado del resto del departamento, acceso hacia la cocina comedor de muy cómodo espacio ya que cuenta con lugar para mesa, heladera y tiene salida al lavadero independiente con pileta para lavado, gran ventanal con rejas de protección. -La cocina cuenta con muebles bajos ubicada sobre mesada de granito, doble bacha de acero inoxidable, alacena y tiene ingreso de muy buena luz natural. -Dormitorio principal con placard empotrado, pisos de parquet, vista al frente y baño en suite. -2do dormitorio cuenta con similares medidas, placard empotrado, pisos de parquet y vista al pulmón del edificio. -3er dormitorio chico con pisos de parquet y vista al lavadero del mismo, cuenta con buena luz natura. -La unidad ofrece un baño completo con bañera y 3 toilettes de servicio, ""uno de ellos con ducha"". -El departamento cuenta con cochera fija y cubierta. -Las condiciones de ingresos son las siguientes: - justificación de ingresos. -Garantía de Capital Federal o seguro de caucion. -El Edificio se lo destáca por su privilegiada ubicación, ofrece una gama de servicios ámplia y variada, más de veinte líneas de colectivos y la línea ""A"" de Subte facilitan el acceso desde cualquier punto de la ciudad. -Ofrece diferentes opciones como restaurantes, farmacias, supermercados, bancos, tiendas de ropa y galerías comerciales a solo 5 cuadras de la Avenida Rivadavia y a media de la Av. Avellaneda. WhatsApp Contactar"
2026-07-01;4;59512235;2026-07-01;0;True;;;;Caballito;Viel 200 Caballito, Capital Federal Corredor Responsable: Hernan Perrone cucicba 2792 / mgr 170- Contacto: Gonzalo Grau. excepcional;$ 1.450.000;ARS;350000.0;96;4;3;1;15104;False;True;False;False;False;False;False;https://www.zonaprop.com.ar/propiedades/clasificado/alclapin-alquiler-4-ambientes-caballito-con-balcon-y-dep.-59512235.html?n_src=Listado&n_pills=Lavadero&n_pg=4&n_pos=26&n_search_id=68f041fb-288c-42da-b6f5-dd86e6b44a48;;$ 1.450.000 $ 350.000 Expensas 96 m² tot. 4 amb. 3 dorm. 1 baño Viel 200 Caballito, Capital Federal Corredor Responsable: Hernan Perrone cucicba 2792 / mgr 170- Contacto: Gonzalo Grau. excepcional departamento de 4 ambientes con dependencia Y balcón corrido en caballito. El equipo re/max presenta en alquiler este magnífico departamento de 4 ambientes con dependencia, reciclado a nuevo, ubicado sobre la calle Viel al 200, en el barrio de Caballito, a tan solo media cuadra del Parque Rivadavia. A 2 cuadras de Av. José María Moreno, a 2 de Av. Rivadavia, Av. La Plata y a 3 de Av. Directorio. Destacando Viel como cuadra tranquila, ya que en ella no transitan colectivos. Situado en el segundo piso, al frente, esta unidad se destaca por su gran luminosidad y una excelente distribución de los ambientes. Características de la propiedad: • Tres dormitorios con amplios placares y pisos de parquet. • Living-comedor con pisos de parquet y acceso al balcón corrido. • Cocina independiente con comedor diario, de generosas dimensiones. • Baño completo y toilette. • Dependencia de servicio con baño propio. • Lavadero independiente. Detalles del edificio: • Antigüedad: 39 años. • Ascensor. • Encargado. Excelente conectividad: Rodeado de múltiples opciones de transporte público: • Colectivos: 2, 5, 8, 15, 25, 26, 36, 42, 53, 55, 56, 65, 84, 85, 86, 88, 96, 103, 104, 119, 132, 135, 141, 172, 180, 181. • Subte: Línea A (Estación Acoyte). ¿por qué elegir este departamento? Su ubicación estratégica, amplitud y luminosidad, esta propiedad es ideal para quienes buscan confort y calidad de vida en una de las zonas más buscadas de Caballito. Requisitos para el alquiler: • Garante familiar directo con garantía propietaria en caba. • Ingresos comprobables. • Un mes de adelanto y depósito de garantía (en dólares). • No acepta mascotas. ¡Contáctenos, estamos para asesorarle! Con gusto coordinaremos una visita. Rau S. R. L. No ejerce el corretaje inmobiliario. El presente sitio web es una plataforma en donde cada oficina inmobiliaria independiente que contrata los servicios re/max puede publicar las propiedades a su cargo. Cada oficina es de propiedad y gestión independiente, por lo que rau S. R. L. No interviene en los datos de la publicación, en la operación inmobiliaria, ni en la confección y/o firma del boleto de compraventa y/o escritura y/o contrato de alquiler. En cumplimiento de las leyes vigentes que regulan el corretaje inmobiliario, Ley Nacional 25. 028, Ley 22. 802 de Lealtad Comercial, Ley 24. 240 de Defensa al Consumidor, las normas del Código Civil y Comercial de la Nación y Constitucionales, los agentes/gestores no ejercen el corretaje inmobiliario. Todas las operaciones inmobiliarias son objeto de intermediación y conclusión por parte del corredor público inmobiliario colegiado a cargo de la publicación, cuyos datos se exhiben en la presente. La presente publicación describe las características esenciales del inmueble, debiéndose consultar al corredor público inmobiliario responsable de la operación por la eventual actualización de las medidas, descripciones arquitectónicas y funcionales, valores de expensas, servicios, impuestos, precios y demás información, cuyos valores son aproximados. Para los casos de alquiler de vivienda, el monto máximo de comisión que se le puede requerir a los propietarios será el equivalente al cuatro con quince centésimos por ciento (4, 15%) del valor total del respectivo contrato. Se encuentra prohibido cobrar a los inquilinos que sean personas físicas comisiones inmobiliarias y gastos de gestoría de informes. El inmueble no es accesible para personas con discapacidades físicas. Contactar
2026-07-01;4;59417022;2026-06-23;8;False;;;;Caballito;"Victor Martinez al 300 Caballito, Capital Federal Ubicado en el prestigioso &quot;Barrio Inglés&quot; de Caballito, este";$ 1.700.000;ARS;500000.0;102;4;2;3;16667;False;True;True;False;False;False;True;https://www.zonaprop.com.ar/propiedades/clasificado/alclapin-caballito-zna.-barrio-ingles-p.-goyena-v.-59417022.html?n_src=Listado&n_pills=Terraza&n_pg=4&n_pos=27&n_search_id=68f041fb-288c-42da-b6f5-dd86e6b44a48;;"$ 1.700.000 $ 500.000 Expensas 102 m² tot. 4 amb. 2 dorm. 3 baños Victor Martinez al 300 Caballito, Capital Federal Ubicado en el prestigioso &quot;Barrio Inglés&quot; de Caballito, este departamento de 4 ambientes con dependencia ofrece una combinación perfecta de espacio, comodidad y ubicación privilegiada. Con una superficie cubierta de 102 m2, este luminoso piso ha sido recientemente reciclado, proporcionando un ambiente moderno y acogedor. El amplio living de 4. 50 x 6. 20 m se abre hacia un balcón al frente de 8 x 1. 20 m, ideal para disfrutar del aire libre. El dormitorio principal, con placard, tiene vistas al frente y mide 3. 50 x 3. 50 m. Los otros dos dormitorios son de 3. 20 x 3. 20 m y 2. 80 x 3. 00 m respectivamente, ofreciendo espacio suficiente para toda la familia. La propiedad cuenta con un total de 3 baños, asegurando la comodidad de todos los residentes. La cocina y el lavadero han sido renovados a nuevo, ofreciendo instalaciones modernas. Además, cuenta con una baulera que proporciona espacio de almacenamiento adicional. Aunque no tiene cochera, el acceso al transporte público en Caballito es excelente, facilitando la movilidad en la ciudad. El edificio, de 60 años de antigüedad, cuenta con un ascensor y un palier privado, asegurando privacidad y comodidad. Los servicios incluyen agua corriente, cloacas, gas natural, electricidad y alumbrado público, garantizando un estilo de vida cómodo y moderno. Las medidas, superficies y proporciones consignadas en esta ficha son aproximadas y solo se muestran a titulo informativo. - WhatsApp Contactar"
