fecha;pagina;id_aviso;fecha_primera_vista;dias_desde_primera_vista;nueva_publicacion;publicado_zonaprop_raw;fecha_publicacion_zonaprop;antiguedad_zonaprop_dias;barrio;direccion;precio_raw;moneda;expensas;m2;ambientes;dormitorios;banos;precio_m2;mascotas;balcon;cochera;terraza;pileta;parrilla;luminoso;url;imagen;texto
2026-07-12;3;59376798;2026-06-23;19;False;Publicado hace 29 días;2026-06-13;29.0;Caballito;Av Honorio Pueyrredon al 1400 Caballito, Capital Federal Unidad de 5 amb. Al frente. Ubicado en el piso 3°, con vista abierta. Ingresando por el hall de entrada, se sitúa un placard de recepción, que da paso a un coqueto y amplio Living- comedor en L, con salida a balcón corrido muy luminoso. Hall de distribución, en donde se ubica un dormitorio Ppal. Al frente y con salida a balcon corrido y dormitorio secundario al contrafrente. Ambos con placard de piso a techo. Cocina comedor, con gran ventanal, equipado con bajo mesada y alacena y amplios lugares de guardado. Mueble de cocina a gas. Lavadero grande e independiente, donde se encuentra una pileta de lavar, espacio para la colocación de lavarropas. Calefón a gas. 3er. Dormitorio c/ baño auxliar (dependecia servicio) 1 Baño completo con todos sus accesorios, totalmente reciclado. Pisos simil porcelanato / ceramica rustico, con diseño tipo madera. Revestimiento en ceramica, tipo mosaico texturizado. 1 Baño con ducha con todos sus accesorios, bien conservado. La unidad cuenta, en tanto en Living - comedor, habitaciones y hall pisos de parquet, con;$ 1.450.000;ARS;540000.0;96;4;2;2;15104;False;True;True;False;True;False;True;https://www.zonaprop.com.ar/propiedades/clasificado/alclapin-alquiler-departamento-4-amb-al-frente-c-cochera-c-59376798.html?n_src=Listado&n_pills=Lavadero&n_pg=3&n_pos=25;;$ 1.450.000 $ 540.000 Expensas 96 m² tot. 4 amb. 2 dorm. 2 baños 1 coch. Av Honorio Pueyrredon al 1400 Caballito, Capital Federal Unidad de 5 amb. Al frente. Ubicado en el piso 3°, con vista abierta. Ingresando por el hall de entrada, se sitúa un placard de recepción, que da paso a un coqueto y amplio Living- comedor en L, con salida a balcón corrido muy luminoso. Hall de distribución, en donde se ubica un dormitorio Ppal. Al frente y con salida a balcon corrido y dormitorio secundario al contrafrente. Ambos con placard de piso a techo. Cocina comedor, con gran ventanal, equipado con bajo mesada y alacena y amplios lugares de guardado. Mueble de cocina a gas. Lavadero grande e independiente, donde se encuentra una pileta de lavar, espacio para la colocación de lavarropas. Calefón a gas. 3er. Dormitorio c/ baño auxliar (dependecia servicio) 1 Baño completo con todos sus accesorios, totalmente reciclado. Pisos simil porcelanato / ceramica rustico, con diseño tipo madera. Revestimiento en ceramica, tipo mosaico texturizado. 1 Baño con ducha con todos sus accesorios, bien conservado. La unidad cuenta, en tanto en Living - comedor, habitaciones y hall pisos de parquet, con excelente conservación. Todos los ambientes con muy buena iluminación y ventilación. Puerta principal de seguridad/ blindada y puerta de servicio con cerradura de seguridadMuy luminoso. Muy buen estado. Excelente y elegante ubicaciónExpensas aproximadas $540. 000Espacio Guardacoche cubiertoEl edificio cuenta con encargadoUbicación estratégica, ya que esta a 4 cuadras de Av. San Martin, donde se encuentra el Metrobus y que conecta salida directa a Gral. Paz. Y por el otro conecta a pocas cuadras con el centro geográfico de la ciudad (Cid Campeador) - Se encuentra a 10 cuadras de Av. Corrientes donde hay una amplia variedad de lineas de colectivos y cercanía con subte B (Estación cercana Dorrego) (V. Urquiza - L. N. Alem) Cercanía con Ferrocarril San Martin. 10/11 cuadras del movistar arena. El inmueble no cuenta con ingreso adaptado para personas con movilidad reducida. Condiciones: Contrato por 2 años- Actualización trimestral por ipc -1 mes de adelanto + 1 mes de deposito ud$ Recibo de sueldo y/o comprobante de ingresos - seguro de caucion Para mas información puede comuníquese con nuestra oficina. En el horario de lunes a viernes 11 a 19 hs, sábados de 10 a 13 horas tel. 4566 - 2783 / 4568 - 8655. WhatsApp 11 - 7005 - 4990 - cucicba mat 3314/observaciones: Las medidas indicadas son aproximadas y al solo efecto orientativo. Las reales surgirán del titulo de propiedad respectivo. WhatsApp Contactar
2026-07-12;3;59466787;2026-06-25;17;False;Publicado hace 17 días;2026-06-25;17.0;Caballito;Honorio Pueyrredon 963 Caballito, Capital Federal Ubicado en el centro geográfico de la Ciudad Autónoma de Buenos Aires, a pasos del Cid Campeador, rodeado de medios de transporte y numerosos parques. Encontramos en el sexto piso al frente, una preciosa unidad de cuatro ambientes. Ingresando por el hall privado, disfrutamos de un gran living comedor;$ 1.500.000;ARS;500000.0;108;4;3;3;13889;False;True;True;False;False;False;True;https://www.zonaprop.com.ar/propiedades/clasificado/alclapin-alquiler-cuatro-ambientes-con-balcon-al-frente-y-59466787.html?n_src=Listado&n_pills=Laundry&n_pg=3&n_pos=26;;$ 1.500.000 $ 500.000 Expensas 108 m² tot. 4 amb. 3 dorm. 3 baños 1 coch. Honorio Pueyrredon 963 Caballito, Capital Federal Ubicado en el centro geográfico de la Ciudad Autónoma de Buenos Aires, a pasos del Cid Campeador, rodeado de medios de transporte y numerosos parques. Encontramos en el sexto piso al frente, una preciosa unidad de cuatro ambientes. Ingresando por el hall privado, disfrutamos de un gran living comedor muy luminoso, ventilando hacia el balcón. Contamos con tres dormitorios, uno en suite con baño completo y vestidor, y dos mas con placard. Segundo baño completo con bañera. Cocina con barra desayunadora, lavadero independiente, espacio para comedor diario y un toilette completan la propuesta. La unidad cuenta con una cochera móvil. Contrato a dos años, actualizado trimestralmente por ipcba. Requisitos: -Garantia propietaria o seguro de caución. -Demostración de ingresos. -Mes adelantado. -Mes de depósito a valor inicial, o en dólares fijo. -Certificación de firmas e informes (pueden ser brindandos por la persona reservante) ¡Estamos a disposición para despejar cualquier consulta y sumarte a las visitas! Servicios: Electricidad, Gas, Agua Corriente. Otros Servicios: Balcón. Las Imágenes son meramente ilustrativas, no contractuales. Las superficies, medidas y expensas aquí citadas son aproximadas al solo efecto informativo y no resultan vinculantes, las reales serán las que surgen de planos, título de propiedad y recibo de expensas que deberán ser suministrados por el propietario. El valor de expensas está sujeto a variación. El precio del inmueble puede ser modificado sin previo aviso. Kon propiedades matricula cucicba 3670 WhatsApp Contactar
2026-07-12;3;59518291;2026-07-04;8;False;Publicado hace 11 días;2026-07-01;11.0;Floresta;Av Avellaneda A al 3900 Floresta, Capital Federal Excelente;$ 950.000;ARS;290000.0;81;4;3;2;11728;False;False;False;False;False;False;True;https://www.zonaprop.com.ar/propiedades/clasificado/alclapin-departamento-en-floresta-59518291.html?n_src=Listado&n_pills=Lavadero&n_pg=3&n_pos=27;;$ 950.000 $ 290.000 Expensas 81 m² tot. 4 amb. 3 dorm. 2 baños Av Avellaneda A al 3900 Floresta, Capital Federal Excelente departamento de cuatro ambientes en alquiler, con una hermosa vista abierta, muy aireado y luminoso. La propiedad cuenta con amplios ambientes, todos con placares, ofreciendo comodidad y una excelente distribución. Dispone de una cómoda cocina con comedor diario y lavadero independiente, ideal para el uso cotidiano. Su luminosidad y ventilación natural hacen de esta unidad una excelente opción para vivir. Contrato a 24 meses con actualización trimestral por ipc. Se acepta seguro de caución. Venga a visitarlo. cucicba 142Diro PropiedadesAgente Raúl Maleh WhatsApp Contactar
2026-07-12;3;59276787;2026-06-23;19;False;Publicado hace 40 días;2026-06-02;40.0;Villa Devoto;Asuncion al 5200 Villa Devoto, Capital Federal;$ 1.500.000;ARS;;84;4;3;1;17857;False;True;False;False;False;False;False;https://www.zonaprop.com.ar/propiedades/clasificado/alclphin-ph-en-villa-devoto-59276787.html?n_src=Listado&n_pills=Lavadero&n_pg=3&n_pos=28;;$ 1.500.000 21% 84 m² tot. 4 amb. 3 dorm. 1 baño Asuncion al 5200 Villa Devoto, Capital Federal Departamento 4 ambientes, primer piso por escaleras al frente en esquina. Living comedor con balcon a la calle, cocina comedor diario muy amplio con espacio para lavarropas, toilette de recepcion, baño completo, un pequño patio pulmon, 3 dormitorios con placard y pisos recien plastificados y 2 de ellos con balcon la a calle. Se encuentra ubicaco a media cuadra de Av. Lope de Vega y 1 cuadra de Av. General Paz. No se pagan expensas! Cuenta con un aire acondicionado frio calor en el living y una estufa a gas en el hall de distribucion. No se aceptan mascotas. Articulo 4, Ley 5859 cabapara los casos de alquiler de vivienda, el monto máximo de comisión que se le puede requerir a los propietarios será el equivalente al cuatro con quince centésimos por ciento (4, 15%) del valor total del respectivo contrato. Se encuentra prohibido cobrar a los inquilinos que sean personas físicas comisiones inmobiliarias y gastos de gestoría de informesEs apto para personas con movilidad reducidaMatriculado 820 cucicbajose pintimalli WhatsApp Contactar
2026-07-12;3;59492302;2026-07-02;10;False;Publicado hace 14 días;2026-06-28;14.0;Caballito;Del Barco Centenera 345 Primera Junta, Caballito 4 ambientes reciclado A nuevo con balcón Y vista abierta - piso 17 - caballito. excelente;$ 1.300.000;ARS;200000.0;67;4;3;1;19403;False;True;True;False;False;False;True;https://www.zonaprop.com.ar/propiedades/clasificado/alclappa-4-amb-3-dorm-2-banos-reciclado-a-nuevo-balcon-59492302.html?n_src=Listado&n_pills=Permite+mascotas&n_pg=3&n_pos=30;;$ 1.300.000 $ 200.000 Expensas 67 m² tot. 4 amb. 3 dorm. 1 baño Del Barco Centenera 345 Primera Junta, Caballito 4 ambientes reciclado A nuevo con balcón Y vista abierta - piso 17 - caballito. excelente departamento de 4 ambientes con 3 dormitorios, ubicado en del barco centenera 345 - caballito. Torre de categoria con seguridad. A media cuadra de avda. Juan B alberdi, 2 cuadras de avda pedro goyena, 2 cuadras del subte A, fácil acceso A transporte público, bares Y restaurantes. La unidad se encuentra en un piso 17, con excelente luminosidad Y vista abierta, ubicada al contrafrente con balcón, brindando tranquilidad Y nada de ruido. Cuenta con: -amplio living comedor con salida al balcón. - balcón enrejado. - 3 dormitorios cómodos Y luminosos. - 1 baño completo con bañera. - 1 toilete. - cocina totalmente renovada. - lavadero independiente. - expensas $200. 000 aprox. - superficie 67 m2 aprox. Departamento totalmente reciclado A nuevo, incluyendo instalaciones, cañerias Y desagues. -se entrega con todas las luces instaladas. excelente distribución Y ambientes aprovechables. el edificio cuenta con 2 encargados (1 permanente), 3 ascensores, grupo electrógeno para funcionamiento de ascensores, seguridad mediante totem, ingreso electrónico visor, excelente mantenimiento general (recien pintado). Opcional: cochera disponible en el edificio (no incluida en el valor del alquiler) ideal para familias que buscan comodidad, excelente ubicación Y un departamento listo para entrar A vivir. Contactar
2026-07-12;5;59282616;2026-06-23;19;False;;;;La Paternal;Av San Martin 2100 La Paternal, Capital Federal Ph piso unico 4 ambientes C/ balcon corrido Y terraza propia. comodidades. living comedor 8. 00 X 3. 50. cocina 3. 50 X 3. 00. Lavadero independiente. 1° dorm 3. 50 X 3. 50 com placard. 2° dorm 3. 50 X 2. 60 con placard. habitacion de servicio con baño. baño instalado completo. balcon 8. 00 X 1. 00. terraza total con lavadero/ parrilla.. Detalles. agua caliente por termotanque. cocina equipada con mueble bajo mesada, alacena colgante. mesada de granito revestimientos de azulejos. living comedor Y dormitorios piso de parquet. resto mosaico granitico muy buen estado.;$ 1.550.000;ARS;;100;4;3;2;15500;False;True;False;True;False;True;False;https://www.zonaprop.com.ar/propiedades/clasificado/alclphin-ph-piso-unico-4-amb.-c-balcon-y-terraza-prop.-59282616.html?n_src=Listado&n_pills=Lavadero&n_pg=5&n_pos=2&n_search_id=c6c2b646-2fbf-41b5-933d-060b61caa1bf;;$ 1.550.000 100 m² tot. 4 amb. 3 dorm. 2 baños Av San Martin 2100 La Paternal, Capital Federal Ph piso unico 4 ambientes C/ balcon corrido Y terraza propia. comodidades. living comedor 8. 00 X 3. 50. cocina 3. 50 X 3. 00. Lavadero independiente. 1° dorm 3. 50 X 3. 50 com placard. 2° dorm 3. 50 X 2. 60 con placard. habitacion de servicio con baño. baño instalado completo. balcon 8. 00 X 1. 00. terraza total con lavadero/ parrilla.. Detalles. agua caliente por termotanque. cocina equipada con mueble bajo mesada, alacena colgante. mesada de granito revestimientos de azulejos. living comedor Y dormitorios piso de parquet. resto mosaico granitico muy buen estado. alquiler: 1° trimestre: $1. 550. 000. - deposito: U$ 1. 500. - requisitos: garantia propietaria A satisfaccion del propietario comprobantes de ingreso justificados gastos de luz - gas - Aysa A cargo del locatario. Las medidas, superficies y detalles consignados en el presente folleto son aproximados y a los solos efectos orientativos. Las medidas originales surgirán del título de propiedad respectivo WhatsApp Contactar
2026-07-12;5;58755233;2026-06-23;19;False;Publicado hace 100 días;2026-04-03;100.0;Caballito;SAN JOSE DE CALASANZ 0 Caballito, Capital Federal Te presento un hermoso;$ 1.200.000;ARS;320000.0;87;4;3;2;13793;False;True;True;False;False;False;True;https://www.zonaprop.com.ar/propiedades/clasificado/alclapin-departamento-de-4-ambientes-en-alquiler-en-caballito-58755233.html?n_src=Listado&n_pills=Lavadero&n_pg=5&n_pos=3&n_search_id=c6c2b646-2fbf-41b5-933d-060b61caa1bf;;$ 1.200.000 $ 320.000 Expensas 87 m² tot. 4 amb. 3 dorm. 2 baños 1 coch. SAN JOSE DE CALASANZ 0 Caballito, Capital Federal Te presento un hermoso departamento de 4 ambientes con balcon corrido al frente. Se trata de una unidad ubicada en un 8vo piso con ingreso de luz natural en todos los ambientes, hiper luminoso. El mismo esta compuesto por una cocina y lavadero independientes, un amplio living comedor con pisos de parquet en impecable estado, ingreso al balcon, y 3 dormitorios que ventilan al exterior vistas abiertas e ingreso de luz permanente. Tiene un baño completo con bañera y un toilette. Ubicacion inmejorable pleno Caballito. Digno de visitar. Comercializa Migliorisi de Corrientes 5500 srl Profesional responsable Diego F Migliorisi cpi263. Ver datos Se deja constancia que las caracteristicas, medidas, expensas y superficies consignadas son aproximadas, sujetos a verificación y/o ajuste. El precio del inmueble puede ser modificado sin previo aviso. Fotos de carácter no contractual. Las unidades publicadas están sujetas a disponibilidad. . Publicado por Migliorisi Villa Crespo a traves de Inmomap Contactar
2026-07-12;5;59523506;2026-07-02;10;False;Publicado hace 11 días;2026-07-01;11.0;Caballito;Avenida Díaz Vélez 5500 Caballito, Capital Federal Corredor Responsable: javier burgue diaz cpi 7777 / cmcpsi 6701- Contacto: Noelia Aldana Ritacco. Alquiler;$ 1.300.000;ARS;380000.0;85;4;3;1;15294;False;True;False;False;False;False;True;https://www.zonaprop.com.ar/propiedades/clasificado/alclapin-alquiler-depto.-de-4-ambientes-en-caballito-59523506.html?n_src=Listado&n_pills=Lavadero&n_pg=5&n_pos=6&n_search_id=c6c2b646-2fbf-41b5-933d-060b61caa1bf;;$ 1.300.000 $ 380.000 Expensas 85 m² tot. 4 amb. 3 dorm. 1 baño Avenida Díaz Vélez 5500 Caballito, Capital Federal Corredor Responsable: javier burgue diaz cpi 7777 / cmcpsi 6701- Contacto: Noelia Aldana Ritacco. Alquiler departamento 4 ambientes con balcón corrido al frente en Caballito. Al ingresar, encontramos un amplio living-comedor con pisos de madera, que se destaca por su gran entrada de luz natural y salida a un balcón corrido al frente, ideal para disfrutar del aire libre. Cuenta con toilette de recepción. La cocina es independiente, de generosas dimensiones y con doble circulación, equipada con alacenas y muebles bajo mesada, posee comedor diario, ventilación al exterior y acceso a un lavadero independiente. Dispone de tres habitaciones amplias y luminosas, todas con placares de gran capacidad de guardado. El departamento se completa con un baño completo en muy buen estado. La unidad se entrega completamente pintada. No se aceptan mascotas. - Contrato de 24 meses. - 1 mes de adelanto. - 1 mes de depósito. Se requiere: - Demostración de ingresos. - Seguro de caución. Excelente ubicación a metros de Av. Honorio Pueyrredón, a 100 metros de la Av. Ángel Gallardo, a 500 metros del Parque Centenario, cercano a líneas de colectivos, subtes A y B, hospitales, farmacias, colegios, restaurantes, comercios, supermercados. Rau S. R. L. No ejerce el corretaje inmobiliario. El presente sitio web es una plataforma en donde cada oficina inmobiliaria independiente que contrata los servicios re/max puede publicar las propiedades a su cargo. Cada oficina es de propiedad y gestión independiente, por lo que rau S. R. L. No interviene en los datos de la publicación, en la operación inmobiliaria, ni en la confección y/o firma del boleto de compraventa y/o escritura y/o contrato de alquiler. En cumplimiento de las leyes vigentes que regulan el corretaje inmobiliario, Ley Nacional 25. 028, Ley 22. 802 de Lealtad Comercial, Ley 24. 240 de Defensa al Consumidor, las normas del Código Civil y Comercial de la Nación y Constitucionales, los agentes/gestores no ejercen el corretaje inmobiliario. Todas las operaciones inmobiliarias son objeto de intermediación y conclusión por parte del corredor público inmobiliario colegiado a cargo de la publicación, cuyos datos se exhiben en la presente. La presente publicación describe las características esenciales del inmueble, debiéndose consultar al corredor público inmobiliario responsable de la operación por la eventual actualización de las medidas, descripciones arquitectónicas y funcionales, valores de expensas, servicios, impuestos, precios y demás información, cuyos valores son aproximados. Para los casos de alquiler de vivienda, el monto máximo de comisión que se le puede requerir a los propietarios será el equivalente al cuatro con quince centésimos por ciento (4, 15%) del valor total del respectivo contrato. Se encuentra prohibido cobrar a los inquilinos que sean personas físicas comisiones inmobiliarias y gastos de gestoría de informes. El inmueble es accesible para personas con discapacidades físicas. Contactar
2026-07-12;5;59466787;2026-06-25;17;False;Publicado hace 17 días;2026-06-25;17.0;Caballito;Honorio Pueyrredon 963 Caballito, Capital Federal Ubicado en el centro geográfico de la Ciudad Autónoma de Buenos Aires, a pasos del Cid Campeador, rodeado de medios de transporte y numerosos parques. Encontramos en el sexto piso al frente, una preciosa unidad de cuatro ambientes. Ingresando por el hall privado, disfrutamos de un gran living comedor;$ 1.500.000;ARS;500000.0;108;4;3;3;13889;False;True;True;False;False;False;True;https://www.zonaprop.com.ar/propiedades/clasificado/alclapin-alquiler-cuatro-ambientes-con-balcon-al-frente-y-59466787.html?n_src=Listado&n_pills=Lavadero&n_pg=5&n_pos=7&n_search_id=c6c2b646-2fbf-41b5-933d-060b61caa1bf;;$ 1.500.000 $ 500.000 Expensas 108 m² tot. 4 amb. 3 dorm. 3 baños 1 coch. Honorio Pueyrredon 963 Caballito, Capital Federal Ubicado en el centro geográfico de la Ciudad Autónoma de Buenos Aires, a pasos del Cid Campeador, rodeado de medios de transporte y numerosos parques. Encontramos en el sexto piso al frente, una preciosa unidad de cuatro ambientes. Ingresando por el hall privado, disfrutamos de un gran living comedor muy luminoso, ventilando hacia el balcón. Contamos con tres dormitorios, uno en suite con baño completo y vestidor, y dos mas con placard. Segundo baño completo con bañera. Cocina con barra desayunadora, lavadero independiente, espacio para comedor diario y un toilette completan la propuesta. La unidad cuenta con una cochera móvil. Contrato a dos años, actualizado trimestralmente por ipcba. Requisitos: -Garantia propietaria o seguro de caución. -Demostración de ingresos. -Mes adelantado. -Mes de depósito a valor inicial, o en dólares fijo. -Certificación de firmas e informes (pueden ser brindandos por la persona reservante) ¡Estamos a disposición para despejar cualquier consulta y sumarte a las visitas! Servicios: Electricidad, Gas, Agua Corriente. Otros Servicios: Balcón. Las Imágenes son meramente ilustrativas, no contractuales. Las superficies, medidas y expensas aquí citadas son aproximadas al solo efecto informativo y no resultan vinculantes, las reales serán las que surgen de planos, título de propiedad y recibo de expensas que deberán ser suministrados por el propietario. El valor de expensas está sujeto a variación. El precio del inmueble puede ser modificado sin previo aviso. Kon propiedades matricula cucicba 3670 WhatsApp Contactar
2026-07-12;5;59473125;2026-06-26;16;False;Publicado hace 17 días;2026-06-25;17.0;Caballito;Yerbal 400 Caballito, Capital Federal 4 Ambientes con Cochera en lo Mejor de Caballito! - Súper Luminoso y Pet Friendly. Alquiler: $ 1. 500. 000 (Alquiler sin muebles) Expensas: $ 340. 000. Características Principales. Superficie: 130 m² totales (130 m² cubiertos). Disposición: Frente (Orientación Norte, luz natural garantizada todo el día). Ambientes: 4 (Gran living comedor y 3 dormitorios amplios). Baños: 3 completos (ideal para familias). Cochera: 1 cochera privada cubierta incluida. Antigüedad: 35 años (sólida construcción, impecable estado de conservación). Mascotas: ¡Muy bienvenidas! Descripción del Inmueble. Si buscás amplitud, luminosidad y una ubicación estratégica, este;$ 1.500.000;ARS;340000.0;130;4;3;3;11538;True;True;True;False;False;False;True;https://www.zonaprop.com.ar/propiedades/clasificado/alclapin-alquiler-departamento-4-ambientes-en-caballito-59473125.html?n_src=Listado&n_pills=Permite+mascotas&n_pg=5&n_pos=8&n_search_id=c6c2b646-2fbf-41b5-933d-060b61caa1bf;;$ 1.500.000 $ 340.000 Expensas 130 m² tot. 4 amb. 3 dorm. 3 baños 1 coch. Yerbal 400 Caballito, Capital Federal 4 Ambientes con Cochera en lo Mejor de Caballito! - Súper Luminoso y Pet Friendly. Alquiler: $ 1. 500. 000 (Alquiler sin muebles) Expensas: $ 340. 000. Características Principales. Superficie: 130 m² totales (130 m² cubiertos). Disposición: Frente (Orientación Norte, luz natural garantizada todo el día). Ambientes: 4 (Gran living comedor y 3 dormitorios amplios). Baños: 3 completos (ideal para familias). Cochera: 1 cochera privada cubierta incluida. Antigüedad: 35 años (sólida construcción, impecable estado de conservación). Mascotas: ¡Muy bienvenidas! Descripción del Inmueble. Si buscás amplitud, luminosidad y una ubicación estratégica, este departamento es para vos. Ubicado en el corazón de Caballito, en la zona más comercial y conectada del barrio, a tan solo pasos del nodo Av. Rivadavia y Av. Acoyte. Tendrás a disposición el Subte Línea A, innumerables líneas de colectivo y una oferta comercial y gastronómica inigualable. El departamento destaca por su excelente estado de mantenimiento y su distribución funcional: Living-comedor de gran tamaño con salida a un amplio balcón a la calle, perfecto para disfrutar de la vista abierta y la excelente orientación Norte. 3 dormitorios cómodos con muy buen espacio de guardado. 3 baños perfectamente distribuidos. Cocina independiente y funcional, con excelente ventilación. Todo el departamento es súper luminoso y se entrega en perfectas condiciones, listo para habitar. Condiciones del Alquiler. Tipo de contrato: Alquiler tradicional (2 años). Requisitos de ingreso: Únicamente con Seguro de Caución o Garantía Propietaria de caba. ¿Te interesa coordinar una visita? Dejanos tu consulta y nos comunicamos con vos a la brevedad. ¡No te pierdas la oportunidad de vivir en una de las mejores zonas de Buenos Aires! WhatsApp Contactar
