fecha;pagina;id_aviso;fecha_primera_vista;dias_desde_primera_vista;nueva_publicacion;publicado_zonaprop_raw;fecha_publicacion_zonaprop;antiguedad_zonaprop_dias;barrio;direccion;precio_raw;moneda;expensas;m2;ambientes;dormitorios;banos;precio_m2;mascotas;balcon;cochera;terraza;pileta;parrilla;luminoso;url;imagen;texto
2026-07-23;5;59520305;2026-07-01;22;False;;;;Villa Devoto;Curuzu Cuatia 2418 Villa Devoto, Capital Federal Se Alquila;$ 980.000;ARS;230000.0;60;4;3.0;1;16333;False;True;False;False;False;False;True;https://www.zonaprop.com.ar/propiedades/clasificado/alclapin-alquiler-departamento-4-ambientes-villa-devoto-59520305.html?n_src=Listado&n_pills=Lavadero&n_pg=5&n_pos=21;;$ 980.000 $ 230.000 Expensas 60 m² tot. 4 amb. 3 dorm. 1 baño Curuzu Cuatia 2418 Villa Devoto, Capital Federal Se Alquila departamento de cuatro ambientes, tres dormitorios (todos con placard), amplia cocina, living comedor, balcón, baño y lavadero. El mismo es muy cómodo y luminoso. Piso alto. En Villa Devoto muy bien ubicado y a dos cuadras de Gral Paz. Requisitos: Mes de Alquiler. Mes de Deposito. Garantia: Seguro de Caución. Daniela Eliana Dosil Matrícula C. U. C. I. C. B. A 7327 l C. M. C. P. S. I. 6550. Todas las propiedades que figuran en esta publicación se encuentran a cargo del profesional matriculado Daniela Eliana Dosil, Matrícula C. U. C. I. C. B. A 7327 l C. M. C. P. S. I. 6550 por lo tanto la intermediación y la conclusión de las operaciones serán llevadas exclusivamente por él. En cumplimiento de la Ley 10. 973 de la Provincia de Buenos Aires, Ley Nacional 25. 028, Ley Nacional 20. 266, Ley 22. 802 de Lealtad Comercial, Ley 24. 240 de Defensa al Consumidor, las normas del Código Civil y Comercial de la Nación y Constitucionales, los asesores o agentes no ejercen el corretaje inmobiliario. Todas las operaciones inmobiliarias son objeto de intermediación y conclusión por parte del martillero y corredor colegiado, cuyos datos se exhiben en el nombre de la inmobiliaria. Ley 5115: excepto que en la descripción de la propiedad se indique lo contrario, el edificio puede no contar con rampa para personas con movilidad reducida, y no ser Accesible para personas con discapacidades físicas. Venta sujeta a la obtención del coti por parte del propietario. Las medidas son aproximadas, las reales surgen del título o plano de mensura. Las reservas se toman exclusivamente en la inmobiliaria con el matriculado C. U. C. I. C. B. A 7327 l C. M. C. P. S. I. 6550 Contactar
2026-07-23;5;59586246;2026-07-10;13;False;;;;Caballito;Avenida Rivadavia 5015 Parque Rivadavia, Caballito;$ 1.500.000;ARS;238000.0;92;4;3.0;1;16304;False;True;False;False;False;False;False;https://www.zonaprop.com.ar/propiedades/clasificado/alclapin-departamento-de-4-ambientes-en-alquiler-en-caballito.-59586246.html?n_src=Listado&n_pills=Encargado&n_pg=5&n_pos=22;;$ 1.500.000 $ 238.000 Expensas 92 m² tot. 4 amb. 3 dorm. 1 baño Avenida Rivadavia 5015 Parque Rivadavia, Caballito Departamento en alquiler ubicado Rivadavia y Acoyte con una superficie construida de 80 m² y 92 m² de superficie total. La propiedad de 4 ambientes cuenta con living comedor, cocina, lavadero, 3 dormitorios, 1 baño completo, 1 toilette, balcón y un patio techado o jardín de invierno.. El departamento cuenta con aire acondicionado en el living comedor. Pisos de parqué plastificados. Posee acceso para personas con movilidad reducida. Ubicado en el centro de la ciudad la zona ofrece una excelente conectividad mediante múltiples líneas de colectivos y la línea A de subte. El entorno es residencial y muy comercial, con cercanía a escuelas, centros de salud y el tradicional parque. Para info, consultas y visitas comunicarse por wpp al Ver datos WhatsApp Contactar
2026-07-23;5;59495096;2026-07-04;19;False;;;;Floresta;Emilio Lamarca 362 Floresta Norte, Floresta;$ 850.000;ARS;130000.0;77;4;3.0;1;11039;False;True;False;False;False;False;False;https://www.zonaprop.com.ar/propiedades/clasificado/alclapin-departamento-de-4-ambientes-en-alquiler-zona-floresta-59495096.html?n_src=Listado&n_pills=Lavadero&n_pg=5&n_pos=23;;$ 850.000 $ 130.000 Expensas 77 m² tot. 4 amb. 3 dorm. 1 baño Emilio Lamarca 362 Floresta Norte, Floresta Departamento de 4 ambientes en alquiler ubicado al frente en la zona de Floresta. La unidad cuenta con 58 m² de superficie construida y 77 m² de superficie total. El diseño interior incluye living comedor integrado, cocina equipada con termotanque, lavadero, 2 dormitorios y 1 baño completo. El espacio exterior destaca por un balcón corrido al frente con excelente entrada de luz natural. El edificio posee ascensor y expensas. El barrio ofrece un entorno familiar y tranquilo, con conectividad hacia avenidas principales, acceso a diversas líneas de colectivos, comercios de cercanía, supermercados y colegios en los alrededores. WhatsApp Contactar
2026-07-23;5;59276787;2026-06-23;30;False;;;;Villa Devoto;Asuncion al 5200 Villa Devoto, Capital Federal;$ 1.500.000;ARS;;84;4;3.0;1;17857;False;True;False;False;False;False;False;https://www.zonaprop.com.ar/propiedades/clasificado/alclphin-ph-en-villa-devoto-59276787.html?n_src=Listado&n_pills=Lavadero&n_pg=5&n_pos=25;;$ 1.500.000 84 m² tot. 4 amb. 3 dorm. 1 baño Asuncion al 5200 Villa Devoto, Capital Federal Departamento 4 ambientes, primer piso por escaleras al frente en esquina. Living comedor con balcon a la calle, cocina comedor diario muy amplio con espacio para lavarropas, toilette de recepcion, baño completo, un pequño patio pulmon, 3 dormitorios con placard y pisos recien plastificados y 2 de ellos con balcon la a calle. Se encuentra ubicaco a media cuadra de Av. Lope de Vega y 1 cuadra de Av. General Paz. No se pagan expensas! Cuenta con un aire acondicionado frio calor en el living y una estufa a gas en el hall de distribucion. No se aceptan mascotas. Articulo 4, Ley 5859 cabapara los casos de alquiler de vivienda, el monto máximo de comisión que se le puede requerir a los propietarios será el equivalente al cuatro con quince centésimos por ciento (4, 15%) del valor total del respectivo contrato. Se encuentra prohibido cobrar a los inquilinos que sean personas físicas comisiones inmobiliarias y gastos de gestoría de informesEs apto para personas con movilidad reducidaMatriculado 820 cucicbajose pintimalli WhatsApp Contactar
2026-07-23;5;56590692;2026-07-21;2;True;;;;Caballito;DOBLAS 468 7 A Caballito, Capital Federal Se trata de un semipiso en un edificio de gran categoría en la mejor ubicación del barrio de caballito A pocos metros de avenida pedro goyena avenida alberdi con solo doce años de antigÜedad. Siendo un séptimo piso con palier privado al frente Y con un amplio balcón terraza ofrece una excelente vista panorámica amplios ambientes como así también cochera fija cubierta. Es realmente un;$ 1.950.000;ARS;300000.0;119;4;;2;16387;False;True;True;True;False;False;False;https://www.zonaprop.com.ar/propiedades/clasificado/alclapin-4-ambientes-con-balcon-terraza-y-cochera-56590692.html?n_src=Listado&n_pills=Terraza&n_pg=5&n_pos=26;;$ 1.950.000 $ 300.000 Expensas 119 m² tot. 4 amb. 2 baños 1 coch. DOBLAS 468 7 A Caballito, Capital Federal Se trata de un semipiso en un edificio de gran categoría en la mejor ubicación del barrio de caballito A pocos metros de avenida pedro goyena avenida alberdi con solo doce años de antigÜedad. Siendo un séptimo piso con palier privado al frente Y con un amplio balcón terraza ofrece una excelente vista panorámica amplios ambientes como así también cochera fija cubierta. Es realmente un departamento para vivirlo Y disfrutarlo. WhatsApp Contactar
2026-07-23;5;59144888;2026-06-23;30;False;;;;Flores;R.l. Falcon al 1900 Flores, Capital Federal Semipiso 4 amb al frente con balcon/ cochera fija cubierta/ luminoso/;$ 1.200.000;ARS;400000.0;76;4;3.0;1;15789;False;True;True;False;False;False;True;https://www.zonaprop.com.ar/propiedades/clasificado/alclapin-departamento-en-flores-59144888.html?n_src=Listado&n_pills=Lavadero&n_pg=5&n_pos=28;;"$ 1.200.000 $ 400.000 Expensas 76 m² tot. 4 amb. 3 dorm. 1 baño 1 coch. R.l. Falcon al 1900 Flores, Capital Federal Semipiso 4 amb al frente con balcon/ cochera fija cubierta/ luminoso/ muy buena ubicacion / lavadero independiente / apto finaerhall/entr: 1. 20 X 1liv/com: 5. 90 X 2. 90 C/salida al balconbalcon corrido: 7. 70 X 1toilette: 1hall/distr: 3. 20 X 0. 80coc/com: 3. 70 X 2. 20 + lavadero independientedorm: 2. 80 X 2. 25 C/placdorm: 2. 90 X 2. 80 C/placbño/compl: C/ vanitory Y bañeradorm: 2. 80 X 2. 40 C/placcant. pisos: 9deptos X piso: 2ascensores: 1observaciones: aysa incluido en expensas/ semipiso luminoso con balcon/ cochera fija cubierta/ baño Y toilette/ entre av. Carabobo Y lautaro/ calefaccion X radiadores/ agua caliente X caldera/ 1. C av. Rivadavia/ 1. C estacion carabobo subte &quot;A&quot;/ 1. C av. J. B. Alberdi/ 3. C av. Directorio/ Colectivos: 1, 2, 5, 8, 25, 36, 44, 49, 53, 55, 76, 85, 86, 88, 96, 104, 113, 126, 132, 133, 134, 136, 141, 163, 180leonardo jose pignataro - Corredor InmobiliarioMat. 813 cucicba WhatsApp Contactar"
2026-07-23;5;59480770;2026-07-04;19;False;;;;Caballito;"Avenida San Martin 2130 Caballito Norte, Caballito A metros del cruce entre la avenida San Martin y la Avenida Juan B. Justo, con innumerables lineas de colectivos que nos conectan con toda la Capital Federal, comercios, establecimientos educativos y parques, ofrecemos esta cómoda unidad que cuenta con una entrada por el living comedor con acceso al balcón, y otra de servicio a la cocina. Grande y con comedor diario. En las fotos se aprecia el amplio amueblamiento. Lavadero y cuarto de servicio con su toilette. Los dormitorios, dos ventilando al frente y otro al aire y luz, todos con placard. Baño completo y toilette en el pasillo. Una unidad atractiva por lo funcional, con la comodidad de la calefacción central. Contrato a dos años, actualizado cuatrimestralmente por ipcba. Requisitos: -Garantía propietaria o seguro de caución. -Demostración de ingresos. -Mes adelantado. -Mes de depósito a valor inicial, o en dólares fijo. -Certificación de firmas e informes (pueden ser brindandos por la persona reservante) no cobramos comisión. ""Propiedad no accesible para personas con movilidad reducida Ley 5115"" Servicios: Electricidad, Cloacas, Gas, Agua Corriente. Otros Servicios: Dependencia, Balcón. Las Imágenes son meramente ilustrativas, no contractuales. Las superficies, medidas y expensas aquí citadas son aproximadas al solo efecto informativo y no resultan vinculantes, las reales serán las que surgen de planos, título de propiedad y recibo de expensas que deberán ser suministrados por el propietario. El valor de expensas está sujeto a variación. El precio del inmueble puede ser modificado sin previo aviso. Kon propiedades matricula cucicba 3670";$ 1.150.000;ARS;426000.0;80;4;3.0;3;14375;False;True;False;False;False;False;False;https://www.zonaprop.com.ar/propiedades/clasificado/alclapin-alquiler-cuatro-ambientes-excelente-zona-59480770.html?n_src=Listado&n_pills=Lavadero&n_pg=5&n_pos=30;;"$ 1.150.000 $ 426.000 Expensas 80 m² tot. 4 amb. 3 dorm. 3 baños Avenida San Martin 2130 Caballito Norte, Caballito A metros del cruce entre la avenida San Martin y la Avenida Juan B. Justo, con innumerables lineas de colectivos que nos conectan con toda la Capital Federal, comercios, establecimientos educativos y parques, ofrecemos esta cómoda unidad que cuenta con una entrada por el living comedor con acceso al balcón, y otra de servicio a la cocina. Grande y con comedor diario. En las fotos se aprecia el amplio amueblamiento. Lavadero y cuarto de servicio con su toilette. Los dormitorios, dos ventilando al frente y otro al aire y luz, todos con placard. Baño completo y toilette en el pasillo. Una unidad atractiva por lo funcional, con la comodidad de la calefacción central. Contrato a dos años, actualizado cuatrimestralmente por ipcba. Requisitos: -Garantía propietaria o seguro de caución. -Demostración de ingresos. -Mes adelantado. -Mes de depósito a valor inicial, o en dólares fijo. -Certificación de firmas e informes (pueden ser brindandos por la persona reservante) no cobramos comisión. ""Propiedad no accesible para personas con movilidad reducida Ley 5115"" Servicios: Electricidad, Cloacas, Gas, Agua Corriente. Otros Servicios: Dependencia, Balcón. Las Imágenes son meramente ilustrativas, no contractuales. Las superficies, medidas y expensas aquí citadas son aproximadas al solo efecto informativo y no resultan vinculantes, las reales serán las que surgen de planos, título de propiedad y recibo de expensas que deberán ser suministrados por el propietario. El valor de expensas está sujeto a variación. El precio del inmueble puede ser modificado sin previo aviso. Kon propiedades matricula cucicba 3670 WhatsApp Contactar"
