fecha;pagina;id_aviso;fecha_primera_vista;dias_desde_primera_vista;nueva_publicacion;publicado_zonaprop_raw;fecha_publicacion_zonaprop;antiguedad_zonaprop_dias;barrio;direccion;precio_raw;moneda;expensas;m2;ambientes;dormitorios;banos;precio_m2;mascotas;balcon;cochera;terraza;pileta;parrilla;luminoso;url;imagen;texto
2026-07-21;3;59490597;2026-06-28;23;False;;;;La Paternal;Espinosa 2300 La Paternal, Capital Federal Corredor Responsable: zmz bienes raices S. R. L. Verónica Zaltzman cpi 8072 - cmcpdjm 3960- Contacto: María Paula Rosso.;$ 1.500.000;ARS;200000.0;85;4;3.0;2.0;17647.0;False;True;True;False;False;False;True;https://www.zonaprop.com.ar/propiedades/clasificado/alclapin-departamento-4-amb-en-alquiler-cochera-en-paternal-59490597.html?n_src=Listado&n_pills=Aire+acondicionado&n_pg=3&n_pos=8&n_search_id=f9a31a4c-479a-4702-8174-c4ec455588f0;;$ 1.500.000 6% $ 200.000 Expensas 85 m² tot. 4 amb. 3 dorm. 2 baños 1 coch. Espinosa 2300 La Paternal, Capital Federal Corredor Responsable: zmz bienes raices S. R. L. Verónica Zaltzman cpi 8072 - cmcpdjm 3960- Contacto: María Paula Rosso. departamento 4 amb C/balcón en alquiler paternal. 2 baños Y cochera. Te presentamos este hermoso departamento de 4 ambientes en el 4º piso, ubicado sobre Espinosa al 2300, en una de las zonas más conectadas y dinámicas de la ciudad. Su altura privilegiada te ofrece luz natural todo el día y una increíble sensación de amplitud. Además, cuenta con Balcón y Cochera Cubierta en subsuelo. Características destacadas: se alquila amoblado! • 4 ambientes bien distribuidos, diseñados para aprovechar cada metro cuadrado. • 3 dormitorios. • 2 Baños completos. • Cocina comedor. • Living-comedor con estufa. *Aire Acondicionado (Frío) * Pallier Privado. *Cochera cubierta. *Balcón con ventanales al contrafrente. Los espacios son muy luminosos y aireados, gracias a su excelente orientación. Requisitos: • 1 mes depósito. • 1 mes de adelanto. • Ingresos demostrables. • Seguro de caución. • Contrato por 2 años. • Ajuste trimestral por Índice de Precios al Consumidor (ipc). No se aceptan Mascotas. Edificio con 2 ascensores. Ubicación estratégica: Este departamento se encuentra en una de las zonas más buscadas de la ciudad, con todo a tu alcance: Centros comerciales y tiendas de cercanía, para resolver el día a día sin complicaciones. Amplia oferta gastronómica, con bares y restaurantes para todos los gustos. Excelentes conexiones de transporte, con múltiples líneas de colectivos que te conectan con toda la ciudad. Plazas y espacios verdes cercanos, ideales para caminar, hacer deporte o relajarte. Transportes Cercanos. Colectivos: 24, 44, 47, 57, 63, 105, 109, 135, 146. Un hogar cómodo, funcional y en una ubicación envidiable. A una cuadra de Av San Martín (Metrobús) y Av. Donato Álvarez. ¡No dejes pasar esta oportunidad! Las medidas son estimativas y pueden sufrir modificaciones. Los datos definitivos son los que surgirán del título de la propiedad, planos y/o comprobantes respaldatorios. Rau S. R. L. No ejerce el corretaje inmobiliario. El presente sitio web es una plataforma en donde cada oficina inmobiliaria independiente que contrata los servicios re/max puede publicar las propiedades a su cargo. Cada oficina es de propiedad y gestión independiente, por lo que rau S. R. L. No interviene en los datos de la publicación, en la operación inmobiliaria, ni en la confección y/o firma del boleto de compraventa y/o escritura y/o contrato de alquiler. En cumplimiento de las leyes vigentes que regulan el corretaje inmobiliario, Ley Nacional 25. 028, Ley 22. 802 de Lealtad Comercial, Ley 24. 240 de Defensa al Consumidor, las normas del Código Civil y Comercial de la Nación y Constitucionales, los agentes/gestores no ejercen el corretaje inmobiliario. Todas las operaciones inmobiliarias son objeto de intermediación y conclusión por parte del corredor público inmobiliario colegiado a cargo de la publicación, cuyos datos se exhiben en la presente. La presente publicación describe las características esenciales del inmueble, debiéndose consultar al corredor público inmobiliario responsable de la operación por la eventual actualización de las medidas, descripciones arquitectónicas y funcionales, valores de expensas, servicios, impuestos, precios y demás información, cuyos valores son aproximados. Para los casos de alquiler de vivienda, el monto máximo de comisión que se le puede requerir a los propietarios será el equivalente al cuatro con quince centésimos por ciento (4, 15%) del valor total del respectivo contrato. Se encuentra prohibido cobrar a los inquilinos que sean personas físicas comisiones inmobiliarias y gastos de gestoría de informes. El inmueble no es accesible para personas con discapacidades físicas. Contactar
2026-07-21;3;59433333;2026-06-23;28;False;;;;Caballito;Avenida Pedro Goyena 1400 Caballito, Capital Federal Corredor Responsable: Gimena Guido cpi 9619 cmcpdjlm 1103- Contacto: Rita D\'Angela. Descripción. alquiler semi piso 4 amb/o 3 con dep. En caballito. Se ingresa con llave presencia y luego código de seguridad. Amplio, luminoso y con balcón. Ubicado en un 4° semi piso contrafrente, con doble ingreso y ventilación cruzada, este;$ 1.600.000;ARS;183000.0;97;4;3.0;1.0;16495.0;False;True;False;False;False;False;True;https://www.zonaprop.com.ar/propiedades/clasificado/alclapin-alquiler-semi-piso-4-amb-o-3-con-dep-en-caballito-59433333.html?n_src=Listado&n_pills=Permite+mascotas&n_pg=3&n_pos=9&n_search_id=f9a31a4c-479a-4702-8174-c4ec455588f0;;$ 1.600.000 $ 183.000 Expensas 97 m² tot. 4 amb. 3 dorm. 1 baño Avenida Pedro Goyena 1400 Caballito, Capital Federal Corredor Responsable: Gimena Guido cpi 9619 cmcpdjlm 1103- Contacto: Rita D\'Angela. Descripción. alquiler semi piso 4 amb/o 3 con dep. En caballito. Se ingresa con llave presencia y luego código de seguridad. Amplio, luminoso y con balcón. Ubicado en un 4° semi piso contrafrente, con doble ingreso y ventilación cruzada, este departamento de 4 ambientes ó 3 con dependencia, ofrece excelentes condiciones de habitabilidad y confort. * Orientación: norte. * Distribución y ambientes: Living comedor amplio, con salida a balcón corrido, pisos de parquet plastificados en excelente estado y muy buena luminosidad. Cocina independiente, completa, con ventilación natural, alacenas y bajo mesadas, con conexión para lavarropas, incluye espacio para la heladera y Comedor/diario. * Dormitorio principal con salida al balcón, placard de piso a techo y excelente luz natural y A. A. Frío/Calor. * Dormitorio secundario con placard de piso a techo, y ventilador de techo. * El otro dormitorio y/o escritorio con baulera. Todos los dormitorios son amplios, luminosos y ventilados. * Baños. Un baño completo con bañera, y mampara, artefactos originales en perfecto funcionamiento. Un Toilette completo. * Balcón. Balcón corrido al contrafrente, con visuales despejadas. Ver video: clqyh7xqXuY. * Extras. Lugar de guardado distribuido en toda la vivienda. Muy buena luminosidad en toda la unidad. En planta baja posee un jardín de uso común. Hall de Entrada 1, 14 X 3, 24 = 3, 69 m² Comedor 2, 97 X 2, 88 = 8, 55 m² Living 3, 55 X 4, 04 = 14, 34 m² Living/Comedor 22, 90 m² Cocina 3, 11 X 2, 90 = 9, 02 m² Comedor Diario 1, 77 X 2, 02 = 3, 58 m² Pasillo/ Lavadero 1, 26 X 2, 66 = 3, 35 m² Toilette 1, 23 X 1, 29 = 1, 59 m² Dormitorio Principal 3, 07 X 3, 55 = 10, 90 m² Segundo Dormitorio 3, 08 X 3, 96 = 12, 20 m² Tercer Dormitorio 2, 15 X 1, 29 = 2, 77 m² Pasillo Interior 1, 32 X 2, 75 = 3, 63 m² Baño Principal 1, 60 X 2, 32 = 3, 71 m² Balcón 7, 53 m² Excelente ubicación sobre avenida Pedro Goyena (polo gastronómico) a una cuadra de Valle( con polo gastronómico también) frondosa de árboles, restaurantes, bares, acceso a transporte público, Subte A y avenidas. requisitos: Disponible a partir del 20 Abril del 2026. 1 mes de depósito. 1 mes de adelanto. Garantía propietaria caba o seguro de caución. Comprobación de ingresos. indexado trimestralmente. rau S. R. L. No ejerce el corretaje inmobiliario. El presente sitio web es una plataforma en donde cada oficina inmobiliaria independiente que contrata los servicios re/max puede publicar las propiedades a su cargo. Cada oficina es de propiedad y gestión independiente, por lo que rau S. R. L. No interviene en los datos de la publicación, en la operación inmobiliaria, ni en la confección y/o firma del boleto de compraventa y/o escritura y/o contrato de alquiler. En cumplimiento de las leyes vigentes que regulan el corretaje inmobiliario, Ley Nacional 25. 028, Ley 22. 802 de Lealtad Comercial, Ley 24. 240 de Defensa al Consumidor, las normas del Código Civil y Comercial de la Nación y Constitucionales, los agentes/gestores no ejercen el corretaje inmobiliario. Todas las operaciones inmobiliarias son objeto de intermediación y conclusión por parte del corredor público inmobiliario colegiado a cargo de la publicación, cuyos datos se exhiben en la presente. La presente publicación describe las características esenciales del inmueble, debiéndose consultar al corredor público inmobiliario responsable de la operación por la eventual actualización de las medidas, descripciones arquitectónicas y funcionales, valores de expensas, servicios, impuestos, precios y demás información, cuyos valores son aproximados. Para los casos de alquiler de vivienda, el monto máximo de comisión que se le puede requerir a los propietarios será el equivalente al cuatro con quince centésimos por ciento (4, 15%) del valor total del respectivo contrato. Se encuentra prohibido cobrar a los inquilinos que sean personas físicas comisiones inmobiliarias y gastos de gestoría de informes. El inmueble no es accesible para personas con discapacidades físicas. Contactar
2026-07-21;3;59434450;2026-06-23;28;False;;;;Flores;Ramón Falcon 2300 Flores, Capital Federal Corredor Responsable: Jorge Salafia cucicba 5666 / csi 5888- Contacto: Maria Riquelme. alquiler;USD 850;USD;124000.0;90;4;3.0;1.0;14167.0;False;True;False;False;False;False;False;https://www.zonaprop.com.ar/propiedades/clasificado/alclapin-alquiler-dpto-3-dorm.-balcon-luminoso-59434450.html?n_src=Listado&n_pg=3&n_pos=11&n_search_id=f9a31a4c-479a-4702-8174-c4ec455588f0;;USD 850 $ 124.000 Expensas 90 m² tot. 4 amb. 3 dorm. 1 baño Ramón Falcon 2300 Flores, Capital Federal Corredor Responsable: Jorge Salafia cucicba 5666 / csi 5888- Contacto: Maria Riquelme. alquiler departamento 4 ambientes venta flores capital federal. Departamento de 90 m² ubicado sobre Ramón Falcon. 4 ambientes con tres dormitorios, un baño completo, toilette, cocina separada y living/comedor. El balcón corrido con orientación sur amplía visualmente los espacios interiores y permite una conexión fluida con el entorno urbano. Construido en 1980, el departamento mantiene su estructura original en buen estado de conservación. Los pisos de madera, los placards en dormitorios y la losa radiante son elementos que garantizan confort y funcionalidad. La disposición de frente y doble ingreso optimizan la distribución de los espacios interiores. El edificio cuenta con ascensor principal y de servicio, lo que representa un valor agregado para la propiedad. Bajas expensas. Requisitos. Plazo 2 años. Un mes de adelanto. Deposito dos mes. Ajuste 5% anual. Ingresos demostrables. Garantía seguro de caución. Rau S. R. L. No ejerce el corretaje inmobiliario. El presente sitio web es una plataforma en donde cada oficina inmobiliaria independiente que contrata los servicios re/max puede publicar las propiedades a su cargo. Cada oficina es de propiedad y gestión independiente, por lo que rau S. R. L. No interviene en los datos de la publicación, en la operación inmobiliaria, ni en la confección y/o firma del boleto de compraventa y/o escritura y/o contrato de alquiler. En cumplimiento de las leyes vigentes que regulan el corretaje inmobiliario, Ley Nacional 25. 028, Ley 22. 802 de Lealtad Comercial, Ley 24. 240 de Defensa al Consumidor, las normas del Código Civil y Comercial de la Nación y Constitucionales, los agentes/gestores no ejercen el corretaje inmobiliario. Todas las operaciones inmobiliarias son objeto de intermediación y conclusión por parte del corredor público inmobiliario colegiado a cargo de la publicación, cuyos datos se exhiben en la presente. La presente publicación describe las características esenciales del inmueble, debiéndose consultar al corredor público inmobiliario responsable de la operación por la eventual actualización de las medidas, descripciones arquitectónicas y funcionales, valores de expensas, servicios, impuestos, precios y demás información, cuyos valores son aproximados. Para los casos de alquiler de vivienda, el monto máximo de comisión que se le puede requerir a los propietarios será el equivalente al cuatro con quince centésimos por ciento (4, 15%) del valor total del respectivo contrato. Se encuentra prohibido cobrar a los inquilinos que sean personas físicas comisiones inmobiliarias y gastos de gestoría de informes. El inmueble no es accesible para personas con discapacidades físicas. WhatsApp Contactar
2026-07-21;3;59306045;2026-06-23;28;False;;;;Flores;MEMBRILLAR 122 Flores Norte, Flores Alquiler tradicional X 2 años (se actualiza trimestralmente por I. P. C.);$ 1.300.000;ARS;300000.0;107;4;3.0;2.0;12150.0;True;True;False;True;False;False;False;https://www.zonaprop.com.ar/propiedades/clasificado/alclapin-alquiler-departamento-flores-4-ambientes-balcon-59306045.html?n_src=Listado&n_pills=Encargado&n_pg=3&n_pos=14&n_search_id=f9a31a4c-479a-4702-8174-c4ec455588f0;;"$ 1.300.000 $ 300.000 Expensas 107 m² tot. 4 amb. 3 dorm. 2 baños MEMBRILLAR 122 Flores Norte, Flores Alquiler tradicional X 2 años (se actualiza trimestralmente por I. P. C.) departamento en flores 4 ambientes balcon -patio Y terraza. requisitos para el alquiler: - mascotas A evaluar. -ingresos demostrables que tripliquen el valor del alquiler. -garantia propietaria de caba O seguro de caucion. -4 ambientes. -balcon. -patio/terraza. medidas generales: 71, 47 m2 cubiertos. 2, 27 m2 (baulera) 6, 99 m2 Semicubiertos (Balcon) 26, 65 m2 Descubiertos (Patio/balcon) 107, 38 m2 totales. edificio torre. - 16 pisos. - 3 departamentos x piso. -seguridad 24 hs con totem. -encargado. -2 ascensores. - losa radiante central. medidas del departamento: Cocina (2, 22 x 3, 34) Living (5, 21 x 3, 39) aire acondicionado - Pisos de parquet-ventilador de techo. Toilette (1, 40 x 1, 29) Baño completo (1, 36 x 2, 17) Habitacion 1 (2, 92 x 2, 78) ventilador de techo - pisos de parquet. Habitacion 2 (2, 98 x 2, 86) aire acondicionado- pisos de parquet. Habitacion 3 (2, 92 x 3, 25) pisos de parquet. Balcon (6, 26 x 1, 12) Patio/Terraza y lavadero ( 4, 63 x 7, 06) Transportes Cercanos. Colectivos: 1, 2, 5, 8, 25, 36, 49, 53, 55, 76, 85, 86, 88, 92, 96, 104, 113, 126, 132, 133, 134, 136, 141, 163, 180. Subtes (Metro): carabobo (Línea A), san josé de flores (Línea A) Datos útiles. Barrio: Flores. Comuna: Comuna 7. Área Hospitalaria: htal. Dr. P. Piñero. Comisaría Comunal: 7. Comisaría Vecinal: 7C. Distrito Escolar: Distrito Escolar xi. Código Postal: 1406. Código Postal Argentino: C1406gnt. Datos sobre el barrio: Flores es un área comercial y residencial concurrida conocida por su barrio coreano pequeño, con varios bares de karaoke discretos y restaurantes donde se sirven platos clásicos, como la sopa de kimchi. Con vista al área verde de la plaza Pueyrredón, la Basílica de San José de Flores es una iglesia majestuosa del siglo xix, donde el papa Francisco, nativo de Flores, se inspiró a unirse al sacerdocio. El Centro cultural Marcó del Pont ofrece talleres y exhibiciones. Aviso legal. Todas las propiedades que figuran en mi perfil se encuentran a cargo del profesional matriculado de la oficina, la intermediación y la conclusión de las operaciones serán llevadas exclusivamente por él. En cumplimiento de la leyes provinciales vigentes que regulan el corretaje inmobiliario, Ley Nacional 25. 028, Ley 22. 802 de Lealtad Comercial, Ley 24. 240 de Defensa al Consumidor, las normas del Código Civil y Comercial de la Nación y Constitucionales, los agentes/gestores/asesores no ejercen el corretaje inmobiliario. Todas las operaciones inmobiliarias son objeto de intermediación y conclusión por parte de los martilleros y corredores colegiados, cuyos datos se exhiben debajo del nombre de la inmobiliaria. ""Para los casos de alquiler de vivienda, el monto máximo de comisión que se le puede requerir a los propietarios será el equivalente al cuatro con quince centésimos por ciento (4, 15%) del valor total del respectivo contrato. Se encuentra prohibido cobrar a los inquilinos que sean personas físicas comisiones inmobiliarias y gastos de gestoría de informes"" ley N° 5. 115. Cumple con las condiciones de accesibilidad para las personas con discapacidades físicas. Todas las propiedades que figuran en mi perfil se encuentran a cargo del profesional matriculado de la oficina, la intermediación y la conclusión de las operaciones serán llevadas exclusivamente por él. En cumplimiento de la leyes provinciales vigentes que regulan el corretaje inmobiliario, Ley Nacional 25. 028, Ley 22. 802 de Lealtad Comercial, Ley 24. 240 de Defensa al Consumidor, las normas del Código Civil y Comercial de la Nación y Constitucionales, los agentes/gestores/asesores no ejercen el corretaje inmobiliario. Todas las operaciones inmobiliarias son objeto de intermediación y conclusión por parte de los martilleros y corredores colegiados, cuyos datos se exhiben debajo del nombre de la inmobiliaria. El yar bienes raices sa. igj N° Ver datos. Las reservas se toman exclusivamente en la inmobiliaria con el matriculado C. U. C. I. C. B. A. 7493 / C. M. C. P. S. I. 6592. ""Para los casos de alquiler de vivienda, el monto máximo de comisión que se le puede requerir a los propietarios será el equivalente al cuatro con quince centésimos por ciento (4, 15%) del valor total del respectivo contrato. Se encuentra prohibido cobrar a los inquilinos que sean personas físicas comisiones inmobiliarias y gastos de gestoría de informes "" WhatsApp Contactar"
2026-07-21;3;59263793;2026-06-24;27;False;;;;Villa Santa Rita;Tres Arroyos al 2900 Villa Santa Rita, Capital Federal Muy lindo ph de 3 dormitorios con balcón desarrollado en dos plantas, muy luminosoSe accede por escalera a un primer piso. Primera Planta: hall de entrada, baño completo, living comedor, balcón y cocina con lavadero. Segunda Planta: 3 dormitorios con placard y aires acondicionados, hall de distribución con escritorio. Expensas: $ 41. 063, - (incluye Aysa) Condiciones y requisitos para el;$ 1.250.000;ARS;41063.0;110;4;3.0;2.0;11364.0;True;True;False;False;False;False;True;https://www.zonaprop.com.ar/propiedades/clasificado/alclphin-ph-3-dorm.-en-dos-plantas-59263793.html?n_src=Listado&n_pills=Aire+acondicionado&n_pg=3&n_pos=16&n_search_id=f9a31a4c-479a-4702-8174-c4ec455588f0;;$ 1.250.000 $ 41.063 Expensas 110 m² tot. 4 amb. 3 dorm. 2 baños Tres Arroyos al 2900 Villa Santa Rita, Capital Federal Muy lindo ph de 3 dormitorios con balcón desarrollado en dos plantas, muy luminosoSe accede por escalera a un primer piso. Primera Planta: hall de entrada, baño completo, living comedor, balcón y cocina con lavadero. Segunda Planta: 3 dormitorios con placard y aires acondicionados, hall de distribución con escritorio. Expensas: $ 41. 063, - (incluye Aysa) Condiciones y requisitos para el alquiler: Ingresos demostrables en blanco. Garantía: Seguro de caución (aprobado al momento de la reserva) Plazo del contrato: 24 mesesAlquiler: $ 1. 250. 000, -Depósito en garantía: $ 1. 250. 000, -A la firma del contrato se abona: un mes a alquiler y el depósito en garantíaAjustes: trimestrales ipcgastos: certificación de firmas e informes a cargo del locador (propietario) Comisión inmobiliaria: a cargo del locador (propietario) Seguro hogar: a cargo del locatario (inquilino) Mascotas: no permitidasley 5859 se encuentra prohibido cobrar honorarios por la intervención de los corredores inmobiliarios y gastos de gestoría de informes a los inquilinos que sean personas físicas (si estarán a cargo de los inquilinos el costo de los mencionados informes, pero no los que deriven de los honorarios de los gestores). En los casos que el destino del inmueble sea comercial o profesional ambas partes abonan honorarios al corredor interviniente. Para los casos de alquiler de vivienda, el monto máximo de honorarios que se le puede requerir a los propietarios será el equivalente al cuatro con quince centésimos por ciento (4, 15%) del valor total del contrato. - Corredores Responsables: Marcelo Madambashi | cpi 6512 | cmcpsi 6154 y Fabián Staniscia | cpi 7610 WhatsApp Contactar
2026-07-21;3;59597619;2026-07-15;6;False;;;;Caballito;Emilio Mitre 221 Caballito Sur, Caballito Aviso con video! No dejede verlo!;$ 1.480.000;ARS;348000.0;98;4;2.0;2.0;15102.0;False;False;False;False;False;False;False;https://www.zonaprop.com.ar/propiedades/clasificado/alclapin-alquilo-muy-lindo-depto.-caballito-2-3-dorm.-59597619.html?n_src=Listado&n_pills=Encargado&n_pg=3&n_pos=19&n_search_id=f9a31a4c-479a-4702-8174-c4ec455588f0;;$ 1.480.000 $ 348.000 Expensas 98 m² tot. 4 amb. 2 dorm. 2 baños Emilio Mitre 221 Caballito Sur, Caballito Aviso con video! No dejede verlo! Muy lindo depto. De 2/3 dormitorios + 1 baño completo + 1 de servicio y/o Toillete. Medidas: L/C: 4, 10 x 4, 40. Dorm. Dependencia 3, 00 x 2, 00. Dorm. Principal 3, 40 x 3, 40. Dorm. Segundo 3, 0 x 3, 40. Dos A/C frío calor + 2 estufas. Edificio de cocheras al lado del edificio. Condiciones: Contrato a 2 años con ajuste trimestral x ipc. Primer mes adelantado. Deposito U$D 1, 500. Garantia caba y/o Seguro de Caucion WhatsApp Contactar
2026-07-21;3;59455932;2026-06-26;25;False;;;;Caballito;Avenida Rivadavia 4900 Caballito, Capital Federal Corredor Responsable: Graciela Teramo cpi 3749 / cmcpsi 6789- Contacto: Graciela Teramo..;USD 1000;USD;590000.0;128;4;3.0;1.0;11719.0;False;True;False;False;False;False;False;https://www.zonaprop.com.ar/propiedades/clasificado/alclapin-alquiler-dpto.-4-ambientes-c-dep.-pque.-rivadavia-59455932.html?n_src=Listado&n_pills=Lavadero&n_pg=3&n_pos=21&n_search_id=f9a31a4c-479a-4702-8174-c4ec455588f0;;$ 1.400.000 6% $ 590.000 Expensas 128 m² tot. 4 amb. 3 dorm. 1 baño Avenida Rivadavia 4900 Caballito, Capital Federal Corredor Responsable: Graciela Teramo cpi 3749 / cmcpsi 6789- Contacto: Graciela Teramo.. Departamento de 128 m2 de 4 ambientes con dependencia de servicio, frente a Parque Rivadavia. La propiedad cuenta con amplio living-comedor, tres dormitorios, cocina comedor, dependencia de servicio, lavadero, baño completo y toilette. Balcón al frente con hermosa vista. a Parque Rivadavia. Privilegiada ubicación,, a media cuadra de Avda. Acoyte., al lado de la Galería París., a pasos del Subte A, líneas de colectivos. Condiciones. Contrato por 24 meses. mensuales $ 1. 400. 000. Un mes adelantado. U$S 1000 de depósito en garantía. Seguro de caución o Garantía propietaria de caba. Actualización trimestral por ipc. rau S. R. L. No ejerce el corretaje inmobiliario. El presente sitio web es una plataforma en donde cada oficina inmobiliaria independiente que contrata los servicios re/max puede publicar las propiedades a su cargo. Cada oficina es de propiedad y gestión independiente, por lo que rau S. R. L. No interviene en los datos de la publicación, en la operación inmobiliaria, ni en la confección y/o firma del boleto de compraventa y/o escritura y/o contrato de alquiler. En cumplimiento de las leyes vigentes que regulan el corretaje inmobiliario, Ley Nacional 25. 028, Ley 22. 802 de Lealtad Comercial, Ley 24. 240 de Defensa al Consumidor, las normas del Código Civil y Comercial de la Nación y Constitucionales, los agentes/gestores no ejercen el corretaje inmobiliario. Todas las operaciones inmobiliarias son objeto de intermediación y conclusión por parte del corredor público inmobiliario colegiado a cargo de la publicación, cuyos datos se exhiben en la presente. La presente publicación describe las características esenciales del inmueble, debiéndose consultar al corredor público inmobiliario responsable de la operación por la eventual actualización de las medidas, descripciones arquitectónicas y funcionales, valores de expensas, servicios, impuestos, precios y demás información, cuyos valores son aproximados. Para los casos de alquiler de vivienda, el monto máximo de comisión que se le puede requerir a los propietarios será el equivalente al cuatro con quince centésimos por ciento (4, 15%) del valor total del respectivo contrato. Se encuentra prohibido cobrar a los inquilinos que sean personas físicas comisiones inmobiliarias y gastos de gestoría de informes. El inmueble no es accesible para personas con discapacidades físicas. WhatsApp Contactar
