fecha;pagina;id_aviso;fecha_primera_vista;dias_desde_primera_vista;nueva_publicacion;publicado_zonaprop_raw;fecha_publicacion_zonaprop;antiguedad_zonaprop_dias;barrio;direccion;precio_raw;moneda;expensas;m2;ambientes;dormitorios;banos;precio_m2;mascotas;balcon;cochera;terraza;pileta;parrilla;luminoso;url;imagen;texto
2026-07-21;4;59512235;2026-07-01;20;False;;;;Caballito;Viel 200 Caballito, Capital Federal Corredor Responsable: Hernan Perrone cucicba 2792 / mgr 170- Contacto: Gonzalo Grau. excepcional;$ 1.450.000;ARS;350000.0;96;4;3.0;1.0;15104.0;False;True;False;False;False;False;False;https://www.zonaprop.com.ar/propiedades/clasificado/alclapin-alquiler-4-ambientes-caballito-con-balcon-y-dep.-59512235.html?n_src=Listado&n_pills=Lavadero&n_pg=4&n_pos=26&n_search_id=93c63083-4cf7-428d-b50b-54786cde6985;;$ 1.450.000 $ 350.000 Expensas 96 m² tot. 4 amb. 3 dorm. 1 baño Viel 200 Caballito, Capital Federal Corredor Responsable: Hernan Perrone cucicba 2792 / mgr 170- Contacto: Gonzalo Grau. excepcional departamento de 4 ambientes con dependencia Y balcón corrido en caballito. El equipo re/max presenta en alquiler este magnífico departamento de 4 ambientes con dependencia, reciclado a nuevo, ubicado sobre la calle Viel al 200, en el barrio de Caballito, a tan solo media cuadra del Parque Rivadavia. A 2 cuadras de Av. José María Moreno, a 2 de Av. Rivadavia, Av. La Plata y a 3 de Av. Directorio. Destacando Viel como cuadra tranquila, ya que en ella no transitan colectivos. Situado en el segundo piso, al frente, esta unidad se destaca por su gran luminosidad y una excelente distribución de los ambientes. Características de la propiedad: • Tres dormitorios con amplios placares y pisos de parquet. • Living-comedor con pisos de parquet y acceso al balcón corrido. • Cocina independiente con comedor diario, de generosas dimensiones. • Baño completo y toilette. • Dependencia de servicio con baño propio. • Lavadero independiente. Detalles del edificio: • Antigüedad: 39 años. • Ascensor. • Encargado. Excelente conectividad: Rodeado de múltiples opciones de transporte público: • Colectivos: 2, 5, 8, 15, 25, 26, 36, 42, 53, 55, 56, 65, 84, 85, 86, 88, 96, 103, 104, 119, 132, 135, 141, 172, 180, 181. • Subte: Línea A (Estación Acoyte). ¿por qué elegir este departamento? Su ubicación estratégica, amplitud y luminosidad, esta propiedad es ideal para quienes buscan confort y calidad de vida en una de las zonas más buscadas de Caballito. Requisitos para el alquiler: • Garante familiar directo con garantía propietaria en caba. • Ingresos comprobables. • Un mes de adelanto y depósito de garantía (en dólares). • No acepta mascotas. ¡Contáctenos, estamos para asesorarle! Con gusto coordinaremos una visita. Rau S. R. L. No ejerce el corretaje inmobiliario. El presente sitio web es una plataforma en donde cada oficina inmobiliaria independiente que contrata los servicios re/max puede publicar las propiedades a su cargo. Cada oficina es de propiedad y gestión independiente, por lo que rau S. R. L. No interviene en los datos de la publicación, en la operación inmobiliaria, ni en la confección y/o firma del boleto de compraventa y/o escritura y/o contrato de alquiler. En cumplimiento de las leyes vigentes que regulan el corretaje inmobiliario, Ley Nacional 25. 028, Ley 22. 802 de Lealtad Comercial, Ley 24. 240 de Defensa al Consumidor, las normas del Código Civil y Comercial de la Nación y Constitucionales, los agentes/gestores no ejercen el corretaje inmobiliario. Todas las operaciones inmobiliarias son objeto de intermediación y conclusión por parte del corredor público inmobiliario colegiado a cargo de la publicación, cuyos datos se exhiben en la presente. La presente publicación describe las características esenciales del inmueble, debiéndose consultar al corredor público inmobiliario responsable de la operación por la eventual actualización de las medidas, descripciones arquitectónicas y funcionales, valores de expensas, servicios, impuestos, precios y demás información, cuyos valores son aproximados. Para los casos de alquiler de vivienda, el monto máximo de comisión que se le puede requerir a los propietarios será el equivalente al cuatro con quince centésimos por ciento (4, 15%) del valor total del respectivo contrato. Se encuentra prohibido cobrar a los inquilinos que sean personas físicas comisiones inmobiliarias y gastos de gestoría de informes. El inmueble no es accesible para personas con discapacidades físicas. Contactar
2026-07-21;4;59017619;2026-06-23;28;False;;;;Caballito;Rosario 300 Parque Rivadavia, Caballito;$ 1.800.000;ARS;220000.0;90;4;3.0;3.0;20000.0;False;True;False;False;False;False;False;https://www.zonaprop.com.ar/propiedades/clasificado/alclapin-excelente-4-ambientes-frente-parque-rivadavia-59017619.html?n_src=Listado&n_pills=Aire+acondicionado&n_pg=4&n_pos=27&n_search_id=93c63083-4cf7-428d-b50b-54786cde6985;;$ 1.800.000 $ 220.000 Expensas 90 m² tot. 4 amb. 3 dorm. 3 baños Rosario 300 Parque Rivadavia, Caballito Departamento en alquiler ubicado en Parque Rivadavia. Cuenta con 3 dormitorios y 3 baños. La propiedad posee living, comedor y cocina equipada. Además, dispone de lavadero y balcón. Este departamento de 110 m2 construidos se distribuye en 4 ambientes. Posee disposición frente y orientación no, destacándose por su luminosidad. Cuenta con aire acondicionado y caldera individual. El edificio tiene 2 departamentos por piso y ascensor. Adicionalmente, el departamento incluye una caja fuerte para mayor seguridad. La zona de Parque Rivadavia ofrece una excelente conectividad, con acceso a diversas líneas de colectivos y cercanía a la estación de subte. En sus alrededores se encuentran numerosos comercios, supermercados, farmacias y centros de salud. Es una zona ideal para familias y estudiantes, con una amplia oferta educativa y recreativa. WhatsApp Contactar
2026-07-21;4;59492302;2026-07-02;19;False;;;;Caballito;Del Barco Centenera 345 Primera Junta, Caballito 4 ambientes reciclado A nuevo con balcón Y vista abierta - piso 17 - caballito. excelente;$ 1.300.000;ARS;200000.0;67;4;3.0;1.0;19403.0;False;True;True;False;False;False;True;https://www.zonaprop.com.ar/propiedades/clasificado/alclappa-4-amb-3-dorm-2-banos-reciclado-a-nuevo-balcon-59492302.html?n_src=Listado&n_pills=Lavadero&n_pg=4&n_pos=28&n_search_id=93c63083-4cf7-428d-b50b-54786cde6985;;$ 1.300.000 $ 200.000 Expensas 67 m² tot. 4 amb. 3 dorm. 1 baño Del Barco Centenera 345 Primera Junta, Caballito 4 ambientes reciclado A nuevo con balcón Y vista abierta - piso 17 - caballito. excelente departamento de 4 ambientes con 3 dormitorios, ubicado en del barco centenera 345 - caballito. Torre de categoria con seguridad. A media cuadra de avda. Juan B alberdi, 2 cuadras de avda pedro goyena, 2 cuadras del subte A, fácil acceso A transporte público, bares Y restaurantes. La unidad se encuentra en un piso 17, con excelente luminosidad Y vista abierta, ubicada al contrafrente con balcón, brindando tranquilidad Y nada de ruido. Cuenta con: -amplio living comedor con salida al balcón. - balcón enrejado. - 3 dormitorios cómodos Y luminosos. - 1 baño completo con bañera. - 1 toilete. - cocina totalmente renovada. - lavadero independiente. - expensas $200. 000 aprox. - superficie 67 m2 aprox. Departamento totalmente reciclado A nuevo, incluyendo instalaciones, cañerias Y desagues. -se entrega con todas las luces instaladas. excelente distribución Y ambientes aprovechables. el edificio cuenta con 2 encargados (1 permanente), 3 ascensores, grupo electrógeno para funcionamiento de ascensores, seguridad mediante totem, ingreso electrónico visor, excelente mantenimiento general (recien pintado). Opcional: cochera disponible en el edificio (no incluida en el valor del alquiler) ideal para familias que buscan comodidad, excelente ubicación Y un departamento listo para entrar A vivir. Contactar
2026-07-21;4;59388151;2026-06-23;28;False;;;;Villa General Mitre;Pasaje La Fronda 1681 Villa General Mitre, Capital Federal Excelente;$ 1.250.000;ARS;400000.0;84;4;3.0;2.0;14881.0;False;True;True;False;False;False;True;https://www.zonaprop.com.ar/propiedades/clasificado/alclappa-luminoso-4-ambientes-todo-externo-balcon-2-banos-y-59388151.html?n_src=Listado&n_pills=Permite+mascotas&n_pg=4&n_pos=29&n_search_id=93c63083-4cf7-428d-b50b-54786cde6985;;$ 1.250.000 $ 400.000 Expensas 84 m² tot. 4 amb. 3 dorm. 2 baños 1 coch. Pasaje La Fronda 1681 Villa General Mitre, Capital Federal Excelente departamento de 4 ambientes todo externo con balcón, 2 baños y cochera en La Paternal. Ubicado en una zona estratégica y segura, con seguridad las 24 horas, a tan solo media cuadra de Av. Juan B. Justo y media cuadra de Av. Boyacá, con excelente conectividad y cercanía a escuelas, comercios y medios de transporte. La unidad se destaca por su gran luminosidad natural, ya que todos sus ambientes son externos. Cuenta con un amplio balcón con una agradable vista abierta hacia la Plaza Pappo Napolitano. Dispone de un cómodo living-comedor, cocina totalmente equipada con horno empotrable y anafe, muebles de guardado y excelente ventilación. Posee tres dormitorios con placard, pisos de parquet lustrado en las habitaciones y dos baños completos, brindando comodidad para toda la familia. Incluye cochera, un valor agregado fundamental para la zona. Una oportunidad ideal para quienes buscan amplitud, luz, seguridad y una excelente ubicación en el corazón de La Paternal. Características principales: 4 ambientes. Todo externo. Balcón con vista abierta. 2 baños. Cochera. Seguridad 24 hs. Cocina equipada con horno empotrable y anafe. Placares en los 3 dormitorios. Pisos de parquet lustrados. Muy luminoso. Cercano a escuelas. A media cuadra de Av. Juan B. Justo y Av. Boyacá Listo para mudarse. ¡Coordiná tu visita! Contactar
2026-07-21;4;59176548;2026-06-23;28;False;;;;Caballito;Av. La Plata Caballito, Capital Federal Aviso alquiler.;$ 1.300.000;ARS;250000.0;105;4;3.0;1.0;12381.0;False;False;False;False;False;False;False;https://www.zonaprop.com.ar/propiedades/clasificado/alclapin-depto-3-amb-con-dependencia-59176548.html?n_src=Listado&n_pg=4&n_pos=30&n_search_id=93c63083-4cf7-428d-b50b-54786cde6985;;$ 1.300.000 $ 250.000 Expensas 105 m² tot. 4 amb. 3 dorm. 1 baño Av. La Plata Caballito, Capital Federal Aviso alquiler. Departamento 3 Ambientes con Dependencia – Av. La Plata al 400. Excelente departamento de 3 ambientes con dependencia, ubicado en 2° piso, con doble entrada y muy buena distribución. La propiedad cuenta con: * Living comedor. * 2 dormitorios. * Dependencia de servicio. * Cocina separada. * Baño completo. * Toilette. * Doble entrada. Ubicado sobre Av. La Plata al 400, en una zona con excelente conectividad, múltiples líneas de colectivo y acceso al nuevo Tren Bus. Ideal para quienes buscan comodidad, buena ubicación y ambientes funcionales. Consultanos para más información y coordinar visita. ⸻ WhatsApp Contactar
2026-07-21;5;59604735;2026-07-15;6;False;;;;Flores;Yerbal 2546 Flores Norte, Flores Excelente tres ambientes con dependencia. Detalle: - El living comedor con pisos parquet, posee unas medidas 8, 68 x 3, 48. Además cuenta con salida al balcónl, lo cual brinda iluminación y ventilación al ambiente. -La cocina comedor diario cuenta con muebles de sobre y bajo mesada y bacha de acero inoxidable. Presenta unas medidas de 2, 32 x 3, 81. -La unidad cuenta con un baño y un toilette. El baño es completo y presenta bañera, con unas medidas 1, 78 x 2, 27, por su parte el toilette cuenta con todas sus comodidades en excelente estado con unas dimensiones de 1, 27 x 1, 22. -el lavadero contiene espacio para lavado y artefactos para la ropa, sus medidas son de 3, 33 x 0, 96. -El balcón es amplio y cuenta con unas medidas de 3, 12 x 1, 23. - La unidad presenta 3 habitaciones, una al frente con salida al balcón principal con unas dimensiones de 3, 40 x 3, 41, la interna, la cual tiene unas medidas de 3, 29 x 2, 99, y por ultimo la habitacion de la dependencia, cuenta con dimensiones de 2, 26 x 2, 60, todas cuenta con placares en la pared. Se destaca por su privilegiada ubicación, dando accesibilidad directa a varios puntos de ciudad mediante sus variados medios de transporte a disposición. Las condiciones de ingreso son las siguientes: -Recibo de sueldo o justificación de ingresos del garante y locatario. - Seguro de caución o garantia de propietario. - Ajustes trimestrales por icl. -Se encuentra prohibido cobrar comisiones inmobiliarias y gastos de gestoría de informes a los inquilinos que sean personas físicas. Para los casos de;$ 950.000;ARS;350000.0;90;4;3.0;2.0;10556.0;False;True;False;False;False;False;False;https://www.zonaprop.com.ar/propiedades/clasificado/alclapin-excelente-tres-ambientes-con-dependencia.-59604735.html?n_src=Listado&n_pills=Lavadero&n_pg=5&n_pos=3&n_search_id=e1d04bf3-1015-4e31-a4d9-83ec0ab4d741;;$ 950.000 $ 350.000 Expensas 90 m² tot. 4 amb. 3 dorm. 2 baños Yerbal 2546 Flores Norte, Flores Excelente tres ambientes con dependencia. Detalle: - El living comedor con pisos parquet, posee unas medidas 8, 68 x 3, 48. Además cuenta con salida al balcónl, lo cual brinda iluminación y ventilación al ambiente. -La cocina comedor diario cuenta con muebles de sobre y bajo mesada y bacha de acero inoxidable. Presenta unas medidas de 2, 32 x 3, 81. -La unidad cuenta con un baño y un toilette. El baño es completo y presenta bañera, con unas medidas 1, 78 x 2, 27, por su parte el toilette cuenta con todas sus comodidades en excelente estado con unas dimensiones de 1, 27 x 1, 22. -el lavadero contiene espacio para lavado y artefactos para la ropa, sus medidas son de 3, 33 x 0, 96. -El balcón es amplio y cuenta con unas medidas de 3, 12 x 1, 23. - La unidad presenta 3 habitaciones, una al frente con salida al balcón principal con unas dimensiones de 3, 40 x 3, 41, la interna, la cual tiene unas medidas de 3, 29 x 2, 99, y por ultimo la habitacion de la dependencia, cuenta con dimensiones de 2, 26 x 2, 60, todas cuenta con placares en la pared. Se destaca por su privilegiada ubicación, dando accesibilidad directa a varios puntos de ciudad mediante sus variados medios de transporte a disposición. Las condiciones de ingreso son las siguientes: -Recibo de sueldo o justificación de ingresos del garante y locatario. - Seguro de caución o garantia de propietario. - Ajustes trimestrales por icl. -Se encuentra prohibido cobrar comisiones inmobiliarias y gastos de gestoría de informes a los inquilinos que sean personas físicas. Para los casos de alquiler de vivienda, el monto máximo de comisión que se le puede requerir a los propietarios será el equivalente al cuatro con quince centésimos por ciento (4, 15%) del valor total del respectivo contrato. Castro reisse propiedades, la vocacion al servicio de la profesion WhatsApp Contactar
2026-07-21;5;59592825;2026-07-12;9;False;;;;Caballito;ROSARIO 162. Entre Senillosa y Doblas Caballito, Capital Federal Alquiler de;$ 1.200.000;ARS;170000.0;89;4;2.0;2.0;13483.0;False;True;False;False;False;False;False;https://www.zonaprop.com.ar/propiedades/clasificado/alclapin-departamento-4-ambientes-2-dorm.-rosario-al-100-59592825.html?n_src=Listado&n_pg=5&n_pos=4&n_search_id=e1d04bf3-1015-4e31-a4d9-83ec0ab4d741;;$ 1.200.000 $ 170.000 Expensas 89 m² tot. 4 amb. 2 dorm. 2 baños ROSARIO 162. Entre Senillosa y Doblas Caballito, Capital Federal Alquiler de Departamento 4 ambientes en Caballito, Capital Federal. doble circulación, acceso de servicio a la cocina comedor diario, y portada principal al liviing comedor, hall intimo, 2 amplios dormitorios con placar, 3ra habitación o escritorio (esta adaptada mas para esta utilización), baño completo, baño auxiliar, balcón con protección, cocina completa con amoblamiento de mesada bajo mesada y alacenas, purificadorxintel(mco-mco-5179) WhatsApp Contactar
2026-07-21;5;58369578;2026-06-23;28;False;;;;Floresta;Moron 4114 Floresta, Capital Federal Morón 4114 entre Gualeguaychu y Sanabria. fines comerciales unicamente. no apto para vivienda.;USD 1.000;USD;;225;4;3.0;2.0;6667.0;False;True;True;True;False;False;False;https://www.zonaprop.com.ar/propiedades/clasificado/alclcain-no-dan-puntada-sin-nudo.-solo-fines-comerciales-58369578.html?n_src=Listado&n_pills=Terraza&n_pg=5&n_pos=5&n_search_id=e1d04bf3-1015-4e31-a4d9-83ec0ab4d741;;USD 1.000 225 m² tot. 4 amb. 3 dorm. 2 baños 1 coch. Moron 4114 Floresta, Capital Federal Morón 4114 entre Gualeguaychu y Sanabria. fines comerciales unicamente. no apto para vivienda. alquiler u$s 1. 000 mensuales. ajustes A convenir. fundamental. garantia propietaria en lo posible familiar directo de quien alquile con inmueble en caba e ingresos demostrables reales. contrato 24 meses. Inmejorable ubicación en el corazón de floresta muy cerquita a próspero centro textil. a una cuadrita Avda. Gaona 4600. a 150 metros Avda. Segurola al 600. a doscientos pasos Av. Avellaneda al 4000 y a no más de cuatro cuadritas de la mítica Plaza velez sarsfield donde hay desde la Estación Saludable del gcba hasta la Iglesia de la candelaria e importante supermercado. opinion y analisis de Inmobiliaria ricardi. se trata de una hermosa casa en lote propio - toda en bajos - reciclada toda pero toda A nuevo - no quedo nada de la casa primitiva, está im-pe-ca- ble cuidadita y en condiciones, si bien conserva la distribución original tipo chorizo fue íntegramente remodelada a nueva, los actuales dueños la han hecho a nuevo - literal - edificando un consultorio que puede ser perfectamente un eventual tercer dormitorio, o escritorio, con un recibidor y-o con sala de espera en la parte delantera de la finca, una regia cochera cubierta y dos dormitorios uno de ellos con vestidor y otro con un placar divino de pared a pared y de piso a techo, una regia cocina y comedor de diario contiguo, un patio interior divino con cerramiento corredizo transformado en otro ambiente más tipo estar, además de un soleado patio trasero donde no falta un ambiente tipo quincho y acceso a la terraza con otra habitación auxiliar, todo pipiqq como para mudarse sin hacer arreglo alguno. Los actuales propietarios - de la mano de su hijo - han reciclado con esmero, dedicación y buen gusto un reciclado integral y cuidadoso de todos los ambientes dando como resultado una casa muy cómoda y con la ventaja de tener exteriormente una discreción total que la hace pasar desapercibida totalmente a la casa. - lote 8, 66x25, 98 son 225 m2 de tierra y tiene edificados 174 m2 cubiertos orientada al norte - con un sol divino. según codigo de edificacion. Unidades de Sustentabilidad de Altura Baja 1. Son las áreas de la ciudad de alturas menores, adecuadas para el desarrollo principalmente de actividades residenciales. Altura Máxima: 9 metros. Altura de Planta Baja mínima: 2, 60 metros, la cual no podrá tener una cota inferior a cero en los primeros 8 metros de fondo contados desde la Línea Oficial con excepción de rampas vehiculares y escaleras. La altura podrá variar si: existe algún edificio lindero Catalogado (Artículo 3. 6 Anexo ii) o la altura del edificio lindero es mayor a la de la Unidad de Edificabilidad (Artículo 6. 5. 5). Área de Media Mixtura de Usos del Suelo 2. Corresponde a las áreas y corredores destinados a residencia, servicios y comercios de mediana afluencia. Ambientes: Baño completo (2. 43x1. 27) Cochera cubierta (2. 5x5. 64) Cocina comedor (4. 37x4. 07) Dormitorio (4. 02x2. 42) Dormitorio con placard (3. 84x3) Hall de entrada (1. 85x3. 37) Patio descubierto (2. 5x9. 39) Servicios: Electricidad, Pavimento, Cloacas, Gas, Agua Corriente. Otros Servicios: Lavadero, Reciclado, Terraza. letra chica ( se recomienda leer) La venta se realiza de acuerdo a superficies y constancias obrantes en los títulos de propiedad y-o planos del inmueble. El presente plano grafico que se reproduce en esta publicación no es preciso y es dibujado por la Inmobiliaria ricardi para la comercialización del inmueble. Los metros cuadrados y medidas aquí indicadas son aproximadas y para uso interno de la Inmobiliaria ricardi quien declina toda su responsabilidad por su eventual no coincidencia con las del título de propiedad y-o plano/s aprobado/s y-o por la simple inexistencia de los mismos. - La Inmobiliaria ricardi no garantiza que el inmueble cumpla con el certificado de conservación de fachadas y balcones (Ley 257) tampoco efectúa el estudio de títulos, ni analiza los alcances del Código de edificación y no será responsable por los vicios ocultos o redhibitorios que competen a quien corresponda. Advertimos al adquirente que las instalaciones eléctricas, de gas natural y-o sanitarias pueden no solo no tener un correcto y adecuado funcionamiento técnico sino que además puede no cumplir con las exigencias actuales de metrogas- edesur- edenor - siendo a cargo del adquirente que implique su puesta en valor y-o funcionamiento. El valor de las expensas e impuestos quedan sujetos a cambios y-o ajustes. El precio y condiciones de venta pueden ser modificados sin previo aviso. Las fotos e imágenes son de carácter no contractual y se exhiben a los fines publicitarios y son meramente ilustrativas. El inmueble publicitado se encuentra está sujeto a disponibilidad y la Inmobiliaria ricardi actúa como comercializador del inmueble., siendo bajo responsabilidad del propietario la tramitación del coti. Comercializa Inmobiliaria ricardi. atencion virtual los 365 días del año. ( Incluso sábados domingos y feriados) Siempre de 10 a 13 y 16 a 20 horas. Nos puede pedir que le enviemos por correo electrónico y-o por Whatsapp fotos plano de relevamiento con medidas y video del inmueble. No somos los primeros. no somos los mejores. no somos los unicos. somos Inmobiliaria ricardi. cucicba Matricula 79. compartimos el 50% de los honorarios del comprador con todos los matriculados de cucicba. ladrillos. La inversión más segura y confiable. Ayer hoy y siempre. WhatsApp Contactar
2026-07-21;5;52487866;2026-06-23;28;False;;;;Floresta;Rivadavia 8000 Floresta, Capital Federal Amplio;$ 800.000;ARS;280000.0;90;4;3.0;2.0;8889.0;False;True;False;False;False;False;False;https://www.zonaprop.com.ar/propiedades/clasificado/alclapin-av-rivadavia-8000-departamento-de-4-ambientes-52487866.html?n_src=Listado&n_pills=Lavadero&n_pg=5&n_pos=7&n_search_id=e1d04bf3-1015-4e31-a4d9-83ec0ab4d741;;"$ 800.000 5% $ 280.000 Expensas 90 m² tot. 4 amb. 3 dorm. 2 baños Rivadavia 8000 Floresta, Capital Federal Amplio departamento ubicado en el corazón de floresta en un piso 10 con disposición al frente. El mismo posee doble circulación, 3 dormitorios (todos con placards y espacio de guardado), 2 baños de los cuales 1 es completo) y balcón corrido, amplia cocina, dependencia de servicio con baño propio (que puede ser una cuarta habitación o escritorio) y lavadero. Sobre Avenida Rivadavia, a tan solo 3 cuadras de la estación Floresta del Ferrocarril Sarmiento y a 5 cuadras de la estación de subte San Pedrito (Línea A). Maximiliano Avila Mat. N° 4887 Inciso 8 del artículo 10 de la Ley 2340 (texto consolidado según Ley N° 5666). Para los casos de alquiler de vivienda, el monto máximo de comisión que se le puede requerir a los propietarios será el equivalente al cuatro con quince centésimos por ciento (4, 15) del valor total del respectivo contrato. Se encuentra prohibido cobrar a los inquilinos que sean personas físicas comisiones inmobiliarias y gastos de gestoría de informes"", segun Art. 4 de la Ley 5. 859 de C. A. B. A. El edificio no cuenta con accesibilidad para personas con movilidad reducida (Ley 5115) ” WhatsApp Contactar"
