fecha;pagina;id_aviso;fecha_primera_vista;dias_desde_primera_vista;nueva_publicacion;publicado_zonaprop_raw;fecha_publicacion_zonaprop;antiguedad_zonaprop_dias;barrio;direccion;precio_raw;moneda;expensas;m2;ambientes;dormitorios;banos;precio_m2;mascotas;balcon;cochera;terraza;pileta;parrilla;luminoso;url;imagen;texto
2026-07-21;4;59658603;2026-07-21;0;True;;;;La Paternal;Av. Tte. Gral. Donato Alvarez 2075 La Paternal, Capital Federal A metros de la Av. San Martín, con cercanía a múltiples comercios, centros educativos, hospitales y medios de transporte. Ofrecemos este cómodo cuatro ambientes con balcón al frente, el mismo cuenta con 3 dormitorios todos con placard, gran living con acceso al balcón, baño completo, toilette, y una amplia cocina con lavadero independiente y espacio para comedor diario. Contrato a dos años, actualizado cuatrimestralmente por ipcba. Requisitos: -Demostración de ingresos. -Garantia propietaria o seguro de caución. -Mes adelantado. -Mes de deposito a valor inicial, restituyendose a valor final, o en dólares fijo. -Certificación de firmas e informes. ¡Estamos a disposición para despejar cualquier duda y cooridnar una visita!;$ 1.100.000;ARS;290000.0;80;4;3.0;2.0;13750.0;False;True;False;False;False;False;False;https://www.zonaprop.com.ar/propiedades/clasificado/alclapin-luminoso-4-ambientes-con-balcon-59658603.html?n_src=Listado&n_pills=Lavadero&n_pg=4&n_pos=11&n_search_id=93c63083-4cf7-428d-b50b-54786cde6985;;$ 1.100.000 $ 290.000 Expensas 80 m² tot. 4 amb. 3 dorm. 2 baños Av. Tte. Gral. Donato Alvarez 2075 La Paternal, Capital Federal A metros de la Av. San Martín, con cercanía a múltiples comercios, centros educativos, hospitales y medios de transporte. Ofrecemos este cómodo cuatro ambientes con balcón al frente, el mismo cuenta con 3 dormitorios todos con placard, gran living con acceso al balcón, baño completo, toilette, y una amplia cocina con lavadero independiente y espacio para comedor diario. Contrato a dos años, actualizado cuatrimestralmente por ipcba. Requisitos: -Demostración de ingresos. -Garantia propietaria o seguro de caución. -Mes adelantado. -Mes de deposito a valor inicial, restituyendose a valor final, o en dólares fijo. -Certificación de firmas e informes. ¡Estamos a disposición para despejar cualquier duda y cooridnar una visita! WhatsApp Contactar
2026-07-21;4;53649975;2026-06-24;27;False;;;;Villa del Parque;Segurola 3216 Villa Devoto, Capital Federal;$ 1.500.000;ARS;150000.0;90;4;3.0;2.0;16667.0;False;True;False;False;False;False;False;https://www.zonaprop.com.ar/propiedades/clasificado/alclapin-departamento-de-4-ambientes-con-balcon-53649975.html?n_src=Listado&n_pg=4&n_pos=12&n_search_id=93c63083-4cf7-428d-b50b-54786cde6985;;$ 1.500.000 $ 150.000 Expensas 90 m² tot. 4 amb. 3 dorm. 2 baños Segurola 3216 Villa Devoto, Capital Federal Departamento de 4 ambientes al frente con balcon, ubicado en el barrio porteño de Villa Devoto, situado en la calle Segurola, entre La Avenida Francisco Beiro y Jose Pedro Varela. la propiedad cuenta con 3 dormitorios, cocina separada, gran living comedor y balcon corrido al frente. expensas mayo 150. 000 pesos. consultas unicamente telefonicas al 4. 5. 0. 3. -. 7. 0. 0. 0 // 4. 5. 0. 4. -. 7. 0. 0. 0. Whatsapp mensajes +. 5. 4. 1. 1. 4. 5. 0. 3. 7. 0. 0. 0. Nani Propiedades. Suc: Villa del Parque. Nazarre Nº 3211 C. A. B. A. Suc: Villa Devoto. Av. Segurola 3261 C. A. B. A. Para los casos de alquiler de vivienda, el monto máximo de comisión que se le puede requerir a los propietarios será el equivalente al cuatro con quince centésimos por ciento (4, 15%) del valor total del respectivo contrato. Se encuentra prohibido cobrar a los inquilinos que sean personas físicas comisiones inmobiliarias y gastos de gestoría de informes. Todas las Medidas y/o superficies indicadas en nuestro sitio son aproximadas y a solo efecto orientativo. Las medidas reales surgirán del plano correspondiante del inmueble. WhatsApp Contactar
2026-07-21;4;59566728;2026-07-15;6;False;;;;Flores;Helguera 393 Flores Norte, Flores;$ 900.000;ARS;410000.0;90;4;2.0;1.0;10000.0;False;True;False;False;False;False;False;https://www.zonaprop.com.ar/propiedades/clasificado/alclapin-gran-departamento-4-ambientes-2-dorm.-y-dependencia-59566728.html?n_src=Listado&n_pg=4&n_pos=13&n_search_id=93c63083-4cf7-428d-b50b-54786cde6985;;$ 900.000 $ 410.000 Expensas 90 m² tot. 4 amb. 2 dorm. 1 baño Helguera 393 Flores Norte, Flores Departamento disponible en alquiler en el barrio de Flores Norte. El inmueble cuenta con 85 m² de superficie construida y 90 m² de superficie total. Presenta una distribución funcional con living comedor, cocina equipada con termotanque, dependencia de servicio y 1 baño. La unidad posee calefacción y tiene la ventaja de contar con balcón. El edificio cuenta con ascensor para mayor comodidad. El departamento ofrece apto profesional y uso comercial, lo que amplía sus posibilidades de uso. Se encuentra ubicado en una zona mixta que combina la tranquilidad residencial con la actividad comercial. El área cuenta con excelente conectividad mediante líneas de colectivos y subte, además de estar rodeada de colegios, centros de salud y locales comerciales. WhatsApp Contactar
2026-07-21;4;59523506;2026-07-02;19;False;;;;Caballito;Avenida Díaz Vélez 5500 Caballito, Capital Federal Corredor Responsable: javier burgue diaz cpi 7777 / cmcpsi 6701- Contacto: Noelia Aldana Ritacco. Alquiler;$ 1.300.000;ARS;380000.0;85;4;3.0;1.0;15294.0;False;True;False;False;False;False;True;https://www.zonaprop.com.ar/propiedades/clasificado/alclapin-alquiler-depto.-de-4-ambientes-en-caballito-59523506.html?n_src=Listado&n_pills=Lavadero&n_pg=4&n_pos=14&n_search_id=93c63083-4cf7-428d-b50b-54786cde6985;;$ 1.300.000 $ 380.000 Expensas 85 m² tot. 4 amb. 3 dorm. 1 baño Avenida Díaz Vélez 5500 Caballito, Capital Federal Corredor Responsable: javier burgue diaz cpi 7777 / cmcpsi 6701- Contacto: Noelia Aldana Ritacco. Alquiler departamento 4 ambientes con balcón corrido al frente en Caballito. Al ingresar, encontramos un amplio living-comedor con pisos de madera, que se destaca por su gran entrada de luz natural y salida a un balcón corrido al frente, ideal para disfrutar del aire libre. Cuenta con toilette de recepción. La cocina es independiente, de generosas dimensiones y con doble circulación, equipada con alacenas y muebles bajo mesada, posee comedor diario, ventilación al exterior y acceso a un lavadero independiente. Dispone de tres habitaciones amplias y luminosas, todas con placares de gran capacidad de guardado. El departamento se completa con un baño completo en muy buen estado. La unidad se entrega completamente pintada. No se aceptan mascotas. - Contrato de 24 meses. - 1 mes de adelanto. - 1 mes de depósito. Se requiere: - Demostración de ingresos. - Seguro de caución. Excelente ubicación a metros de Av. Honorio Pueyrredón, a 100 metros de la Av. Ángel Gallardo, a 500 metros del Parque Centenario, cercano a líneas de colectivos, subtes A y B, hospitales, farmacias, colegios, restaurantes, comercios, supermercados. Rau S. R. L. No ejerce el corretaje inmobiliario. El presente sitio web es una plataforma en donde cada oficina inmobiliaria independiente que contrata los servicios re/max puede publicar las propiedades a su cargo. Cada oficina es de propiedad y gestión independiente, por lo que rau S. R. L. No interviene en los datos de la publicación, en la operación inmobiliaria, ni en la confección y/o firma del boleto de compraventa y/o escritura y/o contrato de alquiler. En cumplimiento de las leyes vigentes que regulan el corretaje inmobiliario, Ley Nacional 25. 028, Ley 22. 802 de Lealtad Comercial, Ley 24. 240 de Defensa al Consumidor, las normas del Código Civil y Comercial de la Nación y Constitucionales, los agentes/gestores no ejercen el corretaje inmobiliario. Todas las operaciones inmobiliarias son objeto de intermediación y conclusión por parte del corredor público inmobiliario colegiado a cargo de la publicación, cuyos datos se exhiben en la presente. La presente publicación describe las características esenciales del inmueble, debiéndose consultar al corredor público inmobiliario responsable de la operación por la eventual actualización de las medidas, descripciones arquitectónicas y funcionales, valores de expensas, servicios, impuestos, precios y demás información, cuyos valores son aproximados. Para los casos de alquiler de vivienda, el monto máximo de comisión que se le puede requerir a los propietarios será el equivalente al cuatro con quince centésimos por ciento (4, 15%) del valor total del respectivo contrato. Se encuentra prohibido cobrar a los inquilinos que sean personas físicas comisiones inmobiliarias y gastos de gestoría de informes. El inmueble es accesible para personas con discapacidades físicas. Contactar
2026-07-21;4;59285453;2026-06-23;28;False;;;;Flores;Helguera 350 Flores Norte, Flores Gran;$ 900.000;ARS;120000.0;100;4;3.0;1.0;9000.0;False;False;False;False;False;False;True;https://www.zonaprop.com.ar/propiedades/clasificado/alclapin-departamento-helguera-y-avellaneda!-59285453.html?n_src=Listado&n_pills=Encargado&n_pg=4&n_pos=15&n_search_id=93c63083-4cf7-428d-b50b-54786cde6985;;$ 900.000 $ 120.000 Expensas 100 m² tot. 4 amb. 3 dorm. 1 baño Helguera 350 Flores Norte, Flores Gran departamento disponible al frente, con 4 amplios ambientes. Ubicado en el barrio de flores, departamento muy luminoso a gran precio. Cuenta con 4 ambientes, 3 habitaciones, living-comedor y una gran cocina con espacio para una meza y sillas. A metros de avenida Avellaneda, gran punto de facil acceso. WhatsApp Contactar
2026-07-21;4;59567755;2026-07-08;13;False;;;;Villa General Mitre;Luis Viale 2112 Villa General Mitre, Capital Federal Descripción: Excelente;$ 1.400.000;ARS;249000.0;87;4;3.0;1.0;16092.0;False;True;False;False;False;False;True;https://www.zonaprop.com.ar/propiedades/clasificado/alclapin-excelente-4-amb-con-balcon-contra-frente-59567755.html?n_src=Listado&n_pills=Lavadero&n_pg=4&n_pos=17&n_search_id=93c63083-4cf7-428d-b50b-54786cde6985;;"$ 1.400.000 $ 249.000 Expensas 87 m² tot. 4 amb. 3 dorm. 1 baño Luis Viale 2112 Villa General Mitre, Capital Federal Descripción: Excelente Departamento de 4 ambientes al contra frente con balcón, en Edificio Torre (todos los ambientes ventilan al exterior) a una cuadra de Avda. Gaona y a tres de Av. Juan B. Justo. Hall de entrada, Estar-comedor muy amplio con piso de madera y salida a balcón de 2x2 con vista abierta, Toilette de recepción, tres amplios dormitorios con grandes placares e interiores marca reno, Cocina con muebles completos e impecables con comedor diario incorporado y doble circulación, super luminoso, Baño completo. Servicios agua caliente por caldera central y calefacción individual con estufas tiro balanceado. Edificio: Buen edificio de 12 pisos, 4 departamentos por piso, 2 Ascensor automáticos, antigüedad 10 años, Vigilancia. 2 encargados. Requisitos: Garantía de caba familiar directo y recibo de sueldo, familia tipo de matrimonio y dos hijos sin mascotas. Requisitos: Garantia Propietaria de Familiar, Recibo de Sueldo, Mes de adelanto y Mes de deposito. Sin Mascotas. -Se deja constancia que los metros cuadrados indicados son aproximados, al igual que las medidas parciales de los ambientes. El precio del inmueble puede ser modificado sin previo aviso. Fotos de carácter no contractual. - vidarte propiedades ""matricula numero: 3147 Contactar"
2026-07-21;4;59576458;2026-07-08;13;False;;;;Caballito;Hidalgo 1000 Caballito, Capital Federal Corredor Responsable: blanco vazquez S. R. L. - Maria Eugenia Blanco cucicba 7834 / Andrea Vazquez cmcpsi 6257- Contacto: Javier Lionel Salamone. Excelente;$ 1.900.000;ARS;300000.0;78;4;3.0;1.0;24359.0;False;True;True;False;False;False;False;https://www.zonaprop.com.ar/propiedades/clasificado/alclapin-alquier-dpto-4-amb-c-cochera-caballito-59576458.html?n_src=Listado&n_pills=Lavadero&n_pg=4&n_pos=18&n_search_id=93c63083-4cf7-428d-b50b-54786cde6985;;$ 1.900.000 $ 300.000 Expensas 78 m² tot. 4 amb. 3 dorm. 1 baño 1 coch. Hidalgo 1000 Caballito, Capital Federal Corredor Responsable: blanco vazquez S. R. L. - Maria Eugenia Blanco cucicba 7834 / Andrea Vazquez cmcpsi 6257- Contacto: Javier Lionel Salamone. Excelente departamento de 4 ambientes al frente 5to piso con cochera. Living comedor con salida al balcón. Cocina amplia al contra-frente con muebles completos bajo mesada y alacenas con lavadero. Dormitorio principal al frente, con placard, segundo y tercer dormitorio con sus placares. Placard de recepción en el hall de distribución. Baño completo con bañera. Toilette. Cochera cubierta fija. Condiciones: Contrato de 2 a 3 años a coordinar. Ajustes trimestrales por ipc. Disponibilidad inmediata. Transportes Cercanos. Colectivos: 15, 24, 36, 42, 55, 57, 76, 92, 99, 105, 106, 110, 119, 124, 135, 141, 146. Datos útiles. Barrio: Caballito. Comuna: Comuna 6. Área Hospitalaria: htal. Dr. C. G. Durand. Comisaría Comunal: 6. Comisaría Vecinal: 6A. Distrito Escolar: Distrito Escolar vii. rau S. R. L. No ejerce el corretaje inmobiliario. El presente sitio web es una plataforma en donde cada oficina inmobiliaria independiente que contrata los servicios re/max puede publicar las propiedades a su cargo. Cada oficina es de propiedad y gestión independiente, por lo que rau S. R. L. No interviene en los datos de la publicación, en la operación inmobiliaria, ni en la confección y/o firma del boleto de compraventa y/o escritura y/o contrato de alquiler. En cumplimiento de las leyes vigentes que regulan el corretaje inmobiliario, Ley Nacional 25. 028, Ley 22. 802 de Lealtad Comercial, Ley 24. 240 de Defensa al Consumidor, las normas del Código Civil y Comercial de la Nación y Constitucionales, los agentes/gestores no ejercen el corretaje inmobiliario. Todas las operaciones inmobiliarias son objeto de intermediación y conclusión por parte del corredor público inmobiliario colegiado a cargo de la publicación, cuyos datos se exhiben en la presente. La presente publicación describe las características esenciales del inmueble, debiéndose consultar al corredor público inmobiliario responsable de la operación por la eventual actualización de las medidas, descripciones arquitectónicas y funcionales, valores de expensas, servicios, impuestos, precios y demás información, cuyos valores son aproximados. Para los casos de alquiler de vivienda, el monto máximo de comisión que se le puede requerir a los propietarios será el equivalente al cuatro con quince centésimos por ciento (4, 15%) del valor total del respectivo contrato. Se encuentra prohibido cobrar a los inquilinos que sean personas físicas comisiones inmobiliarias y gastos de gestoría de informes. El inmueble no es accesible para personas con discapacidades físicas. Contactar
2026-07-21;4;59473125;2026-06-26;25;False;;;;Caballito;Yerbal 400 Caballito, Capital Federal 4 Ambientes con Cochera en lo Mejor de Caballito! - Súper Luminoso y Pet Friendly. Alquiler: $ 1. 500. 000 (Alquiler sin muebles) Expensas: $ 340. 000. Características Principales. Superficie: 130 m² totales (130 m² cubiertos). Disposición: Frente (Orientación Norte, luz natural garantizada todo el día). Ambientes: 4 (Gran living comedor y 3 dormitorios amplios). Baños: 3 completos (ideal para familias). Cochera: 1 cochera privada cubierta incluida. Antigüedad: 35 años (sólida construcción, impecable estado de conservación). Mascotas: ¡Muy bienvenidas! Descripción del Inmueble. Si buscás amplitud, luminosidad y una ubicación estratégica, este;$ 1.500.000;ARS;340000.0;130;4;3.0;3.0;11538.0;True;True;True;False;False;False;True;https://www.zonaprop.com.ar/propiedades/clasificado/alclapin-alquiler-departamento-4-ambientes-en-caballito-59473125.html?n_src=Listado&n_pills=Permite+mascotas&n_pg=4&n_pos=20&n_search_id=93c63083-4cf7-428d-b50b-54786cde6985;;$ 1.500.000 $ 340.000 Expensas 130 m² tot. 4 amb. 3 dorm. 3 baños 1 coch. Yerbal 400 Caballito, Capital Federal 4 Ambientes con Cochera en lo Mejor de Caballito! - Súper Luminoso y Pet Friendly. Alquiler: $ 1. 500. 000 (Alquiler sin muebles) Expensas: $ 340. 000. Características Principales. Superficie: 130 m² totales (130 m² cubiertos). Disposición: Frente (Orientación Norte, luz natural garantizada todo el día). Ambientes: 4 (Gran living comedor y 3 dormitorios amplios). Baños: 3 completos (ideal para familias). Cochera: 1 cochera privada cubierta incluida. Antigüedad: 35 años (sólida construcción, impecable estado de conservación). Mascotas: ¡Muy bienvenidas! Descripción del Inmueble. Si buscás amplitud, luminosidad y una ubicación estratégica, este departamento es para vos. Ubicado en el corazón de Caballito, en la zona más comercial y conectada del barrio, a tan solo pasos del nodo Av. Rivadavia y Av. Acoyte. Tendrás a disposición el Subte Línea A, innumerables líneas de colectivo y una oferta comercial y gastronómica inigualable. El departamento destaca por su excelente estado de mantenimiento y su distribución funcional: Living-comedor de gran tamaño con salida a un amplio balcón a la calle, perfecto para disfrutar de la vista abierta y la excelente orientación Norte. 3 dormitorios cómodos con muy buen espacio de guardado. 3 baños perfectamente distribuidos. Cocina independiente y funcional, con excelente ventilación. Todo el departamento es súper luminoso y se entrega en perfectas condiciones, listo para habitar. Condiciones del Alquiler. Tipo de contrato: Alquiler tradicional (2 años). Requisitos de ingreso: Únicamente con Seguro de Caución o Garantía Propietaria de caba. ¿Te interesa coordinar una visita? Dejanos tu consulta y nos comunicamos con vos a la brevedad. ¡No te pierdas la oportunidad de vivir en una de las mejores zonas de Buenos Aires! WhatsApp Contactar
2026-07-21;4;50168343;2026-06-23;28;False;;;;Caballito;ROSARIO 758 Caballito Norte, Caballito Semipiso,;$ 1.000.000;ARS;300000.0;91;4;3.0;2.0;10989.0;False;True;False;False;False;False;True;https://www.zonaprop.com.ar/propiedades/clasificado/alclapin-caballito:venta-o-alquiler-3-ambientes-c-dependencia-50168343.html?n_src=Listado&n_pills=Aire+acondicionado&n_pg=4&n_pos=21&n_search_id=93c63083-4cf7-428d-b50b-54786cde6985;;"$ 1.000.000 $ 300.000 Expensas 91 m² tot. 4 amb. 3 dorm. 2 baños ROSARIO 758 Caballito Norte, Caballito Semipiso, excelente dto muy luminoso, A mts de av rivadavia Y san jose de calasanz, al frente con balcon corrido, 3 baños, calefaccion central, muy confortable pleno centro comercial. Mat; 5370 cucicba. Contactar"
2026-07-21;4;52487866;2026-06-23;28;False;;;;Floresta;Rivadavia 8000 Floresta, Capital Federal Amplio;$ 800.000;ARS;280000.0;90;4;3.0;2.0;8889.0;False;True;False;False;False;False;False;https://www.zonaprop.com.ar/propiedades/clasificado/alclapin-av-rivadavia-8000-departamento-de-4-ambientes-52487866.html?n_src=Listado&n_pills=Lavadero&n_pg=4&n_pos=22&n_search_id=93c63083-4cf7-428d-b50b-54786cde6985;;"$ 800.000 5% $ 280.000 Expensas 90 m² tot. 4 amb. 3 dorm. 2 baños Rivadavia 8000 Floresta, Capital Federal Amplio departamento ubicado en el corazón de floresta en un piso 10 con disposición al frente. El mismo posee doble circulación, 3 dormitorios (todos con placards y espacio de guardado), 2 baños de los cuales 1 es completo) y balcón corrido, amplia cocina, dependencia de servicio con baño propio (que puede ser una cuarta habitación o escritorio) y lavadero. Sobre Avenida Rivadavia, a tan solo 3 cuadras de la estación Floresta del Ferrocarril Sarmiento y a 5 cuadras de la estación de subte San Pedrito (Línea A). Maximiliano Avila Mat. N° 4887 Inciso 8 del artículo 10 de la Ley 2340 (texto consolidado según Ley N° 5666). Para los casos de alquiler de vivienda, el monto máximo de comisión que se le puede requerir a los propietarios será el equivalente al cuatro con quince centésimos por ciento (4, 15) del valor total del respectivo contrato. Se encuentra prohibido cobrar a los inquilinos que sean personas físicas comisiones inmobiliarias y gastos de gestoría de informes"", segun Art. 4 de la Ley 5. 859 de C. A. B. A. El edificio no cuenta con accesibilidad para personas con movilidad reducida (Ley 5115) ” WhatsApp Contactar"
2026-07-21;4;59462529;2026-06-25;26;False;;;;Flores;Avenida Varela 800 Flores, Capital Federal Corredor Responsable: Sebastián Morales – cmcpsi 7280. - Contacto: Diego Prelog.;$ 1.500.000;ARS;200000.0;78;4;3.0;1.0;19231.0;True;True;True;False;False;False;False;https://www.zonaprop.com.ar/propiedades/clasificado/alclapin-alquiler-departamento-4-ambientes-cochera-flores-59462529.html?n_src=Listado&n_pills=Aire+acondicionado&n_pg=4&n_pos=23&n_search_id=93c63083-4cf7-428d-b50b-54786cde6985;;"$ 1.500.000 $ 200.000 Expensas 78 m² tot. 4 amb. 3 dorm. 1 baño 1 coch. Avenida Varela 800 Flores, Capital Federal Corredor Responsable: Sebastián Morales – cmcpsi 7280. - Contacto: Diego Prelog. departamento 4 ambientes con cochera descubierta en piso 9 en alquiler - flores - capital federal. Departamento de 78 m² ubicado sobre Avenida Varela en el barrio de Flores, emplazado en el noveno piso de un edificio de 10 niveles construido en 1994. Excelente ubicación con acceso inmediato a la autopista 25 de Mayo, estación de subte, múltiples líneas de colectivo y Avenida Directorio. La propiedad mantiene su estructura original en muy buen estado de conservación, distribuida en 4 ambientes con tres dormitorios, un baño completo, toilette, cocina separada y living/comedor con balcón de orientación este. Los pisos de madera en habitaciones se complementan con placard en cada dormitorio y otro adicional en el living. El edificio cuenta con dos ascensores, representando un valor agregado para los residentes. La disposición frente permite una óptima iluminación natural. Entre sus características destacan aire acondicionado, servicios completos de electricidad, agua, gas y desagüe cloacal. Incluye cochera, elemento diferencial para quienes valoran estacionamiento propio en zona céntrica. Vista panorámica 180°. Expensas: incluyen Agua (aysa) y expensas de cochera (descubierta). Encargado con vivienda en el edificio. Condiciones de alquiler: - Plazo contractual: 2 años. - Un mes de adelanto. - Depósito de 1 mes en dólares. - Ajuste por ipc trimestral. - Ingresos demostrables. - Garantía: seguro de caución. A una cuadra de estación \""Varela\"" de subte línea E, 8 cuadras de plaza Flores y estación \""San José de Flores\"" de subte línea A. A 3 cuadras de importante centro comercial, supermercados y otros negocios de cercanía en el radio de 1 cuadra. Zona y cuadra del edificio con vigilancia policial las 24 hs. Importante: !! No se admiten mascotas! Rau S. R. L. No ejerce el corretaje inmobiliario. El presente sitio web es una plataforma en donde cada oficina inmobiliaria independiente que contrata los servicios re/max puede publicar las propiedades a su cargo. Cada oficina es de propiedad y gestión independiente, por lo que rau S. R. L. No interviene en los datos de la publicación, en la operación inmobiliaria, ni en la confección y/o firma del boleto de compraventa y/o escritura y/o contrato de alquiler. En cumplimiento de las leyes vigentes que regulan el corretaje inmobiliario, Ley Nacional 25. 028, Ley 22. 802 de Lealtad Comercial, Ley 24. 240 de Defensa al Consumidor, las normas del Código Civil y Comercial de la Nación y Constitucionales, los agentes/gestores no ejercen el corretaje inmobiliario. Todas las operaciones inmobiliarias son objeto de intermediación y conclusión por parte del corredor público inmobiliario colegiado a cargo de la publicación, cuyos datos se exhiben en la presente. La presente publicación describe las características esenciales del inmueble, debiéndose consultar al corredor público inmobiliario responsable de la operación por la eventual actualización de las medidas, descripciones arquitectónicas y funcionales, valores de expensas, servicios, impuestos, precios y demás información, cuyos valores son aproximados. Para los casos de alquiler de vivienda, el monto máximo de comisión que se le puede requerir a los propietarios será el equivalente al cuatro con quince centésimos por ciento (4, 15%) del valor total del respectivo contrato. Se encuentra prohibido cobrar a los inquilinos que sean personas físicas comisiones inmobiliarias y gastos de gestoría de informes. El inmueble no es accesible para personas con discapacidades físicas. Contactar"
2026-07-21;4;59592825;2026-07-12;9;False;;;;Caballito;ROSARIO 162. Entre Senillosa y Doblas Caballito, Capital Federal Alquiler de;$ 1.200.000;ARS;170000.0;89;4;2.0;2.0;13483.0;False;True;False;False;False;False;False;https://www.zonaprop.com.ar/propiedades/clasificado/alclapin-departamento-4-ambientes-2-dorm.-rosario-al-100-59592825.html?n_src=Listado&n_pg=4&n_pos=24&n_search_id=93c63083-4cf7-428d-b50b-54786cde6985;;$ 1.200.000 $ 170.000 Expensas 89 m² tot. 4 amb. 2 dorm. 2 baños ROSARIO 162. Entre Senillosa y Doblas Caballito, Capital Federal Alquiler de Departamento 4 ambientes en Caballito, Capital Federal. doble circulación, acceso de servicio a la cocina comedor diario, y portada principal al liviing comedor, hall intimo, 2 amplios dormitorios con placar, 3ra habitación o escritorio (esta adaptada mas para esta utilización), baño completo, baño auxiliar, balcón con protección, cocina completa con amoblamiento de mesada bajo mesada y alacenas, purificadorxintel(mco-mco-5179) WhatsApp Contactar
