fecha;pagina;id_aviso;fecha_primera_vista;dias_desde_primera_vista;nueva_publicacion;publicado_zonaprop_raw;fecha_publicacion_zonaprop;antiguedad_zonaprop_dias;barrio;direccion;precio_raw;moneda;expensas;m2;ambientes;dormitorios;banos;precio_m2;mascotas;balcon;cochera;terraza;pileta;parrilla;luminoso;url;imagen;texto
2026-07-12;5;59480770;2026-07-04;8;False;Publicado hace 16 días;2026-06-26;16.0;Caballito;"Avenida San Martin 2130 Caballito Norte, Caballito A metros del cruce entre la avenida San Martin y la Avenida Juan B. Justo, con innumerables lineas de colectivos que nos conectan con toda la Capital Federal, comercios, establecimientos educativos y parques, ofrecemos esta cómoda unidad que cuenta con una entrada por el living comedor con acceso al balcón, y otra de servicio a la cocina. Grande y con comedor diario. En las fotos se aprecia el amplio amueblamiento. Lavadero y cuarto de servicio con su toilette. Los dormitorios, dos ventilando al frente y otro al aire y luz, todos con placard. Baño completo y toilette en el pasillo. Una unidad atractiva por lo funcional, con la comodidad de la calefacción central. Contrato a dos años, actualizado cuatrimestralmente por ipcba. Requisitos: -Garantía propietaria o seguro de caución. -Demostración de ingresos. -Mes adelantado. -Mes de depósito a valor inicial, o en dólares fijo. -Certificación de firmas e informes (pueden ser brindandos por la persona reservante) no cobramos comisión. ""Propiedad no accesible para personas con movilidad reducida Ley 5115"" Servicios: Electricidad, Cloacas, Gas, Agua Corriente. Otros Servicios: Dependencia, Balcón. Las Imágenes son meramente ilustrativas, no contractuales. Las superficies, medidas y expensas aquí citadas son aproximadas al solo efecto informativo y no resultan vinculantes, las reales serán las que surgen de planos, título de propiedad y recibo de expensas que deberán ser suministrados por el propietario. El valor de expensas está sujeto a variación. El precio del inmueble puede ser modificado sin previo aviso. Kon propiedades matricula cucicba 3670";$ 1.150.000;ARS;426000.0;80;4;3;3;14375;False;True;False;False;False;False;False;https://www.zonaprop.com.ar/propiedades/clasificado/alclapin-alquiler-cuatro-ambientes-excelente-zona-59480770.html?n_src=Listado&n_pills=Laundry&n_pg=5&n_pos=9&n_search_id=c6c2b646-2fbf-41b5-933d-060b61caa1bf;;"$ 1.150.000 8% $ 426.000 Expensas 80 m² tot. 4 amb. 3 dorm. 3 baños Avenida San Martin 2130 Caballito Norte, Caballito A metros del cruce entre la avenida San Martin y la Avenida Juan B. Justo, con innumerables lineas de colectivos que nos conectan con toda la Capital Federal, comercios, establecimientos educativos y parques, ofrecemos esta cómoda unidad que cuenta con una entrada por el living comedor con acceso al balcón, y otra de servicio a la cocina. Grande y con comedor diario. En las fotos se aprecia el amplio amueblamiento. Lavadero y cuarto de servicio con su toilette. Los dormitorios, dos ventilando al frente y otro al aire y luz, todos con placard. Baño completo y toilette en el pasillo. Una unidad atractiva por lo funcional, con la comodidad de la calefacción central. Contrato a dos años, actualizado cuatrimestralmente por ipcba. Requisitos: -Garantía propietaria o seguro de caución. -Demostración de ingresos. -Mes adelantado. -Mes de depósito a valor inicial, o en dólares fijo. -Certificación de firmas e informes (pueden ser brindandos por la persona reservante) no cobramos comisión. ""Propiedad no accesible para personas con movilidad reducida Ley 5115"" Servicios: Electricidad, Cloacas, Gas, Agua Corriente. Otros Servicios: Dependencia, Balcón. Las Imágenes son meramente ilustrativas, no contractuales. Las superficies, medidas y expensas aquí citadas son aproximadas al solo efecto informativo y no resultan vinculantes, las reales serán las que surgen de planos, título de propiedad y recibo de expensas que deberán ser suministrados por el propietario. El valor de expensas está sujeto a variación. El precio del inmueble puede ser modificado sin previo aviso. Kon propiedades matricula cucicba 3670 WhatsApp Contactar"
2026-07-12;5;59576758;2026-07-12;0;True;Publicado hace 4 días;2026-07-08;4.0;Floresta;Baradero 0 Floresta, Capital Federal Corredor Responsable: Fiorella Velardez cpi 8214 / cmcpdjlm 1022- Contacto: Roxana Lemmi.;$ 1.400.000;ARS;200000.0;145;4;3;1;9655;False;True;False;False;False;True;True;https://www.zonaprop.com.ar/propiedades/clasificado/alclapin-alquiler-departamento-4-amb-con-parrilla-floresta-59576758.html?n_src=Listado&n_pills=Lavadero&n_pg=5&n_pos=10&n_search_id=c6c2b646-2fbf-41b5-933d-060b61caa1bf;;$ 1.400.000 $ 200.000 Expensas 145 m² tot. 4 amb. 3 dorm. 1 baño Baradero 0 Floresta, Capital Federal Corredor Responsable: Fiorella Velardez cpi 8214 / cmcpdjlm 1022- Contacto: Roxana Lemmi. departamento 4 ambientes en alquiler floresta capital federal. Departamento ubicado en el piso 11 de un edificio de 12 pisos sobre la avenida Baradero, en la zona de Floresta. La propiedad cuenta con 145 m² de superficie total, distribuidos en 85 m² cubiertos, 24 m² semicubiertos y 36 m² descubiertos que conforman espacios versátiles y luminosos. La distribución comprende 4 ambientes principales: 3 dormitorios, 1 baño completo, 1 toilette, living comedor integrado con cocina, lavadero y balcón. Todos los espacios se encuentran en muy buen estado de conservación, con placard en dormitorios y orientación este que garantiza excelente iluminación natural durante la mayor parte del día. El edificio, construido en 1983, mantiene una estructura sólida y funcional. La ubicación estratégica sobre Baradero ofrece acceso directo a comercios, transporte público y servicios de la zona. El balcón y la parrilla privada constituyen espacios adicionales ideales para disfrutar del aire libre sin abandonar la comodidad del hogar. Esta propiedad resulta especialmente atractiva para familias que buscan una vivienda con buena relación de espacios, en un barrio consolidado con infraestructura completa y proximidad a centros educativos y de salud. La altura del piso proporciona privacidad y vistas despejadas, características valoradas en el mercado inmobiliario actual. Rau S. R. L. No ejerce el corretaje inmobiliario. El presente sitio web es una plataforma en donde cada oficina inmobiliaria independiente que contrata los servicios re/max puede publicar las propiedades a su cargo. Cada oficina es de propiedad y gestión independiente, por lo que rau S. R. L. No interviene en los datos de la publicación, en la operación inmobiliaria, ni en la confección y/o firma del boleto de compraventa y/o escritura y/o contrato de alquiler. En cumplimiento de las leyes vigentes que regulan el corretaje inmobiliario, Ley Nacional 25. 028, Ley 22. 802 de Lealtad Comercial, Ley 24. 240 de Defensa al Consumidor, las normas del Código Civil y Comercial de la Nación y Constitucionales, los agentes/gestores no ejercen el corretaje inmobiliario. Todas las operaciones inmobiliarias son objeto de intermediación y conclusión por parte del corredor público inmobiliario colegiado a cargo de la publicación, cuyos datos se exhiben en la presente. La presente publicación describe las características esenciales del inmueble, debiéndose consultar al corredor público inmobiliario responsable de la operación por la eventual actualización de las medidas, descripciones arquitectónicas y funcionales, valores de expensas, servicios, impuestos, precios y demás información, cuyos valores son aproximados. Para los casos de alquiler de vivienda, el monto máximo de comisión que se le puede requerir a los propietarios será el equivalente al cuatro con quince centésimos por ciento (4, 15%) del valor total del respectivo contrato. Se encuentra prohibido cobrar a los inquilinos que sean personas físicas comisiones inmobiliarias y gastos de gestoría de informes. El inmueble no es accesible para personas con discapacidades físicas. Contactar
2026-07-12;5;58677063;2026-06-23;19;False;Publicado hace 109 días;2026-03-25;109.0;Villa del Parque;Álvarez Jonte 2909 Villa del Parque, Capital Federal;$ 1.290.000;ARS;300000.0;110;4;3;1;11727;False;False;False;False;False;False;True;https://www.zonaprop.com.ar/propiedades/clasificado/alclapin-alvarez-jonte-2900-depto-4-ambientes-mas-dependencia-58677063.html?n_src=Listado&n_pills=Lavadero&n_pg=5&n_pos=11&n_search_id=c6c2b646-2fbf-41b5-933d-060b61caa1bf;;$ 1.290.000 $ 300.000 Expensas 110 m² tot. 4 amb. 3 dorm. 1 baño Álvarez Jonte 2909 Villa del Parque, Capital Federal Departamento 4 ambientes con dependencia, cocina con comedor diario, Gran living en L con vista al frente, orientación este, muy luminoso, 1 baño completo, 1 toilette y 1 baño de servicio, lavadero. Entrada de servicio. Excelente ubicación, av nazca y alvarez jonte. Requisitos: -D1. 000 de deposito. -Garantia propietaria de caba, o seguro de caucion respaldar. -Aumento cuatrimestral por indice ipc. -Ingresos demostrables. -Grupo familiar acorde a la unidad. -Seguro contra incendio. -No acepta mascotas. -Comisión a cargo de los propietarios. Para los casos de alquiler de vivienda, el monto máximo de comisión que se le puede requerir a los propietarios será el equivalente al cuatro con quince centésimos por ciento (4, 15%) del valor total del respectivo contrato. Se encuentra prohibido cobrar a los inquilinos que sean personas físicas comisiones inmobiliarias y gastos de gestoría de informes. Matricula Nº 1589. WhatsApp Contactar
2026-07-12;5;59518291;2026-07-04;8;False;Publicado hace 11 días;2026-07-01;11.0;Floresta;Av Avellaneda A al 3900 Floresta, Capital Federal Excelente;$ 950.000;ARS;290000.0;81;4;3;2;11728;False;False;False;False;False;False;True;https://www.zonaprop.com.ar/propiedades/clasificado/alclapin-departamento-en-floresta-59518291.html?n_src=Listado&n_pills=Encargado&n_pg=5&n_pos=13&n_search_id=c6c2b646-2fbf-41b5-933d-060b61caa1bf;;$ 950.000 $ 290.000 Expensas 81 m² tot. 4 amb. 3 dorm. 2 baños Av Avellaneda A al 3900 Floresta, Capital Federal Excelente departamento de cuatro ambientes en alquiler, con una hermosa vista abierta, muy aireado y luminoso. La propiedad cuenta con amplios ambientes, todos con placares, ofreciendo comodidad y una excelente distribución. Dispone de una cómoda cocina con comedor diario y lavadero independiente, ideal para el uso cotidiano. Su luminosidad y ventilación natural hacen de esta unidad una excelente opción para vivir. Contrato a 24 meses con actualización trimestral por ipc. Se acepta seguro de caución. Venga a visitarlo. cucicba 142Diro PropiedadesAgente Raúl Maleh WhatsApp Contactar
2026-07-12;5;53215454;2026-07-02;10;False;Publicado hace 11 días;2026-07-01;11.0;Caballito;Guayaquil 282 Parque Rivadavia, Caballito Te presentamos este hermoso;$ 1.600.000;ARS;290000.0;84;4;3;1;19048;False;False;False;False;False;False;True;https://www.zonaprop.com.ar/propiedades/clasificado/alclappa-excelente-dpto-4-ambientes-parque-rivadavia-53215454.html?n_src=Listado&n_pills=Aire+acondicionado&n_pg=5&n_pos=15&n_search_id=c6c2b646-2fbf-41b5-933d-060b61caa1bf;;$ 1.600.000 $ 290.000 Expensas 84 m² tot. 4 amb. 3 dorm. 1 baño Guayaquil 282 Parque Rivadavia, Caballito Te presentamos este hermoso departamento de 4 ambientes ubicado en la mejor zona del barrio. Los metros del departamento están excelentemente aprovechados!! Con tres amplias habitaciones y un luminoso living, ofrece el espacio perfecto para tu familia. Con un baño completo y un toilet, además de una cocina y comedor muy amplio, tendrás todo lo que necesitas para vivir cómodamente. Además, cuenta con un lavadero separado para mayor comodidad. Disfruta de la vista al frente y la conveniencia de estar a solo dos cuadras de Av. Rivadavia y una cuadra del emblemático Parque Rivadavia. ¡No dejes pasar esta oportunidad de hacer de este departamento tu nuevo hogar! Contáctanos hoy para más información. Contactar
2026-07-12;5;58369578;2026-06-23;19;False;Publicado hace 145 días;2026-02-17;145.0;Floresta;Moron 4114 Floresta, Capital Federal Morón 4114 entre Gualeguaychu y Sanabria. fines comerciales unicamente. no apto para vivienda.;USD 1.000;USD;;225;4;3;2;6667;False;True;True;True;False;False;False;https://www.zonaprop.com.ar/propiedades/clasificado/alclcain-no-dan-puntada-sin-nudo.-solo-fines-comerciales-58369578.html?n_src=Listado&n_pills=Parrilla&n_pg=5&n_pos=17&n_search_id=c6c2b646-2fbf-41b5-933d-060b61caa1bf;;USD 1.000 225 m² tot. 4 amb. 3 dorm. 2 baños 1 coch. Moron 4114 Floresta, Capital Federal Morón 4114 entre Gualeguaychu y Sanabria. fines comerciales unicamente. no apto para vivienda. alquiler u$s 1. 000 mensuales. ajustes A convenir. fundamental. garantia propietaria en lo posible familiar directo de quien alquile con inmueble en caba e ingresos demostrables reales. contrato 24 meses. Inmejorable ubicación en el corazón de floresta muy cerquita a próspero centro textil. a una cuadrita Avda. Gaona 4600. a 150 metros Avda. Segurola al 600. a doscientos pasos Av. Avellaneda al 4000 y a no más de cuatro cuadritas de la mítica Plaza velez sarsfield donde hay desde la Estación Saludable del gcba hasta la Iglesia de la candelaria e importante supermercado. opinion y analisis de Inmobiliaria ricardi. se trata de una hermosa casa en lote propio - toda en bajos - reciclada toda pero toda A nuevo - no quedo nada de la casa primitiva, está im-pe-ca- ble cuidadita y en condiciones, si bien conserva la distribución original tipo chorizo fue íntegramente remodelada a nueva, los actuales dueños la han hecho a nuevo - literal - edificando un consultorio que puede ser perfectamente un eventual tercer dormitorio, o escritorio, con un recibidor y-o con sala de espera en la parte delantera de la finca, una regia cochera cubierta y dos dormitorios uno de ellos con vestidor y otro con un placar divino de pared a pared y de piso a techo, una regia cocina y comedor de diario contiguo, un patio interior divino con cerramiento corredizo transformado en otro ambiente más tipo estar, además de un soleado patio trasero donde no falta un ambiente tipo quincho y acceso a la terraza con otra habitación auxiliar, todo pipiqq como para mudarse sin hacer arreglo alguno. Los actuales propietarios - de la mano de su hijo - han reciclado con esmero, dedicación y buen gusto un reciclado integral y cuidadoso de todos los ambientes dando como resultado una casa muy cómoda y con la ventaja de tener exteriormente una discreción total que la hace pasar desapercibida totalmente a la casa. - lote 8, 66x25, 98 son 225 m2 de tierra y tiene edificados 174 m2 cubiertos orientada al norte - con un sol divino. según codigo de edificacion. Unidades de Sustentabilidad de Altura Baja 1. Son las áreas de la ciudad de alturas menores, adecuadas para el desarrollo principalmente de actividades residenciales. Altura Máxima: 9 metros. Altura de Planta Baja mínima: 2, 60 metros, la cual no podrá tener una cota inferior a cero en los primeros 8 metros de fondo contados desde la Línea Oficial con excepción de rampas vehiculares y escaleras. La altura podrá variar si: existe algún edificio lindero Catalogado (Artículo 3. 6 Anexo ii) o la altura del edificio lindero es mayor a la de la Unidad de Edificabilidad (Artículo 6. 5. 5). Área de Media Mixtura de Usos del Suelo 2. Corresponde a las áreas y corredores destinados a residencia, servicios y comercios de mediana afluencia. Ambientes: Baño completo (2. 43x1. 27) Cochera cubierta (2. 5x5. 64) Cocina comedor (4. 37x4. 07) Dormitorio (4. 02x2. 42) Dormitorio con placard (3. 84x3) Hall de entrada (1. 85x3. 37) Patio descubierto (2. 5x9. 39) Servicios: Electricidad, Pavimento, Cloacas, Gas, Agua Corriente. Otros Servicios: Lavadero, Reciclado, Terraza. letra chica ( se recomienda leer) La venta se realiza de acuerdo a superficies y constancias obrantes en los títulos de propiedad y-o planos del inmueble. El presente plano grafico que se reproduce en esta publicación no es preciso y es dibujado por la Inmobiliaria ricardi para la comercialización del inmueble. Los metros cuadrados y medidas aquí indicadas son aproximadas y para uso interno de la Inmobiliaria ricardi quien declina toda su responsabilidad por su eventual no coincidencia con las del título de propiedad y-o plano/s aprobado/s y-o por la simple inexistencia de los mismos. - La Inmobiliaria ricardi no garantiza que el inmueble cumpla con el certificado de conservación de fachadas y balcones (Ley 257) tampoco efectúa el estudio de títulos, ni analiza los alcances del Código de edificación y no será responsable por los vicios ocultos o redhibitorios que competen a quien corresponda. Advertimos al adquirente que las instalaciones eléctricas, de gas natural y-o sanitarias pueden no solo no tener un correcto y adecuado funcionamiento técnico sino que además puede no cumplir con las exigencias actuales de metrogas- edesur- edenor - siendo a cargo del adquirente que implique su puesta en valor y-o funcionamiento. El valor de las expensas e impuestos quedan sujetos a cambios y-o ajustes. El precio y condiciones de venta pueden ser modificados sin previo aviso. Las fotos e imágenes son de carácter no contractual y se exhiben a los fines publicitarios y son meramente ilustrativas. El inmueble publicitado se encuentra está sujeto a disponibilidad y la Inmobiliaria ricardi actúa como comercializador del inmueble., siendo bajo responsabilidad del propietario la tramitación del coti. Comercializa Inmobiliaria ricardi. atencion virtual los 365 días del año. ( Incluso sábados domingos y feriados) Siempre de 10 a 13 y 16 a 20 horas. Nos puede pedir que le enviemos por correo electrónico y-o por Whatsapp fotos plano de relevamiento con medidas y video del inmueble. No somos los primeros. no somos los mejores. no somos los unicos. somos Inmobiliaria ricardi. cucicba Matricula 79. compartimos el 50% de los honorarios del comprador con todos los matriculados de cucicba. ladrillos. La inversión más segura y confiable. Ayer hoy y siempre. WhatsApp Contactar
2026-07-12;5;59492302;2026-07-02;10;False;Publicado hace 14 días;2026-06-28;14.0;Caballito;Del Barco Centenera 345 Primera Junta, Caballito 4 ambientes reciclado A nuevo con balcón Y vista abierta - piso 17 - caballito. excelente;$ 1.300.000;ARS;200000.0;67;4;3;1;19403;False;True;True;False;False;False;True;https://www.zonaprop.com.ar/propiedades/clasificado/alclappa-4-amb-3-dorm-2-banos-reciclado-a-nuevo-balcon-59492302.html?n_src=Listado&n_pills=Encargado&n_pg=5&n_pos=18&n_search_id=c6c2b646-2fbf-41b5-933d-060b61caa1bf;;$ 1.300.000 $ 200.000 Expensas 67 m² tot. 4 amb. 3 dorm. 1 baño Del Barco Centenera 345 Primera Junta, Caballito 4 ambientes reciclado A nuevo con balcón Y vista abierta - piso 17 - caballito. excelente departamento de 4 ambientes con 3 dormitorios, ubicado en del barco centenera 345 - caballito. Torre de categoria con seguridad. A media cuadra de avda. Juan B alberdi, 2 cuadras de avda pedro goyena, 2 cuadras del subte A, fácil acceso A transporte público, bares Y restaurantes. La unidad se encuentra en un piso 17, con excelente luminosidad Y vista abierta, ubicada al contrafrente con balcón, brindando tranquilidad Y nada de ruido. Cuenta con: -amplio living comedor con salida al balcón. - balcón enrejado. - 3 dormitorios cómodos Y luminosos. - 1 baño completo con bañera. - 1 toilete. - cocina totalmente renovada. - lavadero independiente. - expensas $200. 000 aprox. - superficie 67 m2 aprox. Departamento totalmente reciclado A nuevo, incluyendo instalaciones, cañerias Y desagues. -se entrega con todas las luces instaladas. excelente distribución Y ambientes aprovechables. el edificio cuenta con 2 encargados (1 permanente), 3 ascensores, grupo electrógeno para funcionamiento de ascensores, seguridad mediante totem, ingreso electrónico visor, excelente mantenimiento general (recien pintado). Opcional: cochera disponible en el edificio (no incluida en el valor del alquiler) ideal para familias que buscan comodidad, excelente ubicación Y un departamento listo para entrar A vivir. Contactar
2026-07-12;5;59455932;2026-06-26;16;False;Publicado hace 18 días;2026-06-24;18.0;Caballito;Avenida Rivadavia 4900 Caballito, Capital Federal Corredor Responsable: Graciela Teramo cpi 3749 / cmcpsi 6789- Contacto: Graciela Teramo..;USD 1000;USD;590000.0;128;4;3;1;11719;False;True;False;False;False;False;False;https://www.zonaprop.com.ar/propiedades/clasificado/alclapin-alquiler-dpto.-4-ambientes-c-dep.-pque.-rivadavia-59455932.html?n_src=Listado&n_pills=Lavadero&n_pg=5&n_pos=19&n_search_id=c6c2b646-2fbf-41b5-933d-060b61caa1bf;;$ 1.500.000 $ 590.000 Expensas 128 m² tot. 4 amb. 3 dorm. 1 baño Avenida Rivadavia 4900 Caballito, Capital Federal Corredor Responsable: Graciela Teramo cpi 3749 / cmcpsi 6789- Contacto: Graciela Teramo.. Departamento de 128 m2 de 4 ambientes con dependencia de servicio, frente a Parque Rivadavia. La propiedad cuenta con amplio living-comedor, tres dormitorios, cocina comedor, dependencia de servicio, lavadero, baño completo y toilette. Balcón al frente con hermosa vista. a Parque Rivadavia. Privilegiada ubicación,, a media cuadra de Avda. Acoyte., al lado de la Galería París., a pasos del Subte A, líneas de colectivos. Condiciones. Contrato por 24 meses. mensuales $ 1. 500. 000. Un mes adelantado. U$S 1000 de depósito en garantía. Seguro de caución. Actualización trimestral por ipc. rau S. R. L. No ejerce el corretaje inmobiliario. El presente sitio web es una plataforma en donde cada oficina inmobiliaria independiente que contrata los servicios re/max puede publicar las propiedades a su cargo. Cada oficina es de propiedad y gestión independiente, por lo que rau S. R. L. No interviene en los datos de la publicación, en la operación inmobiliaria, ni en la confección y/o firma del boleto de compraventa y/o escritura y/o contrato de alquiler. En cumplimiento de las leyes vigentes que regulan el corretaje inmobiliario, Ley Nacional 25. 028, Ley 22. 802 de Lealtad Comercial, Ley 24. 240 de Defensa al Consumidor, las normas del Código Civil y Comercial de la Nación y Constitucionales, los agentes/gestores no ejercen el corretaje inmobiliario. Todas las operaciones inmobiliarias son objeto de intermediación y conclusión por parte del corredor público inmobiliario colegiado a cargo de la publicación, cuyos datos se exhiben en la presente. La presente publicación describe las características esenciales del inmueble, debiéndose consultar al corredor público inmobiliario responsable de la operación por la eventual actualización de las medidas, descripciones arquitectónicas y funcionales, valores de expensas, servicios, impuestos, precios y demás información, cuyos valores son aproximados. Para los casos de alquiler de vivienda, el monto máximo de comisión que se le puede requerir a los propietarios será el equivalente al cuatro con quince centésimos por ciento (4, 15%) del valor total del respectivo contrato. Se encuentra prohibido cobrar a los inquilinos que sean personas físicas comisiones inmobiliarias y gastos de gestoría de informes. El inmueble no es accesible para personas con discapacidades físicas. WhatsApp Contactar
2026-07-12;5;59285453;2026-06-23;19;False;Publicado hace 39 días;2026-06-03;39.0;Flores;Helguera 350 Flores Norte, Flores Gran;$ 900.000;ARS;120000.0;100;4;3;1;9000;False;False;False;False;False;False;True;https://www.zonaprop.com.ar/propiedades/clasificado/alclapin-departamento-helguera-y-avellaneda!-59285453.html?n_src=Listado&n_pills=Encargado&n_pg=5&n_pos=20&n_search_id=c6c2b646-2fbf-41b5-933d-060b61caa1bf;;$ 900.000 $ 120.000 Expensas 100 m² tot. 4 amb. 3 dorm. 1 baño Helguera 350 Flores Norte, Flores Gran departamento disponible al frente, con 4 amplios ambientes. Ubicado en el barrio de flores, departamento muy luminoso a gran precio. Cuenta con 4 ambientes, 3 habitaciones, living-comedor y una gran cocina con espacio para una meza y sillas. A metros de avenida Avellaneda, gran punto de facil acceso. WhatsApp Contactar
2026-07-12;5;50168343;2026-06-23;19;False;Publicado hace 279 días;2025-10-06;279.0;Caballito;ROSARIO 758 Caballito Norte, Caballito Semipiso,;$ 1.000.000;ARS;300000.0;91;4;3;2;10989;False;True;False;False;False;False;True;https://www.zonaprop.com.ar/propiedades/clasificado/alclapin-caballito:venta-o-alquiler-3-ambientes-c-dependencia-50168343.html?n_src=Listado&n_pills=Aire+acondicionado&n_pg=5&n_pos=21&n_search_id=c6c2b646-2fbf-41b5-933d-060b61caa1bf;;"$ 1.000.000 $ 300.000 Expensas 91 m² tot. 4 amb. 3 dorm. 2 baños ROSARIO 758 Caballito Norte, Caballito Semipiso, excelente dto muy luminoso, A mts de av rivadavia Y san jose de calasanz, al frente con balcon corrido, 3 baños, calefaccion central, muy confortable pleno centro comercial. Mat; 5370 cucicba. Contactar"
