fecha;pagina;id_aviso;fecha_primera_vista;dias_desde_primera_vista;nueva_publicacion;publicado_zonaprop_raw;fecha_publicacion_zonaprop;antiguedad_zonaprop_dias;barrio;direccion;precio_raw;moneda;expensas;m2;ambientes;dormitorios;banos;precio_m2;mascotas;balcon;cochera;terraza;pileta;parrilla;luminoso;url;imagen;texto
2026-07-12;3;59433333;2026-06-23;19;False;Publicado hace 21 días;2026-06-21;21.0;Caballito;Avenida Pedro Goyena 1400 Caballito, Capital Federal Corredor Responsable: Gimena Guido cpi 9619 cmcpdjlm 1103- Contacto: Rita D\'Angela. Descripción. alquiler semi piso 4 amb/o 3 con dep. En caballito. Se ingresa con llave presencia y luego código de seguridad. Amplio, luminoso y con balcón. Ubicado en un 4° semi piso contrafrente, con doble ingreso y ventilación cruzada, este;$ 1.600.000;ARS;183000.0;97;4;3;1;16495;False;True;False;False;False;False;True;https://www.zonaprop.com.ar/propiedades/clasificado/alclapin-alquiler-semi-piso-4-amb-o-3-con-dep-en-caballito-59433333.html?n_src=Listado&n_pills=Permite+mascotas&n_pg=3&n_pos=14;;$ 1.600.000 11% $ 183.000 Expensas 97 m² tot. 4 amb. 3 dorm. 1 baño Avenida Pedro Goyena 1400 Caballito, Capital Federal Corredor Responsable: Gimena Guido cpi 9619 cmcpdjlm 1103- Contacto: Rita D\'Angela. Descripción. alquiler semi piso 4 amb/o 3 con dep. En caballito. Se ingresa con llave presencia y luego código de seguridad. Amplio, luminoso y con balcón. Ubicado en un 4° semi piso contrafrente, con doble ingreso y ventilación cruzada, este departamento de 4 ambientes ó 3 con dependencia, ofrece excelentes condiciones de habitabilidad y confort. * Orientación: norte. * Distribución y ambientes: Living comedor amplio, con salida a balcón corrido, pisos de parquet plastificados en excelente estado y muy buena luminosidad. Cocina independiente, completa, con ventilación natural, alacenas y bajo mesadas, con conexión para lavarropas, incluye espacio para la heladera y Comedor/diario. * Dormitorio principal con salida al balcón, placard de piso a techo y excelente luz natural y A. A. Frío/Calor. * Dormitorio secundario con placard de piso a techo, y ventilador de techo. * El otro dormitorio y/o escritorio con baulera. Todos los dormitorios son amplios, luminosos y ventilados. * Baños. Un baño completo con bañera, y mampara, artefactos originales en perfecto funcionamiento. Un Toilette completo. * Balcón. Balcón corrido al contrafrente, con visuales despejadas. Ver video: clqyh7xqXuY. * Extras. Lugar de guardado distribuido en toda la vivienda. Muy buena luminosidad en toda la unidad. En planta baja posee un jardín de uso común. Hall de Entrada 1, 14 X 3, 24 = 3, 69 m² Comedor 2, 97 X 2, 88 = 8, 55 m² Living 3, 55 X 4, 04 = 14, 34 m² Living/Comedor 22, 90 m² Cocina 3, 11 X 2, 90 = 9, 02 m² Comedor Diario 1, 77 X 2, 02 = 3, 58 m² Pasillo/ Lavadero 1, 26 X 2, 66 = 3, 35 m² Toilette 1, 23 X 1, 29 = 1, 59 m² Dormitorio Principal 3, 07 X 3, 55 = 10, 90 m² Segundo Dormitorio 3, 08 X 3, 96 = 12, 20 m² Tercer Dormitorio 2, 15 X 1, 29 = 2, 77 m² Pasillo Interior 1, 32 X 2, 75 = 3, 63 m² Baño Principal 1, 60 X 2, 32 = 3, 71 m² Balcón 7, 53 m² Excelente ubicación sobre avenida Pedro Goyena (polo gastronómico) a una cuadra de Valle( con polo gastronómico también) frondosa de árboles, restaurantes, bares, acceso a transporte público, Subte A y avenidas. requisitos: Disponible a partir del 20 Abril del 2026. 1 mes de depósito. 1 mes de adelanto. Garantía propietaria caba o seguro de caución. Comprobación de ingresos. indexado trimestralmente. rau S. R. L. No ejerce el corretaje inmobiliario. El presente sitio web es una plataforma en donde cada oficina inmobiliaria independiente que contrata los servicios re/max puede publicar las propiedades a su cargo. Cada oficina es de propiedad y gestión independiente, por lo que rau S. R. L. No interviene en los datos de la publicación, en la operación inmobiliaria, ni en la confección y/o firma del boleto de compraventa y/o escritura y/o contrato de alquiler. En cumplimiento de las leyes vigentes que regulan el corretaje inmobiliario, Ley Nacional 25. 028, Ley 22. 802 de Lealtad Comercial, Ley 24. 240 de Defensa al Consumidor, las normas del Código Civil y Comercial de la Nación y Constitucionales, los agentes/gestores no ejercen el corretaje inmobiliario. Todas las operaciones inmobiliarias son objeto de intermediación y conclusión por parte del corredor público inmobiliario colegiado a cargo de la publicación, cuyos datos se exhiben en la presente. La presente publicación describe las características esenciales del inmueble, debiéndose consultar al corredor público inmobiliario responsable de la operación por la eventual actualización de las medidas, descripciones arquitectónicas y funcionales, valores de expensas, servicios, impuestos, precios y demás información, cuyos valores son aproximados. Para los casos de alquiler de vivienda, el monto máximo de comisión que se le puede requerir a los propietarios será el equivalente al cuatro con quince centésimos por ciento (4, 15%) del valor total del respectivo contrato. Se encuentra prohibido cobrar a los inquilinos que sean personas físicas comisiones inmobiliarias y gastos de gestoría de informes. El inmueble no es accesible para personas con discapacidades físicas. Contactar
2026-07-12;3;58395301;2026-06-23;19;False;Publicado hace 142 días;2026-02-20;142.0;Flores;Argerich 543 Flores Norte, Flores;$ 700.000;ARS;620000.0;121;4;3;2;5785;False;True;True;False;True;False;False;https://www.zonaprop.com.ar/propiedades/clasificado/alclapin-departamento-4-ambientes-con-dependencia-al-frente-con-58395301.html?n_src=Listado&n_pills=Lavadero&n_pg=3&n_pos=16;;"$ 700.000 $ 620.000 Expensas 121 m² tot. 4 amb. 3 dorm. 2 baños 1 coch. Argerich 543 Flores Norte, Flores Departamento de 4 ambientes con dependencia de servicio al frente con balcón y cochera cubierta, el mismo se lo describe de la siguiente manera: -Entrada por palier privado derivando directamente al living comedor de muy buen tamaño con pisos de mármol, medidas generosas y salida al balcón corrido de casi 7 metros de largo con vista al frente más una excelente luminosidad. -2da entrada por la dependencia de servicio con toilette bien apartado del resto del departamento, acceso hacia la cocina comedor de muy cómodo espacio ya que cuenta con lugar para mesa, heladera y tiene salida al lavadero independiente con pileta para lavado, gran ventanal con rejas de protección. -La cocina cuenta con muebles bajos ubicada sobre mesada de granito, doble bacha de acero inoxidable, alacena y tiene ingreso de muy buena luz natural. -Dormitorio principal con placard empotrado, pisos de parquet, vista al frente y baño en suite. -2do dormitorio cuenta con similares medidas, placard empotrado, pisos de parquet y vista al pulmón del edificio. -3er dormitorio chico con pisos de parquet y vista al lavadero del mismo, cuenta con buena luz natura. -La unidad ofrece un baño completo con bañera y 3 toilettes de servicio, ""uno de ellos con ducha"". -El departamento cuenta con cochera fija y cubierta. -Las condiciones de ingresos son las siguientes: - justificación de ingresos. -Garantía de Capital Federal o seguro de caucion. -El Edificio se lo destáca por su privilegiada ubicación, ofrece una gama de servicios ámplia y variada, más de veinte líneas de colectivos y la línea ""A"" de Subte facilitan el acceso desde cualquier punto de la ciudad. -Ofrece diferentes opciones como restaurantes, farmacias, supermercados, bancos, tiendas de ropa y galerías comerciales a solo 5 cuadras de la Avenida Rivadavia y a media de la Av. Avellaneda. WhatsApp Contactar"
2026-07-12;3;53215454;2026-07-02;10;False;Publicado hace 11 días;2026-07-01;11.0;Caballito;Guayaquil 282 Parque Rivadavia, Caballito Te presentamos este hermoso;$ 1.600.000;ARS;290000.0;84;4;3;1;19048;False;False;False;False;False;False;True;https://www.zonaprop.com.ar/propiedades/clasificado/alclappa-excelente-dpto-4-ambientes-parque-rivadavia-53215454.html?n_src=Listado&n_pills=Terraza&n_pg=3&n_pos=17;;$ 1.600.000 $ 290.000 Expensas 84 m² tot. 4 amb. 3 dorm. 1 baño Guayaquil 282 Parque Rivadavia, Caballito Te presentamos este hermoso departamento de 4 ambientes ubicado en la mejor zona del barrio. Los metros del departamento están excelentemente aprovechados!! Con tres amplias habitaciones y un luminoso living, ofrece el espacio perfecto para tu familia. Con un baño completo y un toilet, además de una cocina y comedor muy amplio, tendrás todo lo que necesitas para vivir cómodamente. Además, cuenta con un lavadero separado para mayor comodidad. Disfruta de la vista al frente y la conveniencia de estar a solo dos cuadras de Av. Rivadavia y una cuadra del emblemático Parque Rivadavia. ¡No dejes pasar esta oportunidad de hacer de este departamento tu nuevo hogar! Contáctanos hoy para más información. Contactar
2026-07-12;3;59523506;2026-07-02;10;False;Publicado hace 11 días;2026-07-01;11.0;Caballito;Avenida Díaz Vélez 5500 Caballito, Capital Federal Corredor Responsable: javier burgue diaz cpi 7777 / cmcpsi 6701- Contacto: Noelia Aldana Ritacco. Alquiler;$ 1.300.000;ARS;380000.0;85;4;3;1;15294;False;True;False;False;False;False;True;https://www.zonaprop.com.ar/propiedades/clasificado/alclapin-alquiler-depto.-de-4-ambientes-en-caballito-59523506.html?n_src=Listado&n_pills=Lavadero&n_pg=3&n_pos=18;;$ 1.300.000 $ 380.000 Expensas 85 m² tot. 4 amb. 3 dorm. 1 baño Avenida Díaz Vélez 5500 Caballito, Capital Federal Corredor Responsable: javier burgue diaz cpi 7777 / cmcpsi 6701- Contacto: Noelia Aldana Ritacco. Alquiler departamento 4 ambientes con balcón corrido al frente en Caballito. Al ingresar, encontramos un amplio living-comedor con pisos de madera, que se destaca por su gran entrada de luz natural y salida a un balcón corrido al frente, ideal para disfrutar del aire libre. Cuenta con toilette de recepción. La cocina es independiente, de generosas dimensiones y con doble circulación, equipada con alacenas y muebles bajo mesada, posee comedor diario, ventilación al exterior y acceso a un lavadero independiente. Dispone de tres habitaciones amplias y luminosas, todas con placares de gran capacidad de guardado. El departamento se completa con un baño completo en muy buen estado. La unidad se entrega completamente pintada. No se aceptan mascotas. - Contrato de 24 meses. - 1 mes de adelanto. - 1 mes de depósito. Se requiere: - Demostración de ingresos. - Seguro de caución. Excelente ubicación a metros de Av. Honorio Pueyrredón, a 100 metros de la Av. Ángel Gallardo, a 500 metros del Parque Centenario, cercano a líneas de colectivos, subtes A y B, hospitales, farmacias, colegios, restaurantes, comercios, supermercados. Rau S. R. L. No ejerce el corretaje inmobiliario. El presente sitio web es una plataforma en donde cada oficina inmobiliaria independiente que contrata los servicios re/max puede publicar las propiedades a su cargo. Cada oficina es de propiedad y gestión independiente, por lo que rau S. R. L. No interviene en los datos de la publicación, en la operación inmobiliaria, ni en la confección y/o firma del boleto de compraventa y/o escritura y/o contrato de alquiler. En cumplimiento de las leyes vigentes que regulan el corretaje inmobiliario, Ley Nacional 25. 028, Ley 22. 802 de Lealtad Comercial, Ley 24. 240 de Defensa al Consumidor, las normas del Código Civil y Comercial de la Nación y Constitucionales, los agentes/gestores no ejercen el corretaje inmobiliario. Todas las operaciones inmobiliarias son objeto de intermediación y conclusión por parte del corredor público inmobiliario colegiado a cargo de la publicación, cuyos datos se exhiben en la presente. La presente publicación describe las características esenciales del inmueble, debiéndose consultar al corredor público inmobiliario responsable de la operación por la eventual actualización de las medidas, descripciones arquitectónicas y funcionales, valores de expensas, servicios, impuestos, precios y demás información, cuyos valores son aproximados. Para los casos de alquiler de vivienda, el monto máximo de comisión que se le puede requerir a los propietarios será el equivalente al cuatro con quince centésimos por ciento (4, 15%) del valor total del respectivo contrato. Se encuentra prohibido cobrar a los inquilinos que sean personas físicas comisiones inmobiliarias y gastos de gestoría de informes. El inmueble es accesible para personas con discapacidades físicas. Contactar
2026-07-12;3;59550189;2026-07-06;6;False;Publicado hace 7 días;2026-07-05;7.0;Caballito;Rosario 841. Entre San josé de calasanz y Del barco centenera Caballito, Capital Federal Alquiler de;$ 1.300.000;ARS;200000.0;71;4;3;1;18310;True;True;False;False;False;False;False;https://www.zonaprop.com.ar/propiedades/clasificado/alclapin-alquiler-departamento-4-ambientes-rosario-al-800-59550189.html?n_src=Listado&n_pills=Luminoso&n_pg=3&n_pos=21;;"$ 1.300.000 $ 200.000 Expensas 71 m² tot. 4 amb. 3 dorm. 1 baño Rosario 841. Entre San josé de calasanz y Del barco centenera Caballito, Capital Federal Alquiler de Departamento 4 Ambientes en Caballito, Capital Federal. 4 ambientes al frente con balcón ubicado sobre la calle Rosario 841, en pleno Barrio de Caballito. La propiedad se distribuye en un amplio living comedor con salida al balcón, cocina independiente, tres dormitorios, un baño completo y espacios funcionales que permiten adaptar uno de los ambientes como escritorio o espacio de trabajo. Cocina equipada con alacenas y muebles bajomesada. Lavadero incorporado. 2 dormitorios con vista hacia el contrafrente (Av. Rivadavia). El 3er. Dormitorio con vista hacia la calle Rosario. Excelente ubicación situado a metros del subte línea ""A"" Estación Primera Junta. Asimismo, con conectividad a múltiples líneas de colectivo tanto sobre la calle Rosario como por Av. Rivadavia. Cercanía a área comercial, comercios, colegios y espacios verdes y de recreación como Parque Rivadavia y Parque Centenario, entre otros. El edificio cuenta con 3 ascensores, encargado y acceso para personas con movilidad reducida. Permite mascotas. Alemany propiedades // C. U. C. I.. B. A. Mat.: 2878 - cuit: Ver datos-8 // Aviso Legal.: Se deja constancia que toda la información expuesta, medidas, valor de expensas, impuestos y servicios de este inmueble son aproximados y pueden no estar actualizados al momento de visualización del presente aviso pudiendo surgir diferencias con respecto a las que surgen de las facturas, títulos y planos legales del inmueble, no comprometiendo contractualmente a nuestra empresa, las que deberán ser ratificados con la documentación pertinente proporcionada por el propietario previo a la realización de cualquier operación, requiriendo por sí o sus profesionales las copias necesarias de la documentación que corresponda. Fotografías no vinculantes ni contractuales. Venta supeditada al cumplimiento por parte del propietario de los requisitos de la resolución general Nº 2371 de la afip (pedido de coti). xintel(any-any-603) WhatsApp Contactar"
2026-07-12;3;59144888;2026-06-23;19;False;Publicado hace 55 días;2026-05-18;55.0;Flores;R.l. Falcon al 1900 Flores, Capital Federal Semipiso 4 amb al frente con balcon/ cochera fija cubierta/ luminoso/;$ 1.200.000;ARS;400000.0;76;4;3;1;15789;False;True;True;False;False;False;True;https://www.zonaprop.com.ar/propiedades/clasificado/alclapin-departamento-en-flores-59144888.html?n_src=Listado&n_pills=Luminoso&n_pg=3&n_pos=22;;"$ 1.200.000 $ 400.000 Expensas 76 m² tot. 4 amb. 3 dorm. 1 baño 1 coch. R.l. Falcon al 1900 Flores, Capital Federal Semipiso 4 amb al frente con balcon/ cochera fija cubierta/ luminoso/ muy buena ubicacion / lavadero independiente / apto finaerhall/entr: 1. 20 X 1liv/com: 5. 90 X 2. 90 C/salida al balconbalcon corrido: 7. 70 X 1toilette: 1hall/distr: 3. 20 X 0. 80coc/com: 3. 70 X 2. 20 + lavadero independientedorm: 2. 80 X 2. 25 C/placdorm: 2. 90 X 2. 80 C/placbño/compl: C/ vanitory Y bañeradorm: 2. 80 X 2. 40 C/placcant. pisos: 9deptos X piso: 2ascensores: 1observaciones: aysa incluido en expensas/ semipiso luminoso con balcon/ cochera fija cubierta/ baño Y toilette/ entre av. Carabobo Y lautaro/ calefaccion X radiadores/ agua caliente X caldera/ 1. C av. Rivadavia/ 1. C estacion carabobo subte &quot;A&quot;/ 1. C av. J. B. Alberdi/ 3. C av. Directorio/ Colectivos: 1, 2, 5, 8, 25, 36, 44, 49, 53, 55, 76, 85, 86, 88, 96, 104, 113, 126, 132, 133, 134, 136, 141, 163, 180leonardo jose pignataro - Corredor InmobiliarioMat. 813 cucicba WhatsApp Contactar"
2026-07-12;3;58369578;2026-06-23;19;False;Publicado hace 145 días;2026-02-17;145.0;Floresta;Moron 4114 Floresta, Capital Federal Morón 4114 entre Gualeguaychu y Sanabria. fines comerciales unicamente. no apto para vivienda.;USD 1.000;USD;;225;4;3;2;6667;False;True;True;True;False;False;False;https://www.zonaprop.com.ar/propiedades/clasificado/alclcain-no-dan-puntada-sin-nudo.-solo-fines-comerciales-58369578.html?n_src=Listado&n_pills=Lavadero&n_pg=3&n_pos=24;;USD 1.000 225 m² tot. 4 amb. 3 dorm. 2 baños 1 coch. Moron 4114 Floresta, Capital Federal Morón 4114 entre Gualeguaychu y Sanabria. fines comerciales unicamente. no apto para vivienda. alquiler u$s 1. 000 mensuales. ajustes A convenir. fundamental. garantia propietaria en lo posible familiar directo de quien alquile con inmueble en caba e ingresos demostrables reales. contrato 24 meses. Inmejorable ubicación en el corazón de floresta muy cerquita a próspero centro textil. a una cuadrita Avda. Gaona 4600. a 150 metros Avda. Segurola al 600. a doscientos pasos Av. Avellaneda al 4000 y a no más de cuatro cuadritas de la mítica Plaza velez sarsfield donde hay desde la Estación Saludable del gcba hasta la Iglesia de la candelaria e importante supermercado. opinion y analisis de Inmobiliaria ricardi. se trata de una hermosa casa en lote propio - toda en bajos - reciclada toda pero toda A nuevo - no quedo nada de la casa primitiva, está im-pe-ca- ble cuidadita y en condiciones, si bien conserva la distribución original tipo chorizo fue íntegramente remodelada a nueva, los actuales dueños la han hecho a nuevo - literal - edificando un consultorio que puede ser perfectamente un eventual tercer dormitorio, o escritorio, con un recibidor y-o con sala de espera en la parte delantera de la finca, una regia cochera cubierta y dos dormitorios uno de ellos con vestidor y otro con un placar divino de pared a pared y de piso a techo, una regia cocina y comedor de diario contiguo, un patio interior divino con cerramiento corredizo transformado en otro ambiente más tipo estar, además de un soleado patio trasero donde no falta un ambiente tipo quincho y acceso a la terraza con otra habitación auxiliar, todo pipiqq como para mudarse sin hacer arreglo alguno. Los actuales propietarios - de la mano de su hijo - han reciclado con esmero, dedicación y buen gusto un reciclado integral y cuidadoso de todos los ambientes dando como resultado una casa muy cómoda y con la ventaja de tener exteriormente una discreción total que la hace pasar desapercibida totalmente a la casa. - lote 8, 66x25, 98 son 225 m2 de tierra y tiene edificados 174 m2 cubiertos orientada al norte - con un sol divino. según codigo de edificacion. Unidades de Sustentabilidad de Altura Baja 1. Son las áreas de la ciudad de alturas menores, adecuadas para el desarrollo principalmente de actividades residenciales. Altura Máxima: 9 metros. Altura de Planta Baja mínima: 2, 60 metros, la cual no podrá tener una cota inferior a cero en los primeros 8 metros de fondo contados desde la Línea Oficial con excepción de rampas vehiculares y escaleras. La altura podrá variar si: existe algún edificio lindero Catalogado (Artículo 3. 6 Anexo ii) o la altura del edificio lindero es mayor a la de la Unidad de Edificabilidad (Artículo 6. 5. 5). Área de Media Mixtura de Usos del Suelo 2. Corresponde a las áreas y corredores destinados a residencia, servicios y comercios de mediana afluencia. Ambientes: Baño completo (2. 43x1. 27) Cochera cubierta (2. 5x5. 64) Cocina comedor (4. 37x4. 07) Dormitorio (4. 02x2. 42) Dormitorio con placard (3. 84x3) Hall de entrada (1. 85x3. 37) Patio descubierto (2. 5x9. 39) Servicios: Electricidad, Pavimento, Cloacas, Gas, Agua Corriente. Otros Servicios: Lavadero, Reciclado, Terraza. letra chica ( se recomienda leer) La venta se realiza de acuerdo a superficies y constancias obrantes en los títulos de propiedad y-o planos del inmueble. El presente plano grafico que se reproduce en esta publicación no es preciso y es dibujado por la Inmobiliaria ricardi para la comercialización del inmueble. Los metros cuadrados y medidas aquí indicadas son aproximadas y para uso interno de la Inmobiliaria ricardi quien declina toda su responsabilidad por su eventual no coincidencia con las del título de propiedad y-o plano/s aprobado/s y-o por la simple inexistencia de los mismos. - La Inmobiliaria ricardi no garantiza que el inmueble cumpla con el certificado de conservación de fachadas y balcones (Ley 257) tampoco efectúa el estudio de títulos, ni analiza los alcances del Código de edificación y no será responsable por los vicios ocultos o redhibitorios que competen a quien corresponda. Advertimos al adquirente que las instalaciones eléctricas, de gas natural y-o sanitarias pueden no solo no tener un correcto y adecuado funcionamiento técnico sino que además puede no cumplir con las exigencias actuales de metrogas- edesur- edenor - siendo a cargo del adquirente que implique su puesta en valor y-o funcionamiento. El valor de las expensas e impuestos quedan sujetos a cambios y-o ajustes. El precio y condiciones de venta pueden ser modificados sin previo aviso. Las fotos e imágenes son de carácter no contractual y se exhiben a los fines publicitarios y son meramente ilustrativas. El inmueble publicitado se encuentra está sujeto a disponibilidad y la Inmobiliaria ricardi actúa como comercializador del inmueble., siendo bajo responsabilidad del propietario la tramitación del coti. Comercializa Inmobiliaria ricardi. atencion virtual los 365 días del año. ( Incluso sábados domingos y feriados) Siempre de 10 a 13 y 16 a 20 horas. Nos puede pedir que le enviemos por correo electrónico y-o por Whatsapp fotos plano de relevamiento con medidas y video del inmueble. No somos los primeros. no somos los mejores. no somos los unicos. somos Inmobiliaria ricardi. cucicba Matricula 79. compartimos el 50% de los honorarios del comprador con todos los matriculados de cucicba. ladrillos. La inversión más segura y confiable. Ayer hoy y siempre. WhatsApp Contactar
